13:56:16.436639 802.1d config 8001.00:09:7c:f6:4b:00.802d root 8000.00:0b:ac:14:37:40 pathcost 19 age 1 max 20 hello 2 fdelay 15 
13:56:16.549076 IP 61.129.59.80.6661 > 192.168.27.100.1140: . ack 429755985 win 5840 (DF)
13:56:16.560021 IP 61.129.59.80.6661 > 192.168.27.100.1140: P 0:1022(1022) ack 1 win 5840 (DF)
13:56:16.560322 IP 61.129.59.80.6661 > 192.168.27.100.1140: . 1022:2482(1460) ack 1 win 5840 (DF)
13:56:16.561097 IP 192.168.27.100.1140 > 61.129.59.80.6661: . ack 2482 win 65535 (DF)
13:56:16.713183 IP 192.168.22.105.4824 > 192.168.31.255.39213: udp 824
13:56:16.756641 2:1:0:0:0:0 ff:ff:ff:ff:ff:ff 886f 1510: 
			 bf01 dec0 0302 0000 0100 0000 0000 0000
			 0000 0000 0000 0000 0300 0200 a859 5e40
			 0000 0000 0000 3010 0000 0000 00f0 ff6f
			 0000 0000 0000 0000 0000 0000 0000 0000
			 0000 0000 0000 0000 0000 0000 0000 0000
			 0000
13:56:16.781480 arp who-has 192.168.27.6 tell 192.168.18.10
13:56:16.859744 arp who-has 192.168.18.1 tell 192.168.20.141
13:56:17.256681 2:1:0:0:0:0 ff:ff:ff:ff:ff:ff 886f 1510: 
			 bf01 dec0 0302 0000 0100 0000 0000 0000
			 0000 0000 0000 0000 0300 0200 a859 5e40
			 0000 0000 0000 3010 0000 0000 00f0 ff6f
			 0000 0000 0000 0000 0000 0000 0000 0000
			 0000 0000 0000 0000 0000 0000 0000 0000
			 0000
13:56:17.377106 IP 61.129.59.80.6661 > 192.168.27.100.1140: P 2482:3605(1123) ack 1 win 5840 (DF)
13:56:17.492397 IP 192.168.27.100.1140 > 61.129.59.80.6661: . ack 3605 win 64412 (DF)
13:56:17.509685 IP 192.168.27.100.1140 > 61.129.59.80.6661: P 1:4(3) ack 3605 win 64412 (DF)
13:56:17.524233 arp who-has 192.168.20.33 tell 192.168.20.175
13:56:17.524590 arp who-has 192.168.20.175 tell 192.168.20.33
13:56:17.681571 arp who-has 192.168.20.23 tell 192.168.18.10
13:56:17.756676 2:1:0:0:0:0 ff:ff:ff:ff:ff:ff 886f 1510: 
			 bf01 dec0 0302 0000 0100 0000 0000 0000
			 0000 0000 0000 0000 0300 0200 a859 5e40
			 0000 0000 0000 3010 0000 0000 00f0 ff6f
			 0000 0000 0000 0000 0000 0000 0000 0000
			 0000 0000 0000 0000 0000 0000 0000 0000
			 0000
13:56:17.880149 IP 192.168.20.31.138 > 192.168.31.255.138: udp 201
13:56:18.261249 2:1:0:0:0:0 ff:ff:ff:ff:ff:ff 886f 1510: 
			 bf01 dec0 0302 0000 0100 0000 0000 0000
			 0000 0000 0000 0000 0300 0200 a859 5e40
			 0000 0000 0000 3010 0000 0000 00f0 ff6f
			 0000 0000 0000 0000 0000 0000 0000 0000
			 0000 0000 0000 0000 0000 0000 0000 0000
			 0000
13:56:18.295926 IP 61.129.59.80.6661 > 192.168.27.100.1140: P 3605:3814(209) ack 1 win 5840 (DF)
13:56:18.296765 IP 192.168.27.100.1140 > 61.129.59.80.6661: P 4:39(35) ack 3814 win 64203 (DF)
13:56:18.339170 IP 61.129.59.80.6661 > 192.168.27.100.1140: . ack 4 win 5840 (DF)
13:56:18.362414 IP 61.129.59.80.6661 > 192.168.27.100.1140: . 3814:5274(1460) ack 4 win 5840 (DF)
13:56:18.426699 802.1d config 8001.00:09:7c:f6:4b:00.802d root 8000.00:0b:ac:14:37:40 pathcost 19 age 1 max 20 hello 2 fdelay 15 
13:56:18.494022 IP 192.168.27.100.1140 > 61.129.59.80.6661: . ack 5274 win 65535 (DF)
13:56:18.586462 IP 192.168.22.105.4825 > 192.168.31.255.39213: udp 268
13:56:18.586686 IP 192.168.22.105.4826 > 192.168.31.255.39213: udp 112
13:56:18.721966 arp who-has 192.168.18.4 tell 192.168.20.38
13:56:18.756616 2:1:0:0:0:0 ff:ff:ff:ff:ff:ff 886f 1510: 
			 bf01 dec0 0302 0000 0100 0000 0000 0000
			 0000 0000 0000 0000 0300 0200 a859 5e40
			 0000 0000 0000 3010 0000 0000 00f0 ff6f
			 0000 0000 0000 0000 0000 0000 0000 0000
			 0000 0000 0000 0000 0000 0000 0000 0000
			 0000
13:56:18.816476 IP 61.129.59.80.6661 > 192.168.27.100.1140: . 5274:6734(1460) ack 4 win 5840 (DF)
13:56:18.819059 IP 192.168.27.100.1140 > 61.129.59.80.6661: P 39:284(245) ack 6734 win 65535 (DF)
13:56:18.936699 IP 61.152.146.60.80 > 192.168.27.100.1138: F 1208965335:1208965335(0) ack 426837151 win 5840 (DF)
13:56:18.939318 IP 192.168.27.100.1138 > 61.152.146.60.80: . ack 1 win 65201 (DF)
13:56:18.994574 arp who-has 192.168.18.1 tell 192.168.20.61
13:56:19.076729 IP 61.129.59.80.6661 > 192.168.27.100.1140: P 6734:7385(651) ack 39 win 5840 (DF)
13:56:19.098298 arp who-has 192.168.18.1 tell 192.168.20.200
13:56:19.195399 IP 192.168.27.100.1140 > 61.129.59.80.6661: . ack 7385 win 64884 (DF)
13:56:19.256620 2:1:0:0:0:0 ff:ff:ff:ff:ff:ff 886f 1510: 
			 bf01 dec0 0302 0000 0100 0000 0000 0000
			 0000 0000 0000 0000 0300 0200 a859 5e40
			 0000 0000 0000 3010 0000 0000 00f0 ff6f
			 0000 0000 0000 0000 0000 0000 0000 0000
			 0000 0000 0000 0000 0000 0000 0000 0000
			 0000
13:56:19.564618 IP 192.168.18.66.3052 > 192.168.31.255.3052: udp 493
13:56:19.603272 IP 61.129.59.80.6661 > 192.168.27.100.1140: . 7385:8845(1460) ack 39 win 5840 (DF)
13:56:19.682153 IP 61.129.59.80.6661 > 192.168.27.100.1140: . ack 284 win 6432 (DF)
13:56:19.763891 2:1:0:0:0:0 ff:ff:ff:ff:ff:ff 886f 1510: 
			 bf01 dec0 0302 0000 0100 0000 0000 0000
			 0000 0000 0000 0000 0300 0200 a859 5e40
			 0000 0000 0000 3010 0000 0000 00f0 ff6f
			 0000 0000 0000 0000 0000 0000 0000 0000
			 0000 0000 0000 0000 0000 0000 0000 0000
			 0000
13:56:19.797792 IP 192.168.27.100.1140 > 61.129.59.80.6661: . ack 8845 win 65535 (DF)
13:56:19.838104 IP 192.168.22.105.4827 > 192.168.31.255.39213: udp 824
13:56:19.964627 IP 61.129.59.80.6661 > 192.168.27.100.1140: P 8845:10244(1399) ack 284 win 6432 (DF)
13:56:20.096073 IP 192.168.27.100.1140 > 61.129.59.80.6661: . ack 10244 win 64136 (DF)
13:56:20.100395 IP 192.168.26.246.138 > 192.168.31.255.138: udp 201
13:56:20.256517 2:1:0:0:0:0 ff:ff:ff:ff:ff:ff 886f 1510: 
			 bf01 dec0 0302 0000 0100 0000 0000 0000
			 0000 0000 0000 0000 0300 0200 a859 5e40
			 0000 0000 0000 3010 0000 0000 00f0 ff6f
			 0000 0000 0000 0000 0000 0000 0000 0000
			 0000 0000 0000 0000 0000 0000 0000 0000
			 0000
13:56:20.271978 (NOV-802.2) 00000001.00:0a:eb:28:df:88.0455 > 00000000.ff:ff:ff:ff:ff:ff.0455: ipx-netbios 50
13:56:20.272341 (NOV-802.2) 00000001.00:0a:eb:28:df:88.0553 > 00000000.ff:ff:ff:ff:ff:ff.0553: ipx-nwlink-dgm 187
13:56:20.272541 IP 192.168.20.129.138 > 192.168.31.255.138: udp 201
13:56:20.426388 802.1d config 8001.00:09:7c:f6:4b:00.802d root 8000.00:0b:ac:14:37:40 pathcost 19 age 1 max 20 hello 2 fdelay 15 
13:56:20.596567 IP 61.129.59.80.6661 > 192.168.27.100.1140: . 10244:11704(1460) ack 284 win 6432 (DF)
13:56:20.670159 arp who-has 192.168.20.203 tell 192.168.18.10
13:56:20.670318 IP 192.168.18.10.53 > 192.168.20.203.1026:  9645* 1/0/0 (66)
13:56:20.670906 arp who-has 192.168.20.203 tell 192.168.20.1
13:56:20.671530 arp who-has 192.168.18.1 tell 192.168.20.1
13:56:20.756528 2:1:0:0:0:0 ff:ff:ff:ff:ff:ff 886f 1510: 
			 bf01 dec0 0302 0000 0100 0000 0000 0000
			 0000 0000 0000 0000 0300 0200 a859 5e40
			 0000 0000 0000 3010 0000 0000 00f0 ff6f
			 0000 0000 0000 0000 0000 0000 0000 0000
			 0000 0000 0000 0000 0000 0000 0000 0000
			 0000
13:56:20.798601 IP 192.168.27.100.1140 > 61.129.59.80.6661: . ack 11704 win 65535 (DF)
13:56:20.865213 IP 61.129.59.80.6661 > 192.168.27.100.1140: P 11704:12513(809) ack 284 win 6432 (DF)
13:56:20.997455 IP 192.168.27.100.1140 > 61.129.59.80.6661: . ack 12513 win 64726 (DF)
13:56:21.086496 IP 192.168.22.105.4828 > 192.168.31.255.39213: udp 268
13:56:21.087017 IP 192.168.22.105.4829 > 192.168.31.255.39213: udp 112
13:56:21.089006 IP 192.168.27.100.1140 > 61.129.59.80.6661: P 284:295(11) ack 12513 win 64726 (DF)
13:56:21.140703 IP 192.168.27.100.1140 > 61.129.59.80.6661: P 295:1755(1460) ack 12513 win 64726 (DF)
13:56:21.140925 IP 192.168.27.100.1140 > 61.129.59.80.6661: P 1755:1765(10) ack 12513 win 64726 (DF)
13:56:21.170944 IP 192.168.22.210.137 > 192.168.31.255.137: udp 50
13:56:21.180235 arp who-has 192.168.22.1 tell 192.168.20.1
13:56:21.256535 2:1:0:0:0:0 ff:ff:ff:ff:ff:ff 886f 1510: 
			 bf01 dec0 0302 0000 0100 0000 0000 0000
			 0000 0000 0000 0000 0300 0200 a859 5e40
			 0000 0000 0000 3010 0000 0000 00f0 ff6f
			 0000 0000 0000 0000 0000 0000 0000 0000
			 0000 0000 0000 0000 0000 0000 0000 0000
			 0000
13:56:21.304262 (NOV-802.2) 00000001.00:e0:4c:43:0c:96.4008 > 00000001.ff:ff:ff:ff:ff:ff.0452:ipx-sap-resp[|ipx 64]
13:56:21.427627 IP 192.168.26.115.137 > 192.168.31.255.137: udp 68
13:56:21.484603 IP 61.129.59.80.6661 > 192.168.27.100.1140: . 12513:13973(1460) ack 284 win 6432 (DF)
13:56:21.487965 IP 192.168.27.100.1140 > 61.129.59.80.6661: P 1765:2125(360) ack 13973 win 65535 (DF)
13:56:21.514078 (NOV-802.2) 00000001.00:0d:60:77:24:50.0455 > 00000000.ff:ff:ff:ff:ff:ff.0455: ipx-netbios 50
13:56:21.514127 (NOV-802.2) 00000001.00:0d:60:77:24:50.0553 > 00000000.ff:ff:ff:ff:ff:ff.0553: ipx-nwlink-dgm 195
13:56:21.514150 IP 192.168.20.130.138 > 192.168.31.255.138: udp 209
13:56:21.746314 IP 61.129.59.80.6661 > 192.168.27.100.1140: P 13973:14775(802) ack 284 win 6432 (DF)
13:56:21.747438 IP 192.168.27.100.1140 > 61.129.59.80.6661: P 2125:2140(15) ack 14775 win 64733 (DF)
13:56:21.756543 2:1:0:0:0:0 ff:ff:ff:ff:ff:ff 886f 1510: 
			 bf01 dec0 0302 0000 0100 0000 0000 0000
			 0000 0000 0000 0000 0300 0200 a859 5e40
			 0000 0000 0000 3010 0000 0000 00f0 ff6f
			 0000 0000 0000 0000 0000 0000 0000 0000
			 0000 0000 0000 0000 0000 0000 0000 0000
			 0000
13:56:21.813044 arp who-has 192.168.20.5 tell 192.168.20.105
13:56:21.851335 IP 61.129.59.80.6661 > 192.168.27.100.1140: . ack 295 win 6432 (DF)
13:56:21.853066 IP 192.168.26.115.137 > 192.168.31.255.137: udp 68
13:56:21.867291 IP 192.168.27.161.138 > 192.168.31.255.138: udp 201
13:56:21.867439 IP 211.97.50.114.138 > 211.97.50.127.138: udp 201
13:56:21.887357 IP 61.129.59.80.6661 > 192.168.27.100.1140: . ack 1765 win 8760 (DF)
13:56:21.895220 IP 61.129.59.80.6661 > 192.168.27.100.1140: . ack 295 win 6432 <nop,nop,sack sack 1 {1755:1765} > (DF)
13:56:21.901762 IP 61.129.59.80.6661 > 192.168.27.100.1140: . 14775:16235(1460) ack 1765 win 8760 (DF)
13:56:21.902570 IP 61.129.59.80.6661 > 192.168.27.100.1140: . 16235:17695(1460) ack 1765 win 8760 (DF)
13:56:21.904332 IP 192.168.27.100.1140 > 61.129.59.80.6661: . ack 17695 win 65535 (DF)
13:56:22.058070 IP 192.168.20.92.138 > 192.168.31.255.138: udp 201
13:56:22.166938 IP 192.168.26.115.137 > 192.168.31.255.137: udp 68
13:56:22.256490 2:1:0:0:0:0 ff:ff:ff:ff:ff:ff 886f 1510: 
			 bf01 dec0 0302 0000 0100 0000 0000 0000
			 0000 0000 0000 0000 0300 0200 a859 5e40
			 0000 0000 0000 3010 0000 0000 00f0 ff6f
			 0000 0000 0000 0000 0000 0000 0000 0000
			 0000 0000 0000 0000 0000 0000 0000 0000
			 0000
13:56:22.268813 IP 61.129.59.80.6661 > 192.168.27.100.1140: . 17695:19155(1460) ack 2125 win 8760 (DF)
13:56:22.268977 IP 61.129.59.80.6661 > 192.168.27.100.1140: . 19155:20615(1460) ack 2125 win 8760 (DF)
13:56:22.271702 IP 192.168.27.100.1140 > 61.129.59.80.6661: . ack 19155 win 65535 (DF)
13:56:22.271799 IP 192.168.27.100.1140 > 61.129.59.80.6661: P 2140:2665(525) ack 19155 win 65535 (DF)
13:56:22.399408 IP 192.168.27.100.1140 > 61.129.59.80.6661: . ack 20615 win 65535 (DF)
13:56:22.428992 802.1d config 8001.00:09:7c:f6:4b:00.802d root 8000.00:0b:ac:14:37:40 pathcost 19 age 1 max 20 hello 2 fdelay 15 
13:56:22.526396 IP 61.129.59.80.6661 > 192.168.27.100.1140: . 20615:22075(1460) ack 2140 win 8760 (DF)
13:56:22.527616 IP 61.129.59.80.6661 > 192.168.27.100.1140: . 22075:23535(1460) ack 2140 win 8760 (DF)
13:56:22.527999 IP 192.168.27.100.1140 > 61.129.59.80.6661: P 2665:2800(135) ack 22075 win 65535 (DF)
13:56:22.528270 IP 192.168.27.100.1140 > 61.129.59.80.6661: . ack 23535 win 65535 (DF)
13:56:22.597574 IP 192.168.26.115.137 > 192.168.31.255.137: udp 68
13:56:22.692849 IP 61.129.59.80.6661 > 192.168.27.100.1140: . 23535:24995(1460) ack 2140 win 8760 (DF)
13:56:22.692973 IP 61.129.59.80.6661 > 192.168.27.100.1140: P 24995:25271(276) ack 2140 win 8760 (DF)
13:56:22.694064 IP 192.168.27.100.1140 > 61.129.59.80.6661: . ack 25271 win 65535 (DF)
13:56:22.756456 2:1:0:0:0:0 ff:ff:ff:ff:ff:ff 886f 1510: 
			 bf01 dec0 0302 0000 0100 0000 0000 0000
			 0000 0000 0000 0000 0300 0200 a859 5e40
			 0000 0000 0000 3010 0000 0000 00f0 ff6f
			 0000 0000 0000 0000 0000 0000 0000 0000
			 0000 0000 0000 0000 0000 0000 0000 0000
			 0000
13:56:22.917960 IP 192.168.26.115.137 > 192.168.31.255.137: udp 68
13:56:22.962959 IP 192.168.22.105.4830 > 192.168.31.255.39213: udp 824
13:56:23.021893 arp who-has 192.168.22.25 tell 192.168.22.138
13:56:23.021968 arp who-has 192.168.22.34 tell 192.168.22.138
13:56:23.099269 IP 61.129.59.80.6661 > 192.168.27.100.1140: . 25271:26731(1460) ack 2665 win 11680 (DF)
13:56:23.102043 IP 61.129.59.80.6661 > 192.168.27.100.1140: . 26731:28191(1460) ack 2665 win 11680 (DF)
13:56:23.103202 IP 192.168.27.100.1140 > 61.129.59.80.6661: . ack 28191 win 65535 (DF)
13:56:23.256473 2:1:0:0:0:0 ff:ff:ff:ff:ff:ff 886f 1510: 
			 bf01 dec0 0302 0000 0100 0000 0000 0000
			 0000 0000 0000 0000 0300 0200 a859 5e40
			 0000 0000 0000 3010 0000 0000 00f0 ff6f
			 0000 0000 0000 0000 0000 0000 0000 0000
			 0000 0000 0000 0000 0000 0000 0000 0000
			 0000
13:56:23.333501 IP 192.168.27.160.138 > 192.168.31.255.138: udp 201
13:56:23.333634 IP 192.168.27.46.138 > 192.168.31.255.138: udp 201
13:56:23.348602 IP 192.168.26.115.137 > 192.168.31.255.137: udp 68
13:56:23.349809 IP 61.129.59.80.6661 > 192.168.27.100.1140: . ack 2800 win 11680 (DF)
13:56:23.379881 IP 61.129.59.80.6661 > 192.168.27.100.1140: . 28191:29651(1460) ack 2800 win 11680 (DF)
13:56:23.380891 IP 192.168.27.100.1140 > 61.129.59.80.6661: . ack 29651 win 65535 (DF)
13:56:23.435217 0:c:29:45:67:bd > 3:0:0:0:0:1 sap f0 ui/C len=44
13:56:23.470603 IP 61.129.59.80.6661 > 192.168.27.100.1140: P 29651:30074(423) ack 2800 win 11680 (DF)
13:56:23.541173 IP 192.168.20.109.138 > 192.168.31.255.138: udp 201
13:56:23.580596 (NOV-802.2) 00000001.00:0a:eb:13:2e:c9.0455 > 00000000.ff:ff:ff:ff:ff:ff.0455: ipx-netbios 50
13:56:23.580644 (NOV-802.2) 00000001.00:0a:eb:13:2e:c9.0553 > 00000000.ff:ff:ff:ff:ff:ff.0553: ipx-nwlink-dgm 187
13:56:23.580665 IP 192.168.20.46.138 > 192.168.31.255.138: udp 201
13:56:23.586209 IP 192.168.22.105.4831 > 192.168.31.255.39213: udp 268
13:56:23.586451 IP 192.168.22.105.4832 > 192.168.31.255.39213: udp 112
13:56:23.601252 IP 192.168.27.100.1140 > 61.129.59.80.6661: . ack 30074 win 65112 (DF)
13:56:23.613106 arp who-has 192.168.26.128 tell 192.168.18.78
13:56:23.669180 IP 192.168.26.115.137 > 192.168.31.255.137: udp 68
13:56:23.756419 2:1:0:0:0:0 ff:ff:ff:ff:ff:ff 886f 1510: 
			 bf01 dec0 0302 0000 0100 0000 0000 0000
			 0000 0000 0000 0000 0300 0200 a859 5e40
			 0000 0000 0000 3010 0000 0000 00f0 ff6f
			 0000 0000 0000 0000 0000 0000 0000 0000
			 0000 0000 0000 0000 0000 0000 0000 0000
			 0000
13:56:23.981736 (NOV-802.2) 00000001.00:0a:eb:22:62:db.0455 > 00000000.ff:ff:ff:ff:ff:ff.0455: ipx-netbios 50
13:56:23.982079 (NOV-802.2) 00000001.00:0a:eb:22:62:db.0553 > 00000000.ff:ff:ff:ff:ff:ff.0553: ipx-nwlink-dgm 187
13:56:23.982282 IP 192.168.20.144.138 > 192.168.31.255.138: udp 201
13:56:24.040591 IP 61.129.59.80.6661 > 192.168.27.100.1140: . 30074:31534(1460) ack 2800 win 11680 (DF)
13:56:24.099661 IP 192.168.26.115.137 > 192.168.31.255.137: udp 68
13:56:24.203664 IP 192.168.27.100.1140 > 61.129.59.80.6661: . ack 31534 win 65535 (DF)
13:56:24.256411 2:1:0:0:0:0 ff:ff:ff:ff:ff:ff 886f 1510: 
			 bf01 dec0 0302 0000 0100 0000 0000 0000
			 0000 0000 0000 0000 0300 0200 a859 5e40
			 0000 0000 0000 3010 0000 0000 00f0 ff6f
			 0000 0000 0000 0000 0000 0000 0000 0000
			 0000 0000 0000 0000 0000 0000 0000 0000
			 0000
13:56:24.420618 IP 192.168.26.115.137 > 192.168.31.255.137: udp 68
13:56:24.426294 IP 61.129.59.80.6661 > 192.168.27.100.1140: P 31534:32602(1068) ack 2800 win 11680 (DF)
13:56:24.429230 802.1d config 8001.00:09:7c:f6:4b:00.802d root 8000.00:0b:ac:14:37:40 pathcost 19 age 1 max 20 hello 2 fdelay 15 
13:56:24.602837 IP 192.168.27.100.1140 > 61.129.59.80.6661: . ack 32602 win 64467 (DF)
13:56:24.612451 arp who-has 192.168.26.128 tell 192.168.18.78
13:56:24.756410 2:1:0:0:0:0 ff:ff:ff:ff:ff:ff 886f 1510: 
			 bf01 dec0 0302 0000 0100 0000 0000 0000
			 0000 0000 0000 0000 0300 0200 a859 5e40
			 0000 0000 0000 3010 0000 0000 00f0 ff6f
			 0000 0000 0000 0000 0000 0000 0000 0000
			 0000 0000 0000 0000 0000 0000 0000 0000
			 0000
13:56:24.848829 IP 192.168.20.204.138 > 192.168.31.255.138: udp 210
13:56:24.853426 IP 192.168.26.115.138 > 192.168.31.255.138: udp 201
13:56:24.966369 arp who-has 192.168.20.144 tell 192.168.18.10
13:56:24.967908 IP 192.168.20.144.137 > 192.168.31.255.137: udp 50
13:56:25.025850 IP 192.168.27.105.138 > 192.168.31.255.138: udp 208
13:56:25.027557 (NOV-802.2) 00000001.00:0c:76:94:62:7d.0455 > 00000000.ff:ff:ff:ff:ff:ff.0455: ipx-netbios 50
13:56:25.037772 (NOV-802.2) 00000001.00:0c:76:94:62:7d.0553 > 00000000.ff:ff:ff:ff:ff:ff.0553: ipx-nwlink-dgm 194
13:56:25.044044 IP 61.129.59.80.6661 > 192.168.27.100.1140: . 32602:34062(1460) ack 2800 win 11680 (DF)
13:56:25.175930 IP 192.168.26.115.137 > 192.168.31.255.137: udp 68
13:56:25.207279 IP 192.168.27.100.1140 > 61.129.59.80.6661: . ack 34062 win 65535 (DF)
13:56:25.224553 arp who-has 192.168.18.1 tell 127.0.0.1
13:56:25.256393 2:1:0:0:0:0 ff:ff:ff:ff:ff:ff 886f 1510: 
			 bf01 dec0 0302 0000 0100 0000 0000 0000
			 0000 0000 0000 0000 0300 0200 a859 5e40
			 0000 0000 0000 3010 0000 0000 00f0 ff6f
			 0000 0000 0000 0000 0000 0000 0000 0000
			 0000 0000 0000 0000 0000 0000 0000 0000
			 0000
13:56:25.437949 IP 61.129.59.80.6661 > 192.168.27.100.1140: P 34062:35044(982) ack 2800 win 11680 (DF)
13:56:25.513964 (NOV-802.2) 00000001.00:e0:4c:ee:27:32.4008 > 00000001.ff:ff:ff:ff:ff:ff.0452:ipx-sap-resp[|ipx 64]
13:56:25.604162 IP 192.168.27.100.1140 > 61.129.59.80.6661: . ack 35044 win 64553 (DF)
13:56:25.612507 arp who-has 192.168.26.128 tell 192.168.18.78
13:56:25.678259 arp who-has 192.168.26.182 tell 192.168.18.55
13:56:25.717088 IP 192.168.20.144.137 > 192.168.31.255.137: udp 50
13:56:25.756350 2:1:0:0:0:0 ff:ff:ff:ff:ff:ff 886f 1510: 
			 bf01 dec0 0302 0000 0100 0000 0000 0000
			 0000 0000 0000 0000 0300 0200 a859 5e40
			 0000 0000 0000 3010 0000 0000 00f0 ff6f
			 0000 0000 0000 0000 0000 0000 0000 0000
			 0000 0000 0000 0000 0000 0000 0000 0000
			 0000
13:56:25.922185 IP 192.168.26.115.137 > 192.168.31.255.137: udp 68
13:56:26.036906 IP 61.129.59.80.6661 > 192.168.27.100.1140: . 35044:36504(1460) ack 2800 win 11680 (DF)
13:56:26.086116 IP 192.168.22.105.4833 > 192.168.31.255.39213: udp 268
13:56:26.088425 IP 192.168.22.105.4834 > 192.168.31.255.39213: udp 824
13:56:26.088488 IP 192.168.22.105.4835 > 192.168.31.255.39213: udp 112
13:56:26.206845 IP 192.168.27.100.1140 > 61.129.59.80.6661: . ack 36504 win 65535 (DF)
13:56:26.256378 2:1:0:0:0:0 ff:ff:ff:ff:ff:ff 886f 1510: 
			 bf01 dec0 0302 0000 0100 0000 0000 0000
			 0000 0000 0000 0000 0300 0200 a859 5e40
			 0000 0000 0000 3010 0000 0000 00f0 ff6f
			 0000 0000 0000 0000 0000 0000 0000 0000
			 0000 0000 0000 0000 0000 0000 0000 0000
			 0000
13:56:26.293793 IP 192.168.20.181.138 > 192.168.31.255.138: udp 201
13:56:26.426493 arp who-has 192.168.22.104 tell 192.168.22.45
13:56:26.429399 802.1d config 8001.00:09:7c:f6:4b:00.802d root 8000.00:0b:ac:14:37:40 pathcost 19 age 1 max 20 hello 2 fdelay 15 
13:56:26.430217 (NOV-802.2) 00000001.00:0a:eb:13:44:e5.0455 > 00000000.ff:ff:ff:ff:ff:ff.0455: ipx-netbios 50
13:56:26.430639 (NOV-802.2) 00000001.00:0a:eb:13:44:e5.0553 > 00000000.ff:ff:ff:ff:ff:ff.0553: ipx-nwlink-dgm 187
13:56:26.430888 IP 192.168.20.139.138 > 192.168.31.255.138: udp 201
13:56:26.439482 IP 61.129.59.80.6661 > 192.168.27.100.1140: P 36504:37505(1001) ack 2800 win 11680 (DF)
13:56:26.467078 IP 192.168.20.144.137 > 192.168.31.255.137: udp 50
13:56:26.537868 IP 192.168.27.100.1140 > 61.129.59.80.6661: P 2800:2815(15) ack 37505 win 64534 (DF)
13:56:26.673267 IP 192.168.26.115.137 > 192.168.31.255.137: udp 68
13:56:26.690594 IP 192.168.20.205.138 > 192.168.31.255.138: udp 201
13:56:26.761046 2:1:0:0:0:0 ff:ff:ff:ff:ff:ff 886f 1510: 
			 bf01 dec0 0302 0000 0100 0000 0000 0000
			 0000 0000 0000 0000 0300 0200 a859 5e40
			 0000 0000 0000 3010 0000 0000 00f0 ff6f
			 0000 0000 0000 0000 0000 0000 0000 0000
			 0000 0000 0000 0000 0000 0000 0000 0000
			 0000
13:56:26.768982 arp who-has 192.168.21.138 tell 192.168.18.10
13:56:27.047797 IP 61.129.59.80.6661 > 192.168.27.100.1140: . 37505:38965(1460) ack 2800 win 11680 (DF)
13:56:27.206457 IP 192.168.27.100.1140 > 61.129.59.80.6661: . ack 38965 win 65535 (DF)
13:56:27.256290 2:1:0:0:0:0 ff:ff:ff:ff:ff:ff 886f 1510: 
			 bf01 dec0 0302 0000 0100 0000 0000 0000
			 0000 0000 0000 0000 0300 0200 a859 5e40
			 0000 0000 0000 3010 0000 0000 00f0 ff6f
			 0000 0000 0000 0000 0000 0000 0000 0000
			 0000 0000 0000 0000 0000 0000 0000 0000
			 0000
13:56:27.363234 arp who-has 192.168.20.3 tell 192.168.20.92
13:56:27.366641 IP 61.129.59.80.6661 > 192.168.27.100.1140: P 38965:39835(870) ack 2815 win 11680 (DF)
13:56:27.427878 IP 192.168.26.115.138 > 192.168.31.255.138: udp 201
13:56:27.463902 IP 192.168.27.100.1140 > 61.129.59.80.6661: P 2815:2830(15) ack 39835 win 64665 (DF)
13:56:27.756309 2:1:0:0:0:0 ff:ff:ff:ff:ff:ff 886f 1510: 
			 bf01 dec0 0302 0000 0100 0000 0000 0000
			 0000 0000 0000 0000 0300 0200 a859 5e40
			 0000 0000 0000 3010 0000 0000 00f0 ff6f
			 0000 0000 0000 0000 0000 0000 0000 0000
			 0000 0000 0000 0000 0000 0000 0000 0000
			 0000
13:56:27.935777 IP 61.129.59.80.6661 > 192.168.27.100.1140: . 39835:41295(1460) ack 2815 win 11680 (DF)
13:56:27.936798 IP 192.168.27.100.1140 > 61.129.59.80.6661: P 2830:2860(30) ack 41295 win 65535 (DF)
13:56:28.247088 IP 192.168.26.115.137 > 192.168.31.255.137: udp 68
13:56:28.256331 2:1:0:0:0:0 ff:ff:ff:ff:ff:ff 886f 1510: 
			 bf01 dec0 0302 0000 0100 0000 0000 0000
			 0000 0000 0000 0000 0300 0200 a859 5e40
			 0000 0000 0000 3010 0000 0000 00f0 ff6f
			 0000 0000 0000 0000 0000 0000 0000 0000
			 0000 0000 0000 0000 0000 0000 0000 0000
			 0000
13:56:28.260819 IP 61.129.59.80.6661 > 192.168.27.100.1140: P 41295:42000(705) ack 2830 win 11680 (DF)
13:56:28.262138 IP 192.168.27.100.1140 > 61.129.59.80.6661: P 2860:2875(15) ack 42000 win 64830 (DF)
13:56:28.265753 IP 192.168.26.115.137 > 192.168.31.255.137: udp 68
13:56:28.415085 (NOV-802.2) 00000001.00:0a:eb:13:2f:53.0455 > 00000000.ff:ff:ff:ff:ff:ff.0455: ipx-netbios 50
13:56:28.415482 (NOV-802.2) 00000001.00:0a:eb:13:2f:53.0553 > 00000000.ff:ff:ff:ff:ff:ff.0553: ipx-nwlink-dgm 187
13:56:28.415694 IP 192.168.20.53.138 > 192.168.31.255.138: udp 201
13:56:28.431490 802.1d config 8001.00:09:7c:f6:4b:00.802d root 8000.00:0b:ac:14:37:40 pathcost 19 age 1 max 20 hello 2 fdelay 15 
13:56:28.586125 IP 192.168.22.105.4837 > 192.168.31.255.39213: udp 268
13:56:28.586402 IP 192.168.22.105.4838 > 192.168.31.255.39213: udp 112
13:56:28.706306 IP 61.129.59.80.6661 > 192.168.27.100.1140: . 42000:43460(1460) ack 2830 win 11680 (DF)
13:56:28.754935 arp who-has 192.168.26.128 tell 192.168.18.78
13:56:28.756194 2:1:0:0:0:0 ff:ff:ff:ff:ff:ff 886f 1510: 
			 bf01 dec0 0302 0000 0100 0000 0000 0000
			 0000 0000 0000 0000 0300 0200 a859 5e40
			 0000 0000 0000 3010 0000 0000 00f0 ff6f
			 0000 0000 0000 0000 0000 0000 0000 0000
			 0000 0000 0000 0000 0000 0000 0000 0000
			 0000
13:56:28.791498 IP 61.129.59.80.6661 > 192.168.27.100.1140: . ack 2860 win 11680 (DF)
13:56:28.792617 IP 192.168.27.100.1140 > 61.129.59.80.6661: P 2875:2965(90) ack 43460 win 65535 (DF)
13:56:28.996799 IP 192.168.26.115.137 > 192.168.31.255.137: udp 68
13:56:29.016780 IP 192.168.26.115.137 > 192.168.31.255.137: udp 68
13:56:29.042655 IP 61.129.59.80.6661 > 192.168.27.100.1140: P 43460:44473(1013) ack 2875 win 11680 (DF)
13:56:29.043835 IP 192.168.27.100.1140 > 61.129.59.80.6661: P 2965:2980(15) ack 44473 win 64522 (DF)
13:56:29.213146 IP 192.168.22.105.4839 > 192.168.31.255.39213: udp 824
13:56:29.256201 2:1:0:0:0:0 ff:ff:ff:ff:ff:ff 886f 1510: 
			 bf01 dec0 0302 0000 0100 0000 0000 0000
			 0000 0000 0000 0000 0300 0200 a859 5e40
			 0000 0000 0000 3010 0000 0000 00f0 ff6f
			 0000 0000 0000 0000 0000 0000 0000 0000
			 0000 0000 0000 0000 0000 0000 0000 0000
			 0000
13:56:29.590332 IP 61.129.59.80.6661 > 192.168.27.100.1140: . 44473:45933(1460) ack 2965 win 11680 (DF)
13:56:29.591488 IP 192.168.27.100.1140 > 61.129.59.80.6661: P 2980:3145(165) ack 45933 win 65535 (DF)
13:56:29.619793 arp who-has 192.168.20.17 tell 192.168.20.1
13:56:29.706089 arp who-has 192.168.18.1 tell 192.168.20.21
13:56:29.706275 arp who-has 192.168.18.1 tell 192.168.20.21
13:56:29.747853 IP 192.168.26.115.137 > 192.168.31.255.137: udp 68
13:56:29.753009 arp who-has 192.168.26.128 tell 192.168.18.78
13:56:29.756174 2:1:0:0:0:0 ff:ff:ff:ff:ff:ff 886f 1510: 
			 bf01 dec0 0302 0000 0100 0000 0000 0000
			 0000 0000 0000 0000 0300 0200 a859 5e40
			 0000 0000 0000 3010 0000 0000 00f0 ff6f
			 0000 0000 0000 0000 0000 0000 0000 0000
			 0000 0000 0000 0000 0000 0000 0000 0000
			 0000
13:56:29.767948 IP 192.168.26.115.137 > 192.168.31.255.137: udp 68
13:56:29.844341 IP 61.129.59.80.6661 > 192.168.27.100.1140: P 45933:47196(1263) ack 2980 win 11680 (DF)
13:56:30.010518 IP 192.168.27.100.1140 > 61.129.59.80.6661: . ack 47196 win 64272 (DF)
13:56:30.153674 IP 192.168.27.197.137 > 192.168.31.255.137: udp 50
13:56:30.262789 2:1:0:0:0:0 ff:ff:ff:ff:ff:ff 886f 1510: 
			 bf01 dec0 0302 0000 0100 0000 0000 0000
			 0000 0000 0000 0000 0300 0200 a859 5e40
			 0000 0000 0000 3010 0000 0000 00f0 ff6f
			 0000 0000 0000 0000 0000 0000 0000 0000
			 0000 0000 0000 0000 0000 0000 0000 0000
			 0000
13:56:30.374984 IP 61.129.59.80.6661 > 192.168.27.100.1140: . 47196:48656(1460) ack 2980 win 11680 (DF)
13:56:30.376165 IP 192.168.27.100.1140 > 61.129.59.80.6661: P 3145:3430(285) ack 48656 win 65535 (DF)
13:56:30.429338 IP 61.129.59.80.6661 > 192.168.27.100.1140: . ack 3145 win 11680 (DF)
13:56:30.432786 802.1d config 8001.00:09:7c:f6:4b:00.802d root 8000.00:0b:ac:14:37:40 pathcost 19 age 1 max 20 hello 2 fdelay 15 
13:56:30.498944 IP 192.168.26.115.137 > 192.168.31.255.137: udp 68
13:56:30.513520 arp who-has 192.168.20.23 tell 192.168.20.1
13:56:30.518999 IP 192.168.26.115.137 > 192.168.31.255.137: udp 68
13:56:30.597513 IP 61.129.59.80.6661 > 192.168.27.100.1140: . 48656:50116(1460) ack 3145 win 11680 (DF)
13:56:30.712193 IP 192.168.27.100.1140 > 61.129.59.80.6661: . ack 50116 win 65535 (DF)
13:56:30.753170 arp who-has 192.168.26.128 tell 192.168.18.78
13:56:30.756172 2:1:0:0:0:0 ff:ff:ff:ff:ff:ff 886f 1510: 
			 bf01 dec0 0302 0000 0100 0000 0000 0000
			 0000 0000 0000 0000 0300 0200 a859 5e40
			 0000 0000 0000 3010 0000 0000 00f0 ff6f
			 0000 0000 0000 0000 0000 0000 0000 0000
			 0000 0000 0000 0000 0000 0000 0000 0000
			 0000
13:56:30.804203 IP 61.129.59.80.6661 > 192.168.27.100.1140: P 50116:50613(497) ack 3145 win 11680 (DF)
13:56:30.808046 IP 192.168.27.100.1140 > 61.129.59.80.6661: P 3430:3445(15) ack 50613 win 65038 (DF)
13:56:30.900948 IP 192.168.27.197.137 > 192.168.31.255.137: udp 50
13:56:31.086201 IP 192.168.22.105.4840 > 192.168.31.255.39213: udp 268
13:56:31.086387 IP 192.168.22.105.4841 > 192.168.31.255.39213: udp 112
13:56:31.192160 IP 61.129.59.80.6661 > 192.168.27.100.1140: . ack 3430 win 11680 (DF)
13:56:31.193176 IP 192.168.27.100.1140 > 61.129.59.80.6661: P 3445:3700(255) ack 50613 win 65038 (DF)
13:56:31.200043 IP 61.129.59.80.6661 > 192.168.27.100.1140: . 50613:52073(1460) ack 3430 win 11680 (DF)
13:56:31.205910 arp who-has 192.168.20.211 tell 192.168.20.215
13:56:31.256134 2:1:0:0:0:0 ff:ff:ff:ff:ff:ff 886f 1510: 
			 bf01 dec0 0302 0000 0100 0000 0000 0000
			 0000 0000 0000 0000 0300 0200 a859 5e40
			 0000 0000 0000 3010 0000 0000 00f0 ff6f
			 0000 0000 0000 0000 0000 0000 0000 0000
			 0000 0000 0000 0000 0000 0000 0000 0000
			 0000
13:56:31.270574 IP 192.168.26.115.138 > 192.168.31.255.138: udp 175
13:56:31.270740 IP 192.168.22.44.138 > 192.168.31.255.138: udp 213 (DF)
13:56:31.270759 IP 192.168.22.44.138 > 192.168.31.255.138: udp 205 (DF)
13:56:31.271556 IP 192.168.26.115.137 > 192.168.31.255.137: udp 50
13:56:31.271980 arp who-has 192.168.22.44 tell 192.168.26.115
13:56:31.283523 IP 192.168.26.115.138 > 192.168.31.255.138: udp 201
13:56:31.313195 IP 192.168.27.100.1140 > 61.129.59.80.6661: . ack 52073 win 65535 (DF)
13:56:31.374109 IP 61.129.59.80.6661 > 192.168.27.100.1140: . 52073:53533(1460) ack 3430 win 11680 (DF)
13:56:31.375243 IP 192.168.27.100.1140 > 61.129.59.80.6661: P 3700:3715(15) ack 53533 win 65535 (DF)
13:56:31.615314 IP 61.129.59.80.6661 > 192.168.27.100.1140: P 53533:54435(902) ack 3445 win 11680 (DF)
13:56:31.616196 IP 192.168.27.100.1140 > 61.129.59.80.6661: . ack 54435 win 64633 (DF)
13:56:31.616219 IP 192.168.27.100.1140 > 61.129.59.80.6661: P 3715:3730(15) ack 54435 win 64633 (DF)
13:56:31.650931 IP 192.168.27.197.137 > 192.168.31.255.137: udp 50
13:56:31.700359 arp who-has 192.168.18.1 tell 192.168.26.22
13:56:31.756190 2:1:0:0:0:0 ff:ff:ff:ff:ff:ff 886f 1510: 
			 bf01 dec0 0302 0000 0100 0000 0000 0000
			 0000 0000 0000 0000 0300 0200 a859 5e40
			 0000 0000 0000 3010 0000 0000 00f0 ff6f
			 0000 0000 0000 0000 0000 0000 0000 0000
			 0000 0000 0000 0000 0000 0000 0000 0000
			 0000
13:56:32.026021 IP 61.129.59.80.6661 > 192.168.27.100.1140: . 54435:55895(1460) ack 3700 win 11680 (DF)
13:56:32.029402 IP 192.168.27.100.1140 > 61.129.59.80.6661: P 3730:3910(180) ack 55895 win 65535 (DF)
13:56:32.175198 IP 192.168.27.121.138 > 192.168.31.255.138: udp 201
13:56:32.175300 IP 192.168.20.3.138 > 192.168.31.255.138: udp 201
13:56:32.192130 0:a:eb:13:23:12 > 3:0:0:0:0:1 sap f0 ui/C len=44
13:56:32.207782 IP 61.129.59.80.6661 > 192.168.27.100.1140: . ack 3715 win 11680 (DF)
13:56:32.256148 2:1:0:0:0:0 ff:ff:ff:ff:ff:ff 886f 1510: 
			 bf01 dec0 0302 0000 0100 0000 0000 0000
			 0000 0000 0000 0000 0300 0200 a859 5e40
			 0000 0000 0000 3010 0000 0000 00f0 ff6f
			 0000 0000 0000 0000 0000 0000 0000 0000
			 0000 0000 0000 0000 0000 0000 0000 0000
			 0000
13:56:32.268011 IP 61.129.59.80.6661 > 192.168.27.100.1140: . 55895:57355(1460) ack 3715 win 11680 (DF)
13:56:32.337528 IP 192.168.22.105.4842 > 192.168.31.255.39213: udp 824
13:56:32.414013 IP 192.168.27.100.1140 > 61.129.59.80.6661: . ack 57355 win 65535 (DF)
13:56:32.418515 IP 61.129.59.80.6661 > 192.168.27.100.1140: P 57355:57810(455) ack 3715 win 11680 (DF)
13:56:32.425652 IP 61.129.59.80.6661 > 192.168.27.100.1140: . ack 3730 win 11680 (DF)
13:56:32.431486 802.1d config 8001.00:09:7c:f6:4b:00.802d root 8000.00:0b:ac:14:37:40 pathcost 19 age 1 max 20 hello 2 fdelay 15 
13:56:32.614366 IP 192.168.27.100.1140 > 61.129.59.80.6661: . ack 57810 win 65080 (DF)
13:56:32.634123 IP 192.168.27.120.138 > 192.168.31.255.138: udp 201
13:56:32.718417 0:a:eb:13:23:12 > 3:0:0:0:0:1 sap f0 ui/C len=44
13:56:32.756076 2:1:0:0:0:0 ff:ff:ff:ff:ff:ff 886f 1510: 
			 bf01 dec0 0302 0000 0100 0000 0000 0000
			 0000 0000 0000 0000 0300 0200 a859 5e40
			 0000 0000 0000 3010 0000 0000 00f0 ff6f
			 0000 0000 0000 0000 0000 0000 0000 0000
			 0000 0000 0000 0000 0000 0000 0000 0000
			 0000
13:56:32.841611 IP 61.129.59.80.6661 > 192.168.27.100.1140: . ack 3910 win 11680 (DF)
13:56:32.842430 IP 192.168.27.100.1140 > 61.129.59.80.6661: P 3910:4150(240) ack 57810 win 65080 (DF)
13:56:32.900054 IP 192.168.20.134.138 > 192.168.31.255.138: udp 214
13:56:32.943074 IP 61.129.59.80.6661 > 192.168.27.100.1140: . 57810:59270(1460) ack 3910 win 11680 (DF)
13:56:32.943938 IP 192.168.27.100.1140 > 61.129.59.80.6661: P 4150:4165(15) ack 59270 win 65535 (DF)
13:56:33.249327 0:a:eb:13:23:12 > 3:0:0:0:0:1 sap f0 ui/C len=44
13:56:33.256102 2:1:0:0:0:0 ff:ff:ff:ff:ff:ff 886f 1510: 
			 bf01 dec0 0302 0000 0100 0000 0000 0000
			 0000 0000 0000 0000 0300 0200 a859 5e40
			 0000 0000 0000 3010 0000 0000 00f0 ff6f
			 0000 0000 0000 0000 0000 0000 0000 0000
			 0000 0000 0000 0000 0000 0000 0000 0000
			 0000
13:56:33.364885 IP 61.129.59.80.6661 > 192.168.27.100.1140: . 59270:60730(1460) ack 3910 win 11680 (DF)
13:56:33.368774 IP 192.168.27.100.1140 > 61.129.59.80.6661: P 4165:4180(15) ack 60730 win 65535 (DF)
13:56:33.429477 IP 61.129.59.80.6661 > 192.168.27.100.1140: P 60730:60939(209) ack 3910 win 11680 (DF)
13:56:33.432247 IP 192.168.27.100.1140 > 61.129.59.80.6661: P 4180:4195(15) ack 60939 win 65326 (DF)
13:56:33.598256 IP 192.168.22.105.4843 > 192.168.31.255.39213: udp 268
13:56:33.598287 IP 192.168.22.105.4844 > 192.168.31.255.39213: udp 112
13:56:33.691925 IP 61.129.59.80.6661 > 192.168.27.100.1140: . ack 4150 win 11680 (DF)
13:56:33.693038 IP 192.168.27.100.1140 > 61.129.59.80.6661: P 4195:4345(150) ack 60939 win 65326 (DF)
13:56:33.706041 IP 61.129.59.80.6661 > 192.168.27.100.1140: . 60939:62399(1460) ack 4150 win 11680 (DF)
13:56:33.763231 2:1:0:0:0:0 ff:ff:ff:ff:ff:ff 886f 1510: 
			 bf01 dec0 0302 0000 0100 0000 0000 0000
			 0000 0000 0000 0000 0300 0200 a859 5e40
			 0000 0000 0000 3010 0000 0000 00f0 ff6f
			 0000 0000 0000 0000 0000 0000 0000 0000
			 0000 0000 0000 0000 0000 0000 0000 0000
			 0000
13:56:33.783201 0:a:eb:13:23:12 > 3:0:0:0:0:1 sap f0 ui/C len=44
13:56:33.791628 IP 61.129.59.80.6661 > 192.168.27.100.1140: . ack 4165 win 11680 (DF)
13:56:33.815880 IP 192.168.27.100.1140 > 61.129.59.80.6661: . ack 62399 win 65535 (DF)
13:56:34.174375 IP 61.129.59.80.6661 > 192.168.27.100.1140: . ack 4180 win 11680 (DF)
13:56:34.175481 IP 192.168.27.100.1140 > 61.129.59.80.6661: P 4345:4450(105) ack 62399 win 65535 (DF)
13:56:34.217178 IP 61.129.59.80.6661 > 192.168.27.100.1140: P 62399:63739(1340) ack 4195 win 11680 (DF)
13:56:34.256034 2:1:0:0:0:0 ff:ff:ff:ff:ff:ff 886f 1510: 
			 bf01 dec0 0302 0000 0100 0000 0000 0000
			 0000 0000 0000 0000 0300 0200 a859 5e40
			 0000 0000 0000 3010 0000 0000 00f0 ff6f
			 0000 0000 0000 0000 0000 0000 0000 0000
			 0000 0000 0000 0000 0000 0000 0000 0000
			 0000
13:56:34.321141 0:a:eb:13:23:12 > 3:0:0:0:0:1 sap f0 ui/C len=44
13:56:34.331799 IP 192.168.26.246.137 > 192.168.31.255.137: udp 50
13:56:34.332315 arp who-has 192.168.22.44 tell 192.168.26.246
13:56:34.378035 IP 192.168.20.93.138 > 192.168.31.255.138: udp 217
13:56:34.418935 IP 192.168.27.100.1140 > 61.129.59.80.6661: . ack 63739 win 64195 (DF)
13:56:34.431677 802.1d config 8001.00:09:7c:f6:4b:00.802d root 8000.00:0b:ac:14:37:40 pathcost 19 age 1 max 20 hello 2 fdelay 15 
13:56:34.519294 IP 61.129.59.80.6661 > 192.168.27.100.1140: . ack 4345 win 11680 (DF)
13:56:34.520751 IP 192.168.27.100.1140 > 61.129.59.80.6661: P 4450:4525(75) ack 63739 win 64195 (DF)
13:56:34.594959 IP 61.129.59.80.6661 > 192.168.27.100.1140: . 63739:65199(1460) ack 4345 win 11680 (DF)
13:56:34.597298 0:9:7c:f6:4b:2d > 1:0:c:cc:cc:cc sap aa ui/C len=35
13:56:34.597413 0:9:7c:f6:4b:2d > 1:0:c:0:0:0 sap aa ui/C len=65
13:56:34.717262 IP 192.168.27.100.1140 > 61.129.59.80.6661: . ack 65199 win 65535 (DF)
13:56:34.741928 arp who-has 192.168.20.142 tell 192.168.20.103
13:56:34.755990 2:1:0:0:0:0 ff:ff:ff:ff:ff:ff 886f 1510: 
			 bf01 dec0 0302 0000 0100 0000 0000 0000
			 0000 0000 0000 0000 0300 0200 a859 5e40
			 0000 0000 0000 3010 0000 0000 00f0 ff6f
			 0000 0000 0000 0000 0000 0000 0000 0000
			 0000 0000 0000 0000 0000 0000 0000 0000
			 0000
13:56:34.806320 arp who-has 192.168.27.33 tell 192.168.18.28
13:56:34.861054 0:a:eb:13:23:12 > 3:0:0:0:0:1 sap f0 ui/C len=44
13:56:34.917719 arp who-has 192.168.18.1 tell 192.168.21.146
13:56:34.968790 (NOV-802.2) 00000001.00:0a:eb:07:dd:45.0553 > 00000000.ff:ff:ff:ff:ff:ff.0553: ipx-nwlink-dgm 187
13:56:34.970421 IP 192.168.21.138.138 > 192.168.31.255.138: udp 201
13:56:34.970474 (NOV-802.2) 00000001.00:0a:eb:07:dd:45.0455 > 00000000.ff:ff:ff:ff:ff:ff.0455: ipx-netbios 50
13:56:34.972297 IP 61.129.59.80.6661 > 192.168.27.100.1140: . ack 4450 win 11680 (DF)
13:56:34.972906 IP 192.168.27.100.1140 > 61.129.59.80.6661: P 4525:4540(15) ack 65199 win 65535 (DF)
13:56:35.044249 IP 61.129.59.80.6661 > 192.168.27.100.1140: . 65199:66659(1460) ack 4450 win 11680 (DF)
13:56:35.197180 IP 61.129.59.80.6661 > 192.168.27.100.1140: P 66659:67068(409) ack 4450 win 11680 (DF)
13:56:35.200479 IP 192.168.27.100.1140 > 61.129.59.80.6661: P 4540:4585(45) ack 67068 win 65535 (DF)
13:56:35.262404 2:1:0:0:0:0 ff:ff:ff:ff:ff:ff 886f 1510: 
			 bf01 dec0 0302 0000 0100 0000 0000 0000
			 0000 0000 0000 0000 0300 0200 a859 5e40
			 0000 0000 0000 3010 0000 0000 00f0 ff6f
			 0000 0000 0000 0000 0000 0000 0000 0000
			 0000 0000 0000 0000 0000 0000 0000 0000
			 0000
13:56:35.320809 IP 61.129.59.80.6661 > 192.168.27.100.1140: . ack 4525 win 11680 (DF)
13:56:35.462541 IP 192.168.22.105.4845 > 192.168.31.255.39213: udp 824
13:56:35.594270 IP 61.129.59.80.6661 > 192.168.27.100.1140: . 67068:68528(1460) ack 4525 win 11680 (DF)
13:56:35.596893 IP 192.168.27.100.1140 > 61.129.59.80.6661: P 4585:4645(60) ack 68528 win 65535 (DF)
13:56:35.725549 arp who-has 192.168.20.5 tell 192.168.20.37
13:56:35.756013 2:1:0:0:0:0 ff:ff:ff:ff:ff:ff 886f 1510: 
			 bf01 dec0 0302 0000 0100 0000 0000 0000
			 0000 0000 0000 0000 0300 0200 a859 5e40
			 0000 0000 0000 3010 0000 0000 00f0 ff6f
			 0000 0000 0000 0000 0000 0000 0000 0000
			 0000 0000 0000 0000 0000 0000 0000 0000
			 0000
13:56:35.767891 IP 192.168.26.115.137 > 192.168.31.255.137: udp 50
13:56:35.801031 IP 61.129.59.80.6661 > 192.168.27.100.1140: . ack 4540 win 11680 (DF)
13:56:35.801477 (NOV-802.2) 00000001.00:0a:eb:07:dd:45.0455 > 00000000.ff:ff:ff:ff:ff:ff.0455: ipx-netbios 50
13:56:36.034807 IP 61.129.59.80.6661 > 192.168.27.100.1140: P 68528:69333(805) ack 4585 win 11680 (DF)
13:56:36.035994 IP 192.168.27.100.1140 > 61.129.59.80.6661: P 4645:4660(15) ack 69333 win 64730 (DF)
13:56:36.086035 IP 192.168.22.105.4846 > 192.168.31.255.39213: udp 268
13:56:36.086551 IP 192.168.22.105.4847 > 192.168.31.255.39213: udp 112
13:56:36.214639 arp who-has 192.168.20.3 tell 192.168.20.175
13:56:36.256011 2:1:0:0:0:0 ff:ff:ff:ff:ff:ff 886f 1510: 
			 bf01 dec0 0302 0000 0100 0000 0000 0000
			 0000 0000 0000 0000 0300 0200 a859 5e40
			 0000 0000 0000 3010 0000 0000 00f0 ff6f
			 0000 0000 0000 0000 0000 0000 0000 0000
			 0000 0000 0000 0000 0000 0000 0000 0000
			 0000
13:56:36.300393 IP 192.168.27.100.1135 > 192.168.18.10.1025: F 390238985:390238985(0) ack 1183839190 win 65535 (DF)
13:56:36.300631 IP 192.168.18.10.1025 > 192.168.27.100.1135: . ack 1 win 16555 (DF)
13:56:36.300702 IP 192.168.18.10.1025 > 192.168.27.100.1135: F 1:1(0) ack 1 win 16555 (DF)
13:56:36.301157 IP 192.168.27.100.1135 > 192.168.18.10.1025: . ack 2 win 65535 (DF)
13:56:36.419585 IP 61.129.59.80.6661 > 192.168.27.100.1140: . ack 4645 win 11680 (DF)
13:56:36.420555 IP 192.168.27.100.1140 > 61.129.59.80.6661: P 4660:4750(90) ack 69333 win 64730 (DF)
13:56:36.433173 802.1d config 8001.00:09:7c:f6:4b:00.802d root 8000.00:0b:ac:14:37:40 pathcost 19 age 1 max 20 hello 2 fdelay 15 
13:56:36.474732 IP 61.129.59.80.6661 > 192.168.27.100.1140: . 69333:70793(1460) ack 4645 win 11680 (DF)
13:56:36.517532 IP 192.168.26.115.137 > 192.168.31.255.137: udp 50
13:56:36.539552 IP 192.168.26.78.138 > 192.168.31.255.138: udp 201
13:56:36.596784 IP 192.168.26.115.137 > 192.168.31.255.137: udp 68
13:56:36.622375 IP 192.168.27.100.1140 > 61.129.59.80.6661: . ack 70793 win 65535 (DF)
13:56:36.756003 2:1:0:0:0:0 ff:ff:ff:ff:ff:ff 886f 1510: 
			 bf01 dec0 0302 0000 0100 0000 0000 0000
			 0000 0000 0000 0000 0300 0200 a859 5e40
			 0000 0000 0000 3010 0000 0000 00f0 ff6f
			 0000 0000 0000 0000 0000 0000 0000 0000
			 0000 0000 0000 0000 0000 0000 0000 0000
			 0000
13:56:36.762207 arp who-has 192.168.18.4 tell 192.168.20.1
13:56:36.841749 IP 61.129.59.80.6661 > 192.168.27.100.1140: P 70793:71804(1011) ack 4660 win 11680 (DF)
13:56:36.867154 IP 192.168.27.124.138 > 192.168.31.255.138: udp 201
13:56:36.870747 IP 192.168.27.100.1140 > 61.129.59.80.6661: P 4750:4765(15) ack 71804 win 64524 (DF)
13:56:36.992955 IP 192.168.26.115.137 > 192.168.31.255.137: udp 50
13:56:37.064760 IP 192.168.26.20.138 > 192.168.31.255.138: udp 201
13:56:37.199171 (NOV-802.2) 00000001.00:0a:eb:4d:06:a3.0453 > 00000001.ff:ff:ff:ff:ff:ff.0453:ipx-rip-resp 1000156433/1.2
13:56:37.206616 arp who-has 192.168.18.1 tell 192.168.22.26
13:56:37.255926 2:1:0:0:0:0 ff:ff:ff:ff:ff:ff 886f 1510: 
			 bf01 dec0 0302 0000 0100 0000 0000 0000
			 0000 0000 0000 0000 0300 0200 a859 5e40
			 0000 0000 0000 3010 0000 0000 00f0 ff6f
