15:22:29.753942 (NOV-802.2) 00000001.00:0d:61:99:8c:bc.0551 > 00000000.ff:ff:ff:ff:ff:ff.0551: ipx-#551 68
15:22:29.888173 arp who-has 192.168.26.132 tell 192.168.22.96
15:22:29.925934 IP 61.129.59.81.6661 > 192.168.27.100.1207: P 1025755963:1025756371(408) ack 1721167709 win 6432 (DF)
15:22:29.935753 802.1d config 8001.00:09:7c:f6:4b:00.802d root 8000.00:0b:ac:14:37:40 pathcost 19 age 1 max 20 hello 2 fdelay 15 
15:22:29.980664 2:1:0:0:0:0 ff:ff:ff:ff:ff:ff 886f 1510: 
			 bf01 dec0 0302 0000 0100 0000 0000 0000
			 0000 0000 0000 0000 0300 0200 a859 5e40
			 0000 0000 0000 3010 0000 0000 00f0 ff6f
			 0000 0000 0000 0000 0000 0000 0000 0000
			 0000 0000 0000 0000 0000 0000 0000 0000
			 0000
15:22:30.053205 IP 192.168.27.100.1207 > 61.129.59.81.6661: . ack 408 win 65127 (DF)
15:22:30.196327 (NOV-802.2) 00000001.00:0a:eb:04:94:f8.4018 > 00000000.ff:ff:ff:ff:ff:ff.0452:ipx-sap-nearest-req 0004
15:22:30.215621 IP 192.168.18.88.138 > 192.168.31.255.138: udp 201
15:22:30.247708 IP 192.168.21.133.138 > 192.168.31.255.138: udp 201
15:22:30.262603 (NOV-802.2) 00000001.00:0d:61:99:8c:bc.0455 > 00000000.ff:ff:ff:ff:ff:ff.0455: ipx-netbios 50
15:22:30.480583 2:1:0:0:0:0 ff:ff:ff:ff:ff:ff 886f 1510: 
			 bf01 dec0 0302 0000 0100 0000 0000 0000
			 0000 0000 0000 0000 0300 0200 a859 5e40
			 0000 0000 0000 3010 0000 0000 00f0 ff6f
			 0000 0000 0000 0000 0000 0000 0000 0000
			 0000 0000 0000 0000 0000 0000 0000 0000
			 0000
15:22:30.724849 IP 61.129.59.81.6661 > 192.168.27.100.1207: P 408:822(414) ack 1 win 6432 (DF)
15:22:30.853334 IP 192.168.27.100.1207 > 61.129.59.81.6661: . ack 822 win 64713 (DF)
15:22:30.853793 IP 192.168.18.1 > 192.168.27.100: icmp 36: redirect 61.129.59.81 to net 192.168.18.4
15:22:30.858316 (NOV-802.2) 00000001.00:0a:eb:04:94:f8.4018 > 00000000.ff:ff:ff:ff:ff:ff.0452:ipx-sap-nearest-req 0004
15:22:30.980573 2:1:0:0:0:0 ff:ff:ff:ff:ff:ff 886f 1510: 
			 bf01 dec0 0302 0000 0100 0000 0000 0000
			 0000 0000 0000 0000 0300 0200 a859 5e40
			 0000 0000 0000 3010 0000 0000 00f0 ff6f
			 0000 0000 0000 0000 0000 0000 0000 0000
			 0000 0000 0000 0000 0000 0000 0000 0000
			 0000
15:22:31.085966 IP 192.168.27.100.1207 > 61.129.59.81.6661: P 1:16(15) ack 822 win 64713 (DF)
15:22:31.405192 arp who-has 192.168.18.11 tell 127.0.0.1
15:22:31.480641 2:1:0:0:0:0 ff:ff:ff:ff:ff:ff 886f 1510: 
			 bf01 dec0 0302 0000 0100 0000 0000 0000
			 0000 0000 0000 0000 0300 0200 a859 5e40
			 0000 0000 0000 3010 0000 0000 00f0 ff6f
			 0000 0000 0000 0000 0000 0000 0000 0000
			 0000 0000 0000 0000 0000 0000 0000 0000
			 0000
15:22:31.493086 IP 192.168.21.97.137 > 192.168.31.255.137: udp 50
15:22:31.515940 IP 61.129.59.81.6661 > 192.168.27.100.1207: P 822:1258(436) ack 1 win 6432 (DF)
15:22:31.516877 IP 192.168.27.100.1207 > 61.129.59.81.6661: P 16:31(15) ack 1258 win 64277 (DF)
15:22:31.522954 (NOV-802.2) 00000001.00:0a:eb:04:94:f8.4018 > 00000000.ff:ff:ff:ff:ff:ff.0452:ipx-sap-nearest-req 0004
15:22:31.651981 arp who-has 192.168.20.215 tell 192.168.20.211
15:22:31.788065 IP 61.129.59.81.6661 > 192.168.27.100.1207: . ack 16 win 6432 (DF)
15:22:31.790531 IP 192.168.27.100.1207 > 61.129.59.81.6661: P 31:46(15) ack 1258 win 64277 (DF)
15:22:31.793761 IP 192.168.22.105.2864 > 192.168.31.255.39213: udp 268
15:22:31.794066 IP 192.168.22.105.2865 > 192.168.31.255.39213: udp 112
15:22:31.935798 802.1d config 8001.00:09:7c:f6:4b:00.802d root 8000.00:0b:ac:14:37:40 pathcost 19 age 1 max 20 hello 2 fdelay 15 
15:22:31.980592 2:1:0:0:0:0 ff:ff:ff:ff:ff:ff 886f 1510: 
			 bf01 dec0 0302 0000 0100 0000 0000 0000
			 0000 0000 0000 0000 0300 0200 a859 5e40
			 0000 0000 0000 3010 0000 0000 00f0 ff6f
			 0000 0000 0000 0000 0000 0000 0000 0000
			 0000 0000 0000 0000 0000 0000 0000 0000
			 0000
15:22:32.026414 arp who-has 192.168.20.23 tell 192.168.20.6
15:22:32.026510 arp who-has 192.168.20.6 tell 192.168.20.23
15:22:32.147504 IP 61.129.59.81.6661 > 192.168.27.100.1207: P 1258:1543(285) ack 31 win 6432 (DF)
15:22:32.148407 IP 192.168.27.100.1207 > 61.129.59.81.6661: P 46:61(15) ack 1543 win 65535 (DF)
15:22:32.182336 (NOV-802.2) 00000001.00:0a:eb:04:94:f8.4018 > 00000000.ff:ff:ff:ff:ff:ff.0452:ipx-sap-nearest-req 0004
15:22:32.242904 IP 192.168.21.97.137 > 192.168.31.255.137: udp 50
15:22:32.247719 (NOV-802.2) 00000001.00:0d:61:99:8c:bc.0455 > 00000000.ff:ff:ff:ff:ff:ff.0455: ipx-netbios 50
15:22:32.420482 IP 192.168.22.105.2866 > 192.168.31.255.39213: udp 824
15:22:32.423822 IP 192.168.20.40.138 > 192.168.20.255.138: udp 179
15:22:32.424030 IP 192.168.20.1.138 > 192.168.31.255.138: udp 201
15:22:32.424048 IP 192.168.20.39.138 > 192.168.255.255.138: udp 201
15:22:32.457920 IP 61.129.59.81.6661 > 192.168.27.100.1207: . ack 46 win 6432 (DF)
15:22:32.480612 2:1:0:0:0:0 ff:ff:ff:ff:ff:ff 886f 1510: 
			 bf01 dec0 0302 0000 0100 0000 0000 0000
			 0000 0000 0000 0000 0300 0200 a859 5e40
			 0000 0000 0000 3010 0000 0000 00f0 ff6f
			 0000 0000 0000 0000 0000 0000 0000 0000
			 0000 0000 0000 0000 0000 0000 0000 0000
			 0000
15:22:32.628090 IP 192.168.20.115.138 > 192.168.20.255.138: udp 201
15:22:32.790602 IP 61.129.59.81.6661 > 192.168.27.100.1207: P 1543:2003(460) ack 61 win 6432 (DF)
15:22:32.793158 IP 192.168.27.100.1207 > 61.129.59.81.6661: P 61:76(15) ack 2003 win 65075 (DF)
15:22:32.844292 (NOV-802.2) 00000001.00:0a:eb:04:94:f8.4018 > 00000000.ff:ff:ff:ff:ff:ff.0452:ipx-sap-nearest-req 0004
15:22:32.918407 arp who-has 192.168.20.3 tell 192.168.20.92
15:22:32.980502 2:1:0:0:0:0 ff:ff:ff:ff:ff:ff 886f 1510: 
			 bf01 dec0 0302 0000 0100 0000 0000 0000
			 0000 0000 0000 0000 0300 0200 a859 5e40
			 0000 0000 0000 3010 0000 0000 00f0 ff6f
			 0000 0000 0000 0000 0000 0000 0000 0000
			 0000 0000 0000 0000 0000 0000 0000 0000
			 0000
15:22:32.992926 IP 192.168.21.97.137 > 192.168.31.255.137: udp 50
15:22:32.996916 (NOV-802.2) 00000001.00:0d:61:99:8c:bc.0455 > 00000000.ff:ff:ff:ff:ff:ff.0455: ipx-netbios 50
15:22:33.029856 IP 192.168.21.133.137 > 192.168.31.255.137: udp 50
15:22:33.043773 (NOV-802.2) 00000001.00:0d:61:99:8c:bc.0455 > 00000000.ff:ff:ff:ff:ff:ff.0455: ipx-netbios 50
15:22:33.480466 2:1:0:0:0:0 ff:ff:ff:ff:ff:ff 886f 1510: 
			 bf01 dec0 0302 0000 0100 0000 0000 0000
			 0000 0000 0000 0000 0300 0200 a859 5e40
			 0000 0000 0000 3010 0000 0000 00f0 ff6f
			 0000 0000 0000 0000 0000 0000 0000 0000
			 0000 0000 0000 0000 0000 0000 0000 0000
			 0000
15:22:33.492280 IP 61.129.59.81.6661 > 192.168.27.100.1207: P 2003:2356(353) ack 76 win 6432 (DF)
15:22:33.493353 IP 192.168.27.100.1207 > 61.129.59.81.6661: P 76:121(45) ack 2356 win 64722 (DF)
15:22:33.506327 (NOV-802.2) 00000001.00:0a:eb:04:94:f8.4018 > 00000000.ff:ff:ff:ff:ff:ff.0452:ipx-sap-nearest-req 0004
15:22:33.550885 arp who-has 192.168.21.168 tell 192.168.18.11
15:22:33.746946 (NOV-802.2) 00000001.00:0d:61:99:8c:bc.0455 > 00000000.ff:ff:ff:ff:ff:ff.0455: ipx-netbios 50
15:22:33.923703 IP 192.168.20.40.138 > 192.168.20.255.138: udp 179
15:22:33.923917 IP 192.168.20.1.138 > 192.168.31.255.138: udp 201
15:22:33.924942 (NOV-802.2) 00000001.00:0d:61:99:8c:bc.0455 > 00000000.ff:ff:ff:ff:ff:ff.0455: ipx-netbios 50
15:22:33.928879 IP 192.168.20.39.138 > 192.168.255.255.138: udp 201
15:22:33.939469 802.1d config 8001.00:09:7c:f6:4b:00.802d root 8000.00:0b:ac:14:37:40 pathcost 19 age 1 max 20 hello 2 fdelay 15 
15:22:33.980486 2:1:0:0:0:0 ff:ff:ff:ff:ff:ff 886f 1510: 
			 bf01 dec0 0302 0000 0100 0000 0000 0000
			 0000 0000 0000 0000 0300 0200 a859 5e40
			 0000 0000 0000 3010 0000 0000 00f0 ff6f
			 0000 0000 0000 0000 0000 0000 0000 0000
			 0000 0000 0000 0000 0000 0000 0000 0000
			 0000
15:22:34.012587 IP 192.168.26.21.138 > 192.168.31.255.138: udp 201
15:22:34.012999 (NOV-802.2) 00000001.00:0a:eb:07:d4:60.0455 > 00000000.ff:ff:ff:ff:ff:ff.0455: ipx-netbios 50
15:22:34.014365 (NOV-802.2) 00000001.00:0a:eb:07:d4:60.0553 > 00000000.ff:ff:ff:ff:ff:ff.0553: ipx-nwlink-dgm 187
15:22:34.125652 IP 61.129.59.81.6661 > 192.168.27.100.1207: P 2356:2749(393) ack 121 win 6432 (DF)
15:22:34.128528 IP 192.168.27.100.1207 > 61.129.59.81.6661: P 121:136(15) ack 2749 win 64329 (DF)
15:22:34.168267 (NOV-802.2) 00000001.00:0a:eb:04:94:f8.4018 > 00000000.ff:ff:ff:ff:ff:ff.0452:ipx-sap-nearest-req 0004
15:22:34.275866 arp who-has 192.168.18.1 tell 192.168.20.36
15:22:34.293700 IP 192.168.22.105.2867 > 192.168.31.255.39213: udp 268
15:22:34.293917 IP 192.168.22.105.2868 > 192.168.31.255.39213: udp 112
15:22:34.480444 2:1:0:0:0:0 ff:ff:ff:ff:ff:ff 886f 1510: 
			 bf01 dec0 0302 0000 0100 0000 0000 0000
			 0000 0000 0000 0000 0300 0200 a859 5e40
			 0000 0000 0000 3010 0000 0000 00f0 ff6f
			 0000 0000 0000 0000 0000 0000 0000 0000
			 0000 0000 0000 0000 0000 0000 0000 0000
			 0000
15:22:34.498675 (NOV-802.2) 00000001.52:54:ab:dd:3d:46.0553 > 00000000.ff:ff:ff:ff:ff:ff.0553: ipx-nwlink-dgm 187
15:22:34.499217 IP 192.168.27.153.138 > 192.168.31.255.138: udp 201
15:22:34.499538 52:54:ab:dd:3d:46 > 3:0:0:0:0:1 sap f0 ui/C len=163
15:22:34.742935 IP 61.129.59.81.6661 > 192.168.27.100.1207: P 2749:3102(353) ack 136 win 6432 (DF)
15:22:34.744593 IP 192.168.27.100.1207 > 61.129.59.81.6661: P 136:181(45) ack 3102 win 65535 (DF)
15:22:34.793806 (NOV-802.2) 00000001.00:0d:61:99:8c:bc.0455 > 00000000.ff:ff:ff:ff:ff:ff.0455: ipx-netbios 50
15:22:34.830269 (NOV-802.2) 00000001.00:0a:eb:04:94:f8.4018 > 00000000.ff:ff:ff:ff:ff:ff.0452:ipx-sap-nearest-req 0004
15:22:34.980594 2:1:0:0:0:0 ff:ff:ff:ff:ff:ff 886f 1510: 
			 bf01 dec0 0302 0000 0100 0000 0000 0000
			 0000 0000 0000 0000 0300 0200 a859 5e40
			 0000 0000 0000 3010 0000 0000 00f0 ff6f
			 0000 0000 0000 0000 0000 0000 0000 0000
			 0000 0000 0000 0000 0000 0000 0000 0000
			 0000
15:22:35.366749 IP 61.129.59.81.6661 > 192.168.27.100.1207: P 3102:3387(285) ack 181 win 6432 (DF)
15:22:35.369516 IP 192.168.27.100.1207 > 61.129.59.81.6661: P 181:286(105) ack 3387 win 65250 (DF)
15:22:35.423812 IP 192.168.20.40.138 > 192.168.20.255.138: udp 179
15:22:35.425005 IP 192.168.20.1.138 > 192.168.31.255.138: udp 201
15:22:35.429137 IP 192.168.20.39.138 > 192.168.255.255.138: udp 201
15:22:35.485936 2:1:0:0:0:0 ff:ff:ff:ff:ff:ff 886f 1510: 
			 bf01 dec0 0302 0000 0100 0000 0000 0000
			 0000 0000 0000 0000 0300 0200 a859 5e40
			 0000 0000 0000 3010 0000 0000 00f0 ff6f
			 0000 0000 0000 0000 0000 0000 0000 0000
			 0000 0000 0000 0000 0000 0000 0000 0000
			 0000
15:22:35.492272 (NOV-802.2) 00000001.00:0a:eb:04:94:f8.4018 > 00000000.ff:ff:ff:ff:ff:ff.0452:ipx-sap-req 0004
15:22:35.518709 0:9:7c:f6:4b:2d > 1:0:c:cc:cc:cc sap aa ui/C len=35
15:22:35.518791 0:9:7c:f6:4b:2d > 1:0:c:0:0:0 sap aa ui/C len=65
15:22:35.545470 IP 192.168.22.105.2869 > 192.168.31.255.39213: udp 824
15:22:35.937863 802.1d config 8001.00:09:7c:f6:4b:00.802d root 8000.00:0b:ac:14:37:40 pathcost 19 age 1 max 20 hello 2 fdelay 15 
15:22:35.980406 2:1:0:0:0:0 ff:ff:ff:ff:ff:ff 886f 1510: 
			 bf01 dec0 0302 0000 0100 0000 0000 0000
			 0000 0000 0000 0000 0300 0200 a859 5e40
			 0000 0000 0000 3010 0000 0000 00f0 ff6f
			 0000 0000 0000 0000 0000 0000 0000 0000
			 0000 0000 0000 0000 0000 0000 0000 0000
			 0000
15:22:35.996510 IP 61.129.59.81.6661 > 192.168.27.100.1207: P 3387:3872(485) ack 286 win 6432 (DF)
15:22:35.997661 IP 192.168.27.100.1207 > 61.129.59.81.6661: P 286:361(75) ack 3872 win 64765 (DF)
15:22:35.998092 (NOV-802.2) 00000001.52:54:ab:dd:3d:46.0553 > 00000000.ff:ff:ff:ff:ff:ff.0553: ipx-nwlink-dgm 187
15:22:35.998706 IP 192.168.27.153.138 > 192.168.31.255.138: udp 201
15:22:35.999046 52:54:ab:dd:3d:46 > 3:0:0:0:0:1 sap f0 ui/C len=163
15:22:36.154273 (NOV-802.2) 00000001.00:0a:eb:04:94:f8.4018 > 00000000.ff:ff:ff:ff:ff:ff.0452:ipx-sap-req 0004
15:22:36.254241 arp who-has 192.168.18.1 tell 192.168.21.113
15:22:36.480399 2:1:0:0:0:0 ff:ff:ff:ff:ff:ff 886f 1510: 
			 bf01 dec0 0302 0000 0100 0000 0000 0000
			 0000 0000 0000 0000 0300 0200 a859 5e40
			 0000 0000 0000 3010 0000 0000 00f0 ff6f
			 0000 0000 0000 0000 0000 0000 0000 0000
			 0000 0000 0000 0000 0000 0000 0000 0000
			 0000
15:22:36.480570 IP 192.168.21.97.137 > 192.168.31.255.137: udp 50
15:22:36.554603 arp who-has 192.168.21.113 tell 192.168.18.11
15:22:36.638807 IP 61.129.59.81.6661 > 192.168.27.100.1207: P 3872:4397(525) ack 361 win 6432 (DF)
15:22:36.641479 IP 192.168.27.100.1207 > 61.129.59.81.6661: P 361:391(30) ack 4397 win 64240 (DF)
15:22:36.793559 IP 192.168.22.105.2870 > 192.168.31.255.39213: udp 268
15:22:36.793777 IP 192.168.22.105.2871 > 192.168.31.255.39213: udp 112
15:22:36.816250 (NOV-802.2) 00000001.00:0a:eb:04:94:f8.4018 > 00000000.ff:ff:ff:ff:ff:ff.0452:ipx-sap-req 0004
15:22:36.923665 IP 192.168.20.40.138 > 192.168.20.255.138: udp 179
15:22:36.924948 IP 192.168.20.1.138 > 192.168.31.255.138: udp 201
15:22:36.944062 IP 192.168.20.39.138 > 192.168.255.255.138: udp 201
15:22:36.945091 IP 192.168.22.14.137 > 192.168.31.255.137: udp 50
15:22:36.980369 2:1:0:0:0:0 ff:ff:ff:ff:ff:ff 886f 1510: 
			 bf01 dec0 0302 0000 0100 0000 0000 0000
			 0000 0000 0000 0000 0300 0200 a859 5e40
			 0000 0000 0000 3010 0000 0000 00f0 ff6f
			 0000 0000 0000 0000 0000 0000 0000 0000
			 0000 0000 0000 0000 0000 0000 0000 0000
			 0000
15:22:37.236218 IP 192.168.21.97.137 > 192.168.31.255.137: udp 50
15:22:37.296525 IP 61.129.59.81.6661 > 192.168.27.100.1207: P 4397:4946(549) ack 391 win 6432 (DF)
15:22:37.299521 IP 192.168.27.100.1207 > 61.129.59.81.6661: P 391:421(30) ack 4946 win 65535 (DF)
15:22:37.487805 (NOV-802.2) 00000001.00:0a:eb:04:94:f8.4018 > 00000000.ff:ff:ff:ff:ff:ff.0452:ipx-sap-req 0004
15:22:37.487867 2:1:0:0:0:0 ff:ff:ff:ff:ff:ff 886f 1510: 
			 bf01 dec0 0302 0000 0100 0000 0000 0000
			 0000 0000 0000 0000 0300 0200 a859 5e40
			 0000 0000 0000 3010 0000 0000 00f0 ff6f
			 0000 0000 0000 0000 0000 0000 0000 0000
			 0000 0000 0000 0000 0000 0000 0000 0000
			 0000
15:22:37.498082 (NOV-802.2) 00000001.52:54:ab:dd:3d:46.0553 > 00000000.ff:ff:ff:ff:ff:ff.0553: ipx-nwlink-dgm 187
15:22:37.498747 IP 192.168.27.153.138 > 192.168.31.255.138: udp 201
15:22:37.498960 52:54:ab:dd:3d:46 > 3:0:0:0:0:1 sap f0 ui/C len=163
15:22:37.581522 arp who-has 192.168.26.41 tell 192.168.22.76
15:22:37.590880 IP 192.168.22.115.137 > 192.168.31.255.137: udp 50
15:22:37.931758 (NOV-802.2) 00000001.00:0a:eb:4d:06:a3.0453 > 00000001.ff:ff:ff:ff:ff:ff.0453:ipx-rip-resp 1000156433/1.2
15:22:37.936245 IP 61.129.59.81.6661 > 192.168.27.100.1207: P 4946:5233(287) ack 421 win 6432 (DF)
15:22:37.938854 IP 192.168.27.100.1207 > 61.129.59.81.6661: P 421:511(90) ack 5233 win 65248 (DF)
15:22:37.939263 802.1d config 8001.00:09:7c:f6:4b:00.802d root 8000.00:0b:ac:14:37:40 pathcost 19 age 1 max 20 hello 2 fdelay 15 
15:22:37.980361 2:1:0:0:0:0 ff:ff:ff:ff:ff:ff 886f 1510: 
			 bf01 dec0 0302 0000 0100 0000 0000 0000
			 0000 0000 0000 0000 0300 0200 a859 5e40
			 0000 0000 0000 3010 0000 0000 00f0 ff6f
			 0000 0000 0000 0000 0000 0000 0000 0000
			 0000 0000 0000 0000 0000 0000 0000 0000
			 0000
15:22:37.980479 IP 192.168.21.97.137 > 192.168.31.255.137: udp 50
15:22:37.993135 (NOV-802.2) 00000001.00:04:61:45:09:1a.0553 > 00000000.ff:ff:ff:ff:ff:ff.0553: ipx-nwlink-dgm 187
15:22:37.996726 (NOV-802.2) 00000001.00:04:61:45:09:1a.0455 > 00000000.ff:ff:ff:ff:ff:ff.0455: ipx-netbios 50
15:22:38.340701 IP 192.168.22.115.137 > 192.168.31.255.137: udp 50
15:22:38.423651 IP 192.168.20.40.138 > 192.168.20.255.138: udp 191
15:22:38.480402 2:1:0:0:0:0 ff:ff:ff:ff:ff:ff 886f 1510: 
			 bf01 dec0 0302 0000 0100 0000 0000 0000
			 0000 0000 0000 0000 0300 0200 a859 5e40
			 0000 0000 0000 3010 0000 0000 00f0 ff6f
			 0000 0000 0000 0000 0000 0000 0000 0000
			 0000 0000 0000 0000 0000 0000 0000 0000
			 0000
15:22:38.522156 IP 192.168.20.39.138 > 192.168.255.255.138: udp 195
15:22:38.527594 IP 192.168.20.1.138 > 192.168.31.255.138: udp 193
15:22:38.592138 IP 61.129.59.81.6661 > 192.168.27.100.1207: P 5233:5610(377) ack 511 win 6432 (DF)
15:22:38.593214 IP 192.168.27.100.1207 > 61.129.59.81.6661: P 511:586(75) ack 5610 win 64871 (DF)
15:22:38.670193 IP 192.168.22.105.2872 > 192.168.31.255.39213: udp 824
15:22:38.779707 (NOV-802.2) 00000001.00:04:61:45:09:1a.0455 > 00000000.ff:ff:ff:ff:ff:ff.0455: ipx-netbios 50
15:22:38.967751 IP 192.168.22.14.137 > 192.168.31.255.137: udp 50
15:22:38.986378 2:1:0:0:0:0 ff:ff:ff:ff:ff:ff 886f 1510: 
			 bf01 dec0 0302 0000 0100 0000 0000 0000
			 0000 0000 0000 0000 0300 0200 a859 5e40
			 0000 0000 0000 3010 0000 0000 00f0 ff6f
			 0000 0000 0000 0000 0000 0000 0000 0000
			 0000 0000 0000 0000 0000 0000 0000 0000
			 0000
15:22:38.998051 (NOV-802.2) 00000001.52:54:ab:dd:3d:46.0553 > 00000000.ff:ff:ff:ff:ff:ff.0553: ipx-nwlink-dgm 187
15:22:38.998598 IP 192.168.27.153.138 > 192.168.31.255.138: udp 201
15:22:38.998918 52:54:ab:dd:3d:46 > 3:0:0:0:0:1 sap f0 ui/C len=163
15:22:39.090633 IP 192.168.22.115.137 > 192.168.31.255.137: udp 50
15:22:39.242381 IP 61.129.59.81.6661 > 192.168.27.100.1207: P 5610:6197(587) ack 586 win 6432 (DF)
15:22:39.244997 IP 192.168.27.100.1207 > 61.129.59.81.6661: P 586:676(90) ack 6197 win 64284 (DF)
15:22:39.293477 IP 192.168.22.105.2873 > 192.168.31.255.39213: udp 268
15:22:39.293723 IP 192.168.22.105.2874 > 192.168.31.255.39213: udp 112
15:22:39.423648 IP 192.168.20.40.138 > 192.168.20.255.138: udp 191
15:22:39.444160 IP 192.168.20.39.138 > 192.168.255.255.138: udp 195
15:22:39.480263 2:1:0:0:0:0 ff:ff:ff:ff:ff:ff 886f 1510: 
			 bf01 dec0 0302 0000 0100 0000 0000 0000
			 0000 0000 0000 0000 0300 0200 a859 5e40
			 0000 0000 0000 3010 0000 0000 00f0 ff6f
			 0000 0000 0000 0000 0000 0000 0000 0000
			 0000 0000 0000 0000 0000 0000 0000 0000
			 0000
15:22:39.511965 IP 192.168.20.1.138 > 192.168.31.255.138: udp 193
15:22:39.562698 (NOV-802.2) 00000001.00:04:61:45:09:1a.0455 > 00000000.ff:ff:ff:ff:ff:ff.0455: ipx-netbios 50
15:22:39.710129 IP 192.168.22.14.137 > 192.168.31.255.137: udp 50
15:22:39.793728 (NOV-802.2) 00000001.00:0d:61:99:8c:bc.0455 > 00000000.ff:ff:ff:ff:ff:ff.0455: ipx-netbios 50
15:22:39.888720 IP 61.129.59.81.6661 > 192.168.27.100.1207: P 6197:6811(614) ack 676 win 6432 (DF)
15:22:39.890236 IP 192.168.27.100.1207 > 61.129.59.81.6661: P 676:721(45) ack 6811 win 65535 (DF)
15:22:39.938937 802.1d config 8001.00:09:7c:f6:4b:00.802d root 8000.00:0b:ac:14:37:40 pathcost 19 age 1 max 20 hello 2 fdelay 15 
15:22:39.980295 2:1:0:0:0:0 ff:ff:ff:ff:ff:ff 886f 1510: 
			 bf01 dec0 0302 0000 0100 0000 0000 0000
			 0000 0000 0000 0000 0300 0200 a859 5e40
			 0000 0000 0000 3010 0000 0000 00f0 ff6f
			 0000 0000 0000 0000 0000 0000 0000 0000
			 0000 0000 0000 0000 0000 0000 0000 0000
			 0000
15:22:40.345740 (NOV-802.2) 00000001.00:04:61:45:09:1a.0455 > 00000001.ff:ff:ff:ff:ff:ff.0455: ipx-netbios 153
15:22:40.345874 0:4:61:45:9:1a > 3:0:0:0:0:1 sap f0 ui/C len=163
15:22:40.347199 IP 192.168.20.193.138 > 192.168.31.255.138: udp 201
15:22:40.374896 arp who-has 192.168.18.4 tell 192.168.21.168
15:22:40.423603 IP 192.168.20.40.138 > 192.168.20.255.138: udp 191
15:22:40.453967 IP 192.168.20.1.138 > 192.168.31.255.138: udp 193
15:22:40.465951 IP 192.168.22.14.137 > 192.168.31.255.137: udp 50
15:22:40.487247 2:1:0:0:0:0 ff:ff:ff:ff:ff:ff 886f 1510: 
			 bf01 dec0 0302 0000 0100 0000 0000 0000
			 0000 0000 0000 0000 0300 0200 a859 5e40
			 0000 0000 0000 3010 0000 0000 00f0 ff6f
			 0000 0000 0000 0000 0000 0000 0000 0000
			 0000 0000 0000 0000 0000 0000 0000 0000
			 0000
15:22:40.487279 arp who-has 192.168.20.3 tell 127.0.0.1
15:22:40.497397 IP 192.168.21.133.137 > 192.168.31.255.137: udp 68
15:22:40.500789 IP 192.168.21.97.137 > 192.168.31.255.137: udp 50
15:22:40.506428 IP 192.168.20.39.138 > 192.168.255.255.138: udp 195
15:22:40.526044 IP 61.129.59.81.6661 > 192.168.27.100.1207: P 6811:7603(792) ack 721 win 6432 (DF)
15:22:40.528665 IP 192.168.27.100.1207 > 61.129.59.81.6661: P 721:871(150) ack 7603 win 64743 (DF)
15:22:40.543697 (NOV-802.2) 00000001.00:0d:61:99:8c:bc.0455 > 00000000.ff:ff:ff:ff:ff:ff.0455: ipx-netbios 50
15:22:40.668727 (NOV-802.2) 00000001.00:0d:61:99:8c:bc.0455 > 00000000.ff:ff:ff:ff:ff:ff.0455: ipx-netbios 50
15:22:40.966521 0:a:eb:13:23:12 > 3:0:0:0:0:1 sap f0 ui/C len=44
15:22:40.980318 2:1:0:0:0:0 ff:ff:ff:ff:ff:ff 886f 1510: 
			 bf01 dec0 0302 0000 0100 0000 0000 0000
			 0000 0000 0000 0000 0300 0200 a859 5e40
			 0000 0000 0000 3010 0000 0000 00f0 ff6f
			 0000 0000 0000 0000 0000 0000 0000 0000
			 0000 0000 0000 0000 0000 0000 0000 0000
			 0000
15:22:41.181131 IP 61.129.59.81.6661 > 192.168.27.100.1207: P 7603:8267(664) ack 871 win 6432 (DF)
15:22:41.182944 IP 192.168.27.100.1207 > 61.129.59.81.6661: P 871:1036(165) ack 8267 win 64079 (DF)
15:22:41.246824 IP 192.168.21.133.137 > 192.168.31.255.137: udp 68
15:22:41.250592 IP 192.168.21.97.137 > 192.168.31.255.137: udp 50
15:22:41.418673 (NOV-802.2) 00000001.00:0d:61:99:8c:bc.0455 > 00000000.ff:ff:ff:ff:ff:ff.0455: ipx-netbios 50
15:22:41.423580 IP 192.168.20.40.138 > 192.168.20.255.138: udp 191
15:22:41.449328 IP 192.168.20.1.138 > 192.168.31.255.138: udp 193
15:22:41.480200 2:1:0:0:0:0 ff:ff:ff:ff:ff:ff 886f 1510: 
			 bf01 dec0 0302 0000 0100 0000 0000 0000
			 0000 0000 0000 0000 0300 0200 a859 5e40
			 0000 0000 0000 3010 0000 0000 00f0 ff6f
			 0000 0000 0000 0000 0000 0000 0000 0000
			 0000 0000 0000 0000 0000 0000 0000 0000
			 0000
15:22:41.481099 0:a:eb:13:23:12 > 3:0:0:0:0:1 sap f0 ui/C len=44
15:22:41.490808 IP 192.168.20.39.138 > 192.168.255.255.138: udp 195
15:22:41.543713 (NOV-802.2) 00000001.00:0d:61:99:8c:bc.0455 > 00000000.ff:ff:ff:ff:ff:ff.0455: ipx-netbios 50
15:22:41.644732 IP 192.168.21.113.138 > 192.168.31.255.138: udp 201
15:22:41.793346 IP 192.168.22.105.2875 > 192.168.31.255.39213: udp 268
15:22:41.795655 IP 192.168.22.105.2876 > 192.168.31.255.39213: udp 824
15:22:41.795918 IP 192.168.22.105.2877 > 192.168.31.255.39213: udp 112
15:22:41.855832 IP 61.129.59.81.6661 > 192.168.27.100.1207: P 8267:9362(1095) ack 1036 win 6432 (DF)
15:22:41.858839 IP 192.168.27.100.1207 > 61.129.59.81.6661: P 1036:1156(120) ack 9362 win 65535 (DF)
15:22:41.938864 802.1d config 8001.00:09:7c:f6:4b:00.802d root 8000.00:0b:ac:14:37:40 pathcost 19 age 1 max 20 hello 2 fdelay 15 
15:22:41.980265 2:1:0:0:0:0 ff:ff:ff:ff:ff:ff 886f 1510: 
			 bf01 dec0 0302 0000 0100 0000 0000 0000
			 0000 0000 0000 0000 0300 0200 a859 5e40
			 0000 0000 0000 3010 0000 0000 00f0 ff6f
			 0000 0000 0000 0000 0000 0000 0000 0000
			 0000 0000 0000 0000 0000 0000 0000 0000
			 0000
15:22:41.996825 IP 192.168.21.133.137 > 192.168.31.255.137: udp 68
15:22:42.000572 IP 192.168.21.97.137 > 192.168.31.255.137: udp 50
15:22:42.022879 0:a:eb:13:23:12 > 3:0:0:0:0:1 sap f0 ui/C len=44
15:22:42.263155 arp who-has 192.168.21.113 tell 127.0.0.1
15:22:42.280750 IP 192.168.21.113.137 > 192.168.31.255.137: udp 50
15:22:42.293664 (NOV-802.2) 00000001.00:0d:61:99:8c:bc.0455 > 00000000.ff:ff:ff:ff:ff:ff.0455: ipx-netbios 50
15:22:42.411360 (NOV-802.2) 00000001.00:0a:eb:07:d4:60.0455 > 00000000.ff:ff:ff:ff:ff:ff.0455: ipx-netbios 50
15:22:42.423609 IP 192.168.20.40.137 > 192.168.20.255.137: udp 68
15:22:42.423786 arp who-has 192.168.20.40 tell 192.168.20.1
15:22:42.423836 arp who-has 192.168.20.40 tell 192.168.20.39
15:22:42.449304 IP 192.168.20.1.138 > 192.168.31.255.138: udp 193
15:22:42.480216 2:1:0:0:0:0 ff:ff:ff:ff:ff:ff 886f 1510: 
			 bf01 dec0 0302 0000 0100 0000 0000 0000
			 0000 0000 0000 0000 0300 0200 a859 5e40
			 0000 0000 0000 3010 0000 0000 00f0 ff6f
			 0000 0000 0000 0000 0000 0000 0000 0000
			 0000 0000 0000 0000 0000 0000 0000 0000
			 0000
15:22:42.490804 IP 192.168.20.39.138 > 192.168.255.255.138: udp 195
15:22:42.508717 IP 61.129.59.81.6661 > 192.168.27.100.1207: P 9362:10239(877) ack 1156 win 6432 (DF)
15:22:42.510546 IP 192.168.27.100.1207 > 61.129.59.81.6661: P 1156:1201(45) ack 10239 win 64658 (DF)
15:22:42.535918 0:a:eb:13:23:12 > 3:0:0:0:0:1 sap f0 ui/C len=44
15:22:42.746840 IP 192.168.21.133.137 > 192.168.31.255.137: udp 68
15:22:42.804358 arp who-has 192.168.27.33 tell 192.168.18.28
15:22:42.804492 arp who-has 192.168.18.28 tell 192.168.27.33
15:22:42.911671 arp who-has 192.168.18.4 tell 192.168.21.168
15:22:42.911755 arp who-has 192.168.18.4 tell 192.168.21.168
15:22:42.980238 2:1:0:0:0:0 ff:ff:ff:ff:ff:ff 886f 1510: 
			 bf01 dec0 0302 0000 0100 0000 0000 0000
			 0000 0000 0000 0000 0300 0200 a859 5e40
			 0000 0000 0000 3010 0000 0000 00f0 ff6f
			 0000 0000 0000 0000 0000 0000 0000 0000
			 0000 0000 0000 0000 0000 0000 0000 0000
			 0000
15:22:43.010362 arp who-has 192.168.21.87 tell 192.168.21.2
15:22:43.018886 IP 192.168.21.113.137 > 192.168.31.255.137: udp 50
15:22:43.050847 0:a:eb:13:23:12 > 3:0:0:0:0:1 sap f0 ui/C len=44
15:22:43.188236 IP 61.129.59.81.6661 > 192.168.27.100.1207: P 10239:11063(824) ack 1201 win 6432 (DF)
15:22:43.188460 arp who-has 192.168.18.4 tell 192.168.21.168
15:22:43.192689 IP 192.168.27.100.1207 > 61.129.59.81.6661: P 1201:1216(15) ack 11063 win 65535 (DF)
15:22:43.400458 (NOV-802.2) 3b9d2d11.00:00:00:00:00:01.0455 > 00000000.ff:ff:ff:ff:ff:ff.0455: ipx-netbios 50
15:22:43.449317 IP 192.168.20.1.138 > 192.168.31.255.138: udp 193
15:22:43.480119 2:1:0:0:0:0 ff:ff:ff:ff:ff:ff 886f 1510: 
			 bf01 dec0 0302 0000 0100 0000 0000 0000
			 0000 0000 0000 0000 0300 0200 a859 5e40
			 0000 0000 0000 3010 0000 0000 00f0 ff6f
			 0000 0000 0000 0000 0000 0000 0000 0000
			 0000 0000 0000 0000 0000 0000 0000 0000
			 0000
15:22:43.490814 IP 192.168.20.39.138 > 192.168.255.255.138: udp 195
15:22:43.505459 IP 192.168.21.133.138 > 192.168.31.255.138: udp 182
15:22:43.505723 IP 192.168.21.1.138 > 192.168.31.255.138: udp 201
15:22:43.505867 IP 192.168.21.2.138 > 192.168.31.255.138: udp 201
15:22:43.570735 0:a:eb:13:23:12 > 3:0:0:0:0:1 sap f0 ui/C len=44
15:22:43.768909 IP 192.168.21.113.137 > 192.168.31.255.137: udp 50
15:22:43.857268 IP 61.129.59.81.6661 > 192.168.27.100.1207: P 11063:11700(637) ack 1216 win 6432 (DF)
15:22:43.858384 IP 192.168.27.100.1207 > 61.129.59.81.6661: P 1216:1261(45) ack 11700 win 64898 (DF)
15:22:43.942561 802.1d config 8001.00:09:7c:f6:4b:00.802d root 8000.00:0b:ac:14:37:40 pathcost 19 age 1 max 20 hello 2 fdelay 15 
15:22:43.980136 2:1:0:0:0:0 ff:ff:ff:ff:ff:ff 886f 1510: 
			 bf01 dec0 0302 0000 0100 0000 0000 0000
			 0000 0000 0000 0000 0300 0200 a859 5e40
			 0000 0000 0000 3010 0000 0000 00f0 ff6f
			 0000 0000 0000 0000 0000 0000 0000 0000
			 0000 0000 0000 0000 0000 0000 0000 0000
			 0000
15:22:44.282491 (NOV-802.2) 3b9d2d11.00:00:00:00:00:01.0455 > 00000000.ff:ff:ff:ff:ff:ff.0455: ipx-netbios 50
15:22:44.293220 IP 192.168.22.105.2878 > 192.168.31.255.39213: udp 268
15:22:44.293478 IP 192.168.22.105.2879 > 192.168.31.255.39213: udp 112
15:22:44.449233 IP 192.168.20.1.138 > 192.168.31.255.138: udp 193
15:22:44.480173 2:1:0:0:0:0 ff:ff:ff:ff:ff:ff 886f 1510: 
			 bf01 dec0 0302 0000 0100 0000 0000 0000
			 0000 0000 0000 0000 0300 0200 a859 5e40
			 0000 0000 0000 3010 0000 0000 00f0 ff6f
			 0000 0000 0000 0000 0000 0000 0000 0000
			 0000 0000 0000 0000 0000 0000 0000 0000
			 0000
15:22:44.485508 IP 61.129.59.81.6661 > 192.168.27.100.1207: P 11700:12257(557) ack 1261 win 6432 (DF)
15:22:44.488017 IP 192.168.27.100.1207 > 61.129.59.81.6661: P 1261:1291(30) ack 12257 win 64341 (DF)
15:22:44.490882 IP 192.168.20.39.138 > 192.168.255.255.138: udp 195
15:22:44.920038 IP 192.168.22.105.2880 > 192.168.31.255.39213: udp 824
15:22:44.980070 2:1:0:0:0:0 ff:ff:ff:ff:ff:ff 886f 1510: 
			 bf01 dec0 0302 0000 0100 0000 0000 0000
			 0000 0000 0000 0000 0300 0200 a859 5e40
			 0000 0000 0000 3010 0000 0000 00f0 ff6f
			 0000 0000 0000 0000 0000 0000 0000 0000
			 0000 0000 0000 0000 0000 0000 0000 0000
			 0000
15:22:45.150330 (NOV-802.2) 3b9d2d11.00:00:00:00:00:01.0455 > 00000000.ff:ff:ff:ff:ff:ff.0455: ipx-netbios 50
15:22:45.157933 IP 61.129.59.81.6661 > 192.168.27.100.1207: P 12257:12904(647) ack 1291 win 6432 (DF)
15:22:45.158696 IP 192.168.27.100.1207 > 61.129.59.81.6661: P 1291:1328(37) ack 12904 win 65535 (DF)
15:22:45.449246 IP 192.168.20.1.138 > 192.168.31.255.138: udp 201
15:22:45.480123 2:1:0:0:0:0 ff:ff:ff:ff:ff:ff 886f 1510: 
			 bf01 dec0 0302 0000 0100 0000 0000 0000
			 0000 0000 0000 0000 0300 0200 a859 5e40
			 0000 0000 0000 3010 0000 0000 00f0 ff6f
			 0000 0000 0000 0000 0000 0000 0000 0000
			 0000 0000 0000 0000 0000 0000 0000 0000
			 0000
15:22:45.526732 IP 192.168.20.39.138 > 192.168.255.255.138: udp 201
15:22:45.828157 IP 61.129.59.81.6661 > 192.168.27.100.1207: P 12904:13780(876) ack 1328 win 6432 (DF)
15:22:45.830945 IP 192.168.27.100.1207 > 61.129.59.81.6661: P 1328:1362(34) ack 13780 win 64659 (DF)
15:22:45.942013 802.1d config 8001.00:09:7c:f6:4b:00.802d root 8000.00:0b:ac:14:37:40 pathcost 19 age 1 max 20 hello 2 fdelay 15 
15:22:45.985762 2:1:0:0:0:0 ff:ff:ff:ff:ff:ff 886f 1510: 
			 bf01 dec0 0302 0000 0100 0000 0000 0000
			 0000 0000 0000 0000 0300 0200 a859 5e40
			 0000 0000 0000 3010 0000 0000 00f0 ff6f
			 0000 0000 0000 0000 0000 0000 0000 0000
			 0000 0000 0000 0000 0000 0000 0000 0000
			 0000
15:22:45.995855 arp who-has 192.168.18.1 tell 192.168.26.73
15:22:46.017442 arp who-has 192.168.20.3 tell 192.168.20.133
15:22:46.025437 (NOV-802.2) 3b9d2d11.00:00:00:00:00:01.0455 > 00000001.ff:ff:ff:ff:ff:ff.0455: ipx-netbios 142
15:22:46.128165 arp who-has 192.168.18.4 tell 192.168.21.168
15:22:46.314982 IP 192.168.20.144.137 > 192.168.31.255.137: udp 50
15:22:46.332819 (NOV-802.2) 00000001.52:54:ab:19:e1:65.4022 > 00000000.ff:ff:ff:ff:ff:ff.0452:ipx-sap-req 0004
15:22:46.480051 2:1:0:0:0:0 ff:ff:ff:ff:ff:ff 886f 1510: 
			 bf01 dec0 0302 0000 0100 0000 0000 0000
			 0000 0000 0000 0000 0300 0200 a859 5e40
			 0000 0000 0000 3010 0000 0000 00f0 ff6f
			 0000 0000 0000 0000 0000 0000 0000 0000
			 0000 0000 0000 0000 0000 0000 0000 0000
			 0000
15:22:46.501929 arp who-has 192.168.26.65 tell 192.168.26.73
15:22:46.566563 IP 61.129.59.81.6661 > 192.168.27.100.1207: P 13780:14651(871) ack 1362 win 6432 (DF)
15:22:46.569569 IP 192.168.27.100.1207 > 61.129.59.81.6661: P 1362:1467(105) ack 14651 win 65535 (DF)
15:22:46.570931 IP 192.168.18.66.3052 > 192.168.31.255.3052: udp 471
15:22:46.772522 arp who-has 192.168.26.63 tell 192.168.26.37
15:22:46.793345 IP 192.168.22.105.2881 > 192.168.31.255.39213: udp 268
15:22:46.793437 IP 192.168.22.105.2882 > 192.168.31.255.39213: udp 112
15:22:46.835517 IP 192.168.21.123.138 > 192.168.21.255.138: udp 176
15:22:46.835845 IP 192.168.21.1.138 > 192.168.31.255.138: udp 201
15:22:46.836082 IP 192.168.21.2.138 > 192.168.31.255.138: udp 201
15:22:46.980024 2:1:0:0:0:0 ff:ff:ff:ff:ff:ff 886f 1510: 
			 bf01 dec0 0302 0000 0100 0000 0000 0000
			 0000 0000 0000 0000 0300 0200 a859 5e40
			 0000 0000 0000 3010 0000 0000 00f0 ff6f
			 0000 0000 0000 0000 0000 0000 0000 0000
			 0000 0000 0000 0000 0000 0000 0000 0000
			 0000
15:22:47.064820 IP 192.168.20.144.137 > 192.168.31.255.137: udp 50
15:22:47.189347 (NOV-802.2) 00000001.00:0a:eb:13:24:c5.0455 > 00000000.ff:ff:ff:ff:ff:ff.0455: ipx-netbios 50
15:22:47.228098 IP 61.129.59.81.6661 > 192.168.27.100.1207: P 14651:15529(878) ack 1467 win 6432 (DF)
15:22:47.230792 IP 192.168.27.100.1207 > 61.129.59.81.6661: P 1467:1579(112) ack 15529 win 64657 (DF)
15:22:47.480004 2:1:0:0:0:0 ff:ff:ff:ff:ff:ff 886f 1510: 
			 bf01 dec0 0302 0000 0100 0000 0000 0000
			 0000 0000 0000 0000 0300 0200 a859 5e40
			 0000 0000 0000 3010 0000 0000 00f0 ff6f
			 0000 0000 0000 0000 0000 0000 0000 0000
			 0000 0000 0000 0000 0000 0000 0000 0000
			 0000
15:22:47.712404 (NOV-802.2) 00000001.00:e0:4c:57:0c:1b.0455 > 00000000.ff:ff:ff:ff:ff:ff.0455: ipx-netbios 50
15:22:47.712884 (NOV-802.2) 00000001.00:e0:4c:57:0c:1b.0553 > 00000000.ff:ff:ff:ff:ff:ff.0553: ipx-nwlink-dgm 187
15:22:47.713144 IP 192.168.20.120.138 > 192.168.31.255.138: udp 201
15:22:47.814819 IP 192.168.20.144.137 > 192.168.31.255.137: udp 50
15:22:47.892171 IP 61.129.59.81.6661 > 192.168.27.100.1207: P 15529:16413(884) ack 1579 win 6432 (DF)
15:22:47.901915 IP 192.168.27.100.1207 > 61.129.59.81.6661: P 1579:1691(112) ack 16413 win 65535 (DF)
15:22:47.901928 IP 192.168.18.1 > 192.168.27.100: icmp 36: redirect 61.129.59.81 to net 192.168.18.4
15:22:47.946940 802.1d config 8001.00:09:7c:f6:4b:00.802d root 8000.00:0b:ac:14:37:40 pathcost 19 age 1 max 20 hello 2 fdelay 15 
15:22:47.968632 (NOV-802.2) 00000001.00:0a:eb:13:24:c5.0455 > 00000000.ff:ff:ff:ff:ff:ff.0455: ipx-netbios 50
15:22:47.979996 2:1:0:0:0:0 ff:ff:ff:ff:ff:ff 886f 1510: 
			 bf01 dec0 0302 0000 0100 0000 0000 0000
			 0000 0000 0000 0000 0300 0200 a859 5e40
			 0000 0000 0000 3010 0000 0000 00f0 ff6f
			 0000 0000 0000 0000 0000 0000 0000 0000
			 0000 0000 0000 0000 0000 0000 0000 0000
			 0000
15:22:48.044786 IP 192.168.22.105.2883 > 192.168.31.255.39213: udp 824
15:22:48.346218 IP 192.168.21.123.138 > 192.168.21.255.138: udp 176
15:22:48.346419 IP 192.168.21.1.138 > 192.168.31.255.138: udp 201
15:22:48.346597 IP 192.168.21.2.138 > 192.168.31.255.138: udp 201
15:22:48.480003 2:1:0:0:0:0 ff:ff:ff:ff:ff:ff 886f 1510: 
			 bf01 dec0 0302 0000 0100 0000 0000 0000
			 0000 0000 0000 0000 0300 0200 a859 5e40
			 0000 0000 0000 3010 0000 0000 00f0 ff6f
			 0000 0000 0000 0000 0000 0000 0000 0000
			 0000 0000 0000 0000 0000 0000 0000 0000
			 0000
15:22:48.524203 IP 61.129.59.81.6661 > 192.168.27.100.1207: P 16413:17218(805) ack 1691 win 6432 (DF)
15:22:48.526864 IP 192.168.27.100.1207 > 61.129.59.81.6661: P 1691:1766(75) ack 17218 win 64730 (DF)
15:22:48.720390 arp who-has 192.168.18.4 tell 192.168.21.168
15:22:48.747892 (NOV-802.2) 00000001.00:0a:eb:13:24:c5.0455 > 00000000.ff:ff:ff:ff:ff:ff.0455: ipx-netbios 50
15:22:48.959336 (NOV-802.2) 00000001.00:0a:eb:28:cd:ac.0455 > 00000000.ff:ff:ff:ff:ff:ff.0455: ipx-netbios 50
15:22:48.959703 (NOV-802.2) 00000001.00:0a:eb:28:cd:ac.0553 > 00000000.ff:ff:ff:ff:ff:ff.0553: ipx-nwlink-dgm 187
15:22:48.959907 IP 192.168.20.197.138 > 192.168.31.255.138: udp 201
15:22:48.980014 2:1:0:0:0:0 ff:ff:ff:ff:ff:ff 886f 1510: 
			 bf01 dec0 0302 0000 0100 0000 0000 0000
			 0000 0000 0000 0000 0300 0200 a859 5e40
			 0000 0000 0000 3010 0000 0000 00f0 ff6f
			 0000 0000 0000 0000 0000 0000 0000 0000
			 0000 0000 0000 0000 0000 0000 0000 0000
			 0000
15:22:49.203281 IP 61.129.59.81.6661 > 192.168.27.100.1207: P 17218:17844(626) ack 1766 win 6432 (DF)
15:22:49.204416 IP 192.168.27.100.1207 > 61.129.59.81.6661: P 1766:1830(64) ack 17844 win 64104 (DF)
15:22:49.293108 IP 192.168.22.105.2884 > 192.168.31.255.39213: udp 268
15:22:49.293357 IP 192.168.22.105.2885 > 192.168.31.255.39213: udp 112
15:22:49.448142 IP 192.168.27.100 > 192.168.18.10: icmp 8: echo request seq 5376
15:22:49.448343 IP 192.168.18.10 > 192.168.27.100: icmp 8: echo reply seq 5376
15:22:49.479941 2:1:0:0:0:0 ff:ff:ff:ff:ff:ff 886f 1510: 
			 bf01 dec0 0302 0000 0100 0000 0000 0000
			 0000 0000 0000 0000 0300 0200 a859 5e40
			 0000 0000 0000 3010 0000 0000 00f0 ff6f
			 0000 0000 0000 0000 0000 0000 0000 0000
			 0000 0000 0000 0000 0000 0000 0000 0000
			 0000
15:22:49.525197 IP 192.168.27.100 > 192.168.18.10: icmp 1480: echo request seq 5632 (frag 12473:1480@0+)
15:22:49.526390 IP 192.168.27.100 > 192.168.18.10: icmp (frag 12473:576@1480)
15:22:49.527494 IP 192.168.18.10 > 192.168.27.100: icmp 1480: echo reply seq 5632 (frag 20652:1480@0+)
15:22:49.527592 IP 192.168.18.10 > 192.168.27.100: icmp (frag 20652:576@1480)
15:22:49.827362 IP 61.129.59.81.6661 > 192.168.27.100.1207: P 17844:18402(558) ack 1830 win 6432 (DF)
15:22:49.834750 IP 192.168.27.100.1208 > 192.168.18.10.389: udp 210
15:22:49.835506 IP 192.168.18.10.389 > 192.168.27.100.1208: udp 182
15:22:49.846867 IP 192.168.21.123.138 > 192.168.21.255.138: udp 176
15:22:49.847170 IP 192.168.21.1.138 > 192.168.31.255.138: udp 201
15:22:49.847360 IP 192.168.21.2.138 > 192.168.31.255.138: udp 201
15:22:49.884265 IP 192.168.27.100.1207 > 61.129.59.81.6661: P 1830:1845(15) ack 18402 win 65535 (DF)
15:22:49.947490 802.1d config 8001.00:09:7c:f6:4b:00.802d root 8000.00:0b:ac:14:37:40 pathcost 19 age 1 max 20 hello 2 fdelay 15 
15:22:49.979889 2:1:0:0:0:0 ff:ff:ff:ff:ff:ff 886f 1510: 
			 bf01 dec0 0302 0000 0100 0000 0000 0000
			 0000 0000 0000 0000 0300 0200 a859 5e40
			 0000 0000 0000 3010 0000 0000 00f0 ff6f
			 0000 0000 0000 0000 0000 0000 0000 0000
			 0000 0000 0000 0000 0000 0000 0000 0000
			 0000
15:22:50.117091 IP 192.168.27.100.1209 > 192.168.18.10.135: S 1729928678:1729928678(0) win 65535 <mss 1460,nop,nop,sackOK> (DF)
15:22:50.117329 IP 192.168.18.10.135 > 192.168.27.100.1209: S 1483065339:1483065339(0) ack 1729928679 win 17520 <mss 1460,nop,nop,sackOK> (DF)
15:22:50.117727 IP 192.168.27.100.1209 > 192.168.18.10.135: . ack 1 win 65535 (DF)
15:22:50.118233 IP 192.168.27.100.1209 > 192.168.18.10.135: P 1:73(72) ack 1 win 65535 (DF)
15:22:50.118667 IP 192.168.18.10.135 > 192.168.27.100.1209: P 1:61(60) ack 73 win 17448 (DF)
15:22:50.119347 IP 192.168.27.100.1209 > 192.168.18.10.135: P 73:229(156) ack 61 win 65475 (DF)
15:22:50.120086 IP 192.168.18.10.135 > 192.168.27.100.1209: P 61:213(152) ack 229 win 17292 (DF)
15:22:50.120833 IP 192.168.27.100.1209 > 192.168.18.10.135: F 229:229(0) ack 213 win 65323 (DF)
15:22:50.121013 IP 192.168.18.10.135 > 192.168.27.100.1209: . ack 230 win 17292 (DF)
15:22:50.121052 IP 192.168.18.10.135 > 192.168.27.100.1209: F 213:213(0) ack 230 win 17292 (DF)
15:22:50.121351 IP 192.168.27.100.1209 > 192.168.18.10.135: . ack 214 win 65323 (DF)
15:22:50.128968 (NOV-802.2) 00000001.52:54:ab:dd:3d:46.0553 > 00000000.ff:ff:ff:ff:ff:ff.0553: ipx-nwlink-dgm 187
15:22:50.129551 IP 192.168.27.153.138 > 192.168.31.255.138: udp 201
15:22:50.129879 52:54:ab:dd:3d:46 > 3:0:0:0:0:1 sap f0 ui/C len=163
15:22:50.140472 IP 192.168.27.100.1210 > 192.168.18.10.1025: S 1729984196:1729984196(0) win 65535 <mss 1460,nop,nop,sackOK> (DF)
15:22:50.140690 IP 192.168.18.10.1025 > 192.168.27.100.1210: S 3103462830:3103462830(0) ack 1729984197 win 17520 <mss 1460,nop,nop,sackOK> (DF)
15:22:50.141089 IP 192.168.27.100.1210 > 192.168.18.10.1025: . ack 1 win 65535 (DF)
15:22:50.209318 IP 192.168.27.100.1210 > 192.168.18.10.1025: . 1:1461(1460) ack 1 win 65535 (DF)
15:22:50.209527 IP 192.168.27.100.1210 > 192.168.18.10.1025: P 1461:2550(1089) ack 1 win 65535 (DF)
15:22:50.210430 IP 192.168.18.10.1025 > 192.168.27.100.1210: . ack 2550 win 17520 (DF)
15:22:50.212330 IP 192.168.18.10.1025 > 192.168.27.100.1210: P 1:213(212) ack 2550 win 17520 (DF)
15:22:50.213897 IP 192.168.27.100.1210 > 192.168.18.10.1025: P 2550:2727(177) ack 213 win 65323 (DF)
15:22:50.214732 IP 192.168.18.10.1025 > 192.168.27.100.1210: P 213:286(73) ack 2727 win 17343 (DF)
15:22:50.217220 IP 192.168.27.100.1210 > 192.168.18.10.1025: P 2727:2916(189) ack 286 win 65250 (DF)
15:22:50.218013 IP 192.168.18.10.1025 > 192.168.27.100.1210: P 286:427(141) ack 2916 win 17154 (DF)
15:22:50.231567 IP 192.168.27.100.1210 > 192.168.18.10.1025: P 2916:3105(189) ack 427 win 65109 (DF)
15:22:50.232615 IP 192.168.18.10.1025 > 192.168.27.100.1210: P 427:728(301) ack 3105 win 16965 (DF)
15:22:50.233582 IP 192.168.27.100.1210 > 192.168.18.10.1025: P 3105:3294(189) ack 728 win 64808 (DF)
15:22:50.234782 IP 192.168.18.10.1025 > 192.168.27.100.1210: P 728:997(269) ack 3294 win 16776 (DF)
15:22:50.235723 IP 192.168.27.100.1210 > 192.168.18.10.1025: P 3294:3403(109) ack 997 win 64539 (DF)
15:22:50.236371 IP 192.168.18.10.1025 > 192.168.27.100.1210: P 997:1106(109) ack 3403 win 16667 (DF)
15:22:50.237059 IP 192.168.27.100.1210 > 192.168.18.10.1025: F 3403:3403(0) ack 1106 win 64430 (DF)
15:22:50.237239 IP 192.168.18.10.1025 > 192.168.27.100.1210: . ack 3404 win 16667 (DF)
15:22:50.237267 IP 192.168.18.10.1025 > 192.168.27.100.1210: F 1106:1106(0) ack 3404 win 16667 (DF)
15:22:50.237557 IP 192.168.27.100.1210 > 192.168.18.10.1025: . ack 1107 win 64430 (DF)
15:22:50.298320 0:4:61:45:9:1a > 3:0:0:0:0:1 sap f0 ui/C len=202
15:22:50.298341 IP 192.168.20.193.137 > 192.168.31.255.137: udp 50
15:22:50.479875 2:1:0:0:0:0 ff:ff:ff:ff:ff:ff 886f 1510: 
			 bf01 dec0 0302 0000 0100 0000 0000 0000
			 0000 0000 0000 0000 0300 0200 a859 5e40
			 0000 0000 0000 3010 0000 0000 00f0 ff6f
			 0000 0000 0000 0000 0000 0000 0000 0000
			 0000 0000 0000 0000 0000 0000 0000 0000
			 0000
