File STDIN:
13:56:16.549076 IP 61.129.59.80.6661 > 192.168.27.100.1140: . ack 429755985 win 5840 (DF)
13:56:16.560021 IP 61.129.59.80.6661 > 192.168.27.100.1140: P 0:1022(1022) ack 1 win 5840 (DF)
13:56:16.560322 IP 61.129.59.80.6661 > 192.168.27.100.1140: . 1022:2482(1460) ack 1 win 5840 (DF)
13:56:16.561097 IP 192.168.27.100.1140 > 61.129.59.80.6661: . ack 2482 win 65535 (DF)
13:56:17.377106 IP 61.129.59.80.6661 > 192.168.27.100.1140: P 2482:3605(1123) ack 1 win 5840 (DF)
13:56:17.492397 IP 192.168.27.100.1140 > 61.129.59.80.6661: . ack 3605 win 64412 (DF)
13:56:17.509685 IP 192.168.27.100.1140 > 61.129.59.80.6661: P 1:4(3) ack 3605 win 64412 (DF)
13:56:18.295926 IP 61.129.59.80.6661 > 192.168.27.100.1140: P 3605:3814(209) ack 1 win 5840 (DF)
13:56:18.296765 IP 192.168.27.100.1140 > 61.129.59.80.6661: P 4:39(35) ack 3814 win 64203 (DF)
13:56:18.339170 IP 61.129.59.80.6661 > 192.168.27.100.1140: . ack 4 win 5840 (DF)
13:56:18.362414 IP 61.129.59.80.6661 > 192.168.27.100.1140: . 3814:5274(1460) ack 4 win 5840 (DF)
13:56:18.494022 IP 192.168.27.100.1140 > 61.129.59.80.6661: . ack 5274 win 65535 (DF)
13:56:18.816476 IP 61.129.59.80.6661 > 192.168.27.100.1140: . 5274:6734(1460) ack 4 win 5840 (DF)
13:56:18.819059 IP 192.168.27.100.1140 > 61.129.59.80.6661: P 39:284(245) ack 6734 win 65535 (DF)
13:56:19.076729 IP 61.129.59.80.6661 > 192.168.27.100.1140: P 6734:7385(651) ack 39 win 5840 (DF)
13:56:19.195399 IP 192.168.27.100.1140 > 61.129.59.80.6661: . ack 7385 win 64884 (DF)
13:56:19.603272 IP 61.129.59.80.6661 > 192.168.27.100.1140: . 7385:8845(1460) ack 39 win 5840 (DF)
13:56:19.682153 IP 61.129.59.80.6661 > 192.168.27.100.1140: . ack 284 win 6432 (DF)
13:56:19.797792 IP 192.168.27.100.1140 > 61.129.59.80.6661: . ack 8845 win 65535 (DF)
13:56:19.964627 IP 61.129.59.80.6661 > 192.168.27.100.1140: P 8845:10244(1399) ack 284 win 6432 (DF)
13:56:20.096073 IP 192.168.27.100.1140 > 61.129.59.80.6661: . ack 10244 win 64136 (DF)
13:56:20.596567 IP 61.129.59.80.6661 > 192.168.27.100.1140: . 10244:11704(1460) ack 284 win 6432 (DF)
13:56:20.798601 IP 192.168.27.100.1140 > 61.129.59.80.6661: . ack 11704 win 65535 (DF)
13:56:20.865213 IP 61.129.59.80.6661 > 192.168.27.100.1140: P 11704:12513(809) ack 284 win 6432 (DF)
13:56:20.997455 IP 192.168.27.100.1140 > 61.129.59.80.6661: . ack 12513 win 64726 (DF)
13:56:21.089006 IP 192.168.27.100.1140 > 61.129.59.80.6661: P 284:295(11) ack 12513 win 64726 (DF)
13:56:21.140703 IP 192.168.27.100.1140 > 61.129.59.80.6661: P 295:1755(1460) ack 12513 win 64726 (DF)
13:56:21.140925 IP 192.168.27.100.1140 > 61.129.59.80.6661: P 1755:1765(10) ack 12513 win 64726 (DF)
13:56:21.484603 IP 61.129.59.80.6661 > 192.168.27.100.1140: . 12513:13973(1460) ack 284 win 6432 (DF)
13:56:21.487965 IP 192.168.27.100.1140 > 61.129.59.80.6661: P 1765:2125(360) ack 13973 win 65535 (DF)
13:56:21.746314 IP 61.129.59.80.6661 > 192.168.27.100.1140: P 13973:14775(802) ack 284 win 6432 (DF)
13:56:21.747438 IP 192.168.27.100.1140 > 61.129.59.80.6661: P 2125:2140(15) ack 14775 win 64733 (DF)
13:56:21.851335 IP 61.129.59.80.6661 > 192.168.27.100.1140: . ack 295 win 6432 (DF)
13:56:21.887357 IP 61.129.59.80.6661 > 192.168.27.100.1140: . ack 1765 win 8760 (DF)
13:56:21.895220 IP 61.129.59.80.6661 > 192.168.27.100.1140: . ack 295 win 6432 <nop,nop,sack sack 1 {1755:1765} > (DF)
13:56:21.901762 IP 61.129.59.80.6661 > 192.168.27.100.1140: . 14775:16235(1460) ack 1765 win 8760 (DF)
13:56:21.902570 IP 61.129.59.80.6661 > 192.168.27.100.1140: . 16235:17695(1460) ack 1765 win 8760 (DF)
13:56:21.904332 IP 192.168.27.100.1140 > 61.129.59.80.6661: . ack 17695 win 65535 (DF)
13:56:22.268813 IP 61.129.59.80.6661 > 192.168.27.100.1140: . 17695:19155(1460) ack 2125 win 8760 (DF)
13:56:22.268977 IP 61.129.59.80.6661 > 192.168.27.100.1140: . 19155:20615(1460) ack 2125 win 8760 (DF)
13:56:22.271702 IP 192.168.27.100.1140 > 61.129.59.80.6661: . ack 19155 win 65535 (DF)
13:56:22.271799 IP 192.168.27.100.1140 > 61.129.59.80.6661: P 2140:2665(525) ack 19155 win 65535 (DF)
13:56:22.399408 IP 192.168.27.100.1140 > 61.129.59.80.6661: . ack 20615 win 65535 (DF)
13:56:22.526396 IP 61.129.59.80.6661 > 192.168.27.100.1140: . 20615:22075(1460) ack 2140 win 8760 (DF)
13:56:22.527616 IP 61.129.59.80.6661 > 192.168.27.100.1140: . 22075:23535(1460) ack 2140 win 8760 (DF)
13:56:22.527999 IP 192.168.27.100.1140 > 61.129.59.80.6661: P 2665:2800(135) ack 22075 win 65535 (DF)
13:56:22.528270 IP 192.168.27.100.1140 > 61.129.59.80.6661: . ack 23535 win 65535 (DF)
13:56:22.692849 IP 61.129.59.80.6661 > 192.168.27.100.1140: . 23535:24995(1460) ack 2140 win 8760 (DF)
13:56:22.692973 IP 61.129.59.80.6661 > 192.168.27.100.1140: P 24995:25271(276) ack 2140 win 8760 (DF)
13:56:22.694064 IP 192.168.27.100.1140 > 61.129.59.80.6661: . ack 25271 win 65535 (DF)
13:56:23.099269 IP 61.129.59.80.6661 > 192.168.27.100.1140: . 25271:26731(1460) ack 2665 win 11680 (DF)
13:56:23.102043 IP 61.129.59.80.6661 > 192.168.27.100.1140: . 26731:28191(1460) ack 2665 win 11680 (DF)
13:56:23.103202 IP 192.168.27.100.1140 > 61.129.59.80.6661: . ack 28191 win 65535 (DF)
13:56:23.349809 IP 61.129.59.80.6661 > 192.168.27.100.1140: . ack 2800 win 11680 (DF)
13:56:23.379881 IP 61.129.59.80.6661 > 192.168.27.100.1140: . 28191:29651(1460) ack 2800 win 11680 (DF)
13:56:23.380891 IP 192.168.27.100.1140 > 61.129.59.80.6661: . ack 29651 win 65535 (DF)
13:56:23.470603 IP 61.129.59.80.6661 > 192.168.27.100.1140: P 29651:30074(423) ack 2800 win 11680 (DF)
13:56:23.601252 IP 192.168.27.100.1140 > 61.129.59.80.6661: . ack 30074 win 65112 (DF)
13:56:24.040591 IP 61.129.59.80.6661 > 192.168.27.100.1140: . 30074:31534(1460) ack 2800 win 11680 (DF)
13:56:24.203664 IP 192.168.27.100.1140 > 61.129.59.80.6661: . ack 31534 win 65535 (DF)
13:56:24.426294 IP 61.129.59.80.6661 > 192.168.27.100.1140: P 31534:32602(1068) ack 2800 win 11680 (DF)
13:56:24.602837 IP 192.168.27.100.1140 > 61.129.59.80.6661: . ack 32602 win 64467 (DF)
13:56:25.044044 IP 61.129.59.80.6661 > 192.168.27.100.1140: . 32602:34062(1460) ack 2800 win 11680 (DF)
13:56:25.207279 IP 192.168.27.100.1140 > 61.129.59.80.6661: . ack 34062 win 65535 (DF)
13:56:25.437949 IP 61.129.59.80.6661 > 192.168.27.100.1140: P 34062:35044(982) ack 2800 win 11680 (DF)
13:56:25.604162 IP 192.168.27.100.1140 > 61.129.59.80.6661: . ack 35044 win 64553 (DF)
13:56:26.036906 IP 61.129.59.80.6661 > 192.168.27.100.1140: . 35044:36504(1460) ack 2800 win 11680 (DF)
13:56:26.206845 IP 192.168.27.100.1140 > 61.129.59.80.6661: . ack 36504 win 65535 (DF)
13:56:26.439482 IP 61.129.59.80.6661 > 192.168.27.100.1140: P 36504:37505(1001) ack 2800 win 11680 (DF)
13:56:26.537868 IP 192.168.27.100.1140 > 61.129.59.80.6661: P 2800:2815(15) ack 37505 win 64534 (DF)
13:56:27.047797 IP 61.129.59.80.6661 > 192.168.27.100.1140: . 37505:38965(1460) ack 2800 win 11680 (DF)
13:56:27.206457 IP 192.168.27.100.1140 > 61.129.59.80.6661: . ack 38965 win 65535 (DF)
13:56:27.366641 IP 61.129.59.80.6661 > 192.168.27.100.1140: P 38965:39835(870) ack 2815 win 11680 (DF)
13:56:27.463902 IP 192.168.27.100.1140 > 61.129.59.80.6661: P 2815:2830(15) ack 39835 win 64665 (DF)
13:56:27.935777 IP 61.129.59.80.6661 > 192.168.27.100.1140: . 39835:41295(1460) ack 2815 win 11680 (DF)
13:56:27.936798 IP 192.168.27.100.1140 > 61.129.59.80.6661: P 2830:2860(30) ack 41295 win 65535 (DF)
13:56:28.260819 IP 61.129.59.80.6661 > 192.168.27.100.1140: P 41295:42000(705) ack 2830 win 11680 (DF)
13:56:28.262138 IP 192.168.27.100.1140 > 61.129.59.80.6661: P 2860:2875(15) ack 42000 win 64830 (DF)
13:56:28.706306 IP 61.129.59.80.6661 > 192.168.27.100.1140: . 42000:43460(1460) ack 2830 win 11680 (DF)
13:56:28.791498 IP 61.129.59.80.6661 > 192.168.27.100.1140: . ack 2860 win 11680 (DF)
13:56:28.792617 IP 192.168.27.100.1140 > 61.129.59.80.6661: P 2875:2965(90) ack 43460 win 65535 (DF)
13:56:29.042655 IP 61.129.59.80.6661 > 192.168.27.100.1140: P 43460:44473(1013) ack 2875 win 11680 (DF)
13:56:29.043835 IP 192.168.27.100.1140 > 61.129.59.80.6661: P 2965:2980(15) ack 44473 win 64522 (DF)
13:56:29.590332 IP 61.129.59.80.6661 > 192.168.27.100.1140: . 44473:45933(1460) ack 2965 win 11680 (DF)
13:56:29.591488 IP 192.168.27.100.1140 > 61.129.59.80.6661: P 2980:3145(165) ack 45933 win 65535 (DF)
13:56:29.844341 IP 61.129.59.80.6661 > 192.168.27.100.1140: P 45933:47196(1263) ack 2980 win 11680 (DF)
13:56:30.010518 IP 192.168.27.100.1140 > 61.129.59.80.6661: . ack 47196 win 64272 (DF)
13:56:30.374984 IP 61.129.59.80.6661 > 192.168.27.100.1140: . 47196:48656(1460) ack 2980 win 11680 (DF)
13:56:30.376165 IP 192.168.27.100.1140 > 61.129.59.80.6661: P 3145:3430(285) ack 48656 win 65535 (DF)
13:56:30.429338 IP 61.129.59.80.6661 > 192.168.27.100.1140: . ack 3145 win 11680 (DF)
13:56:30.597513 IP 61.129.59.80.6661 > 192.168.27.100.1140: . 48656:50116(1460) ack 3145 win 11680 (DF)
13:56:30.712193 IP 192.168.27.100.1140 > 61.129.59.80.6661: . ack 50116 win 65535 (DF)
13:56:30.804203 IP 61.129.59.80.6661 > 192.168.27.100.1140: P 50116:50613(497) ack 3145 win 11680 (DF)
13:56:30.808046 IP 192.168.27.100.1140 > 61.129.59.80.6661: P 3430:3445(15) ack 50613 win 65038 (DF)
13:56:31.192160 IP 61.129.59.80.6661 > 192.168.27.100.1140: . ack 3430 win 11680 (DF)
13:56:31.193176 IP 192.168.27.100.1140 > 61.129.59.80.6661: P 3445:3700(255) ack 50613 win 65038 (DF)
13:56:31.200043 IP 61.129.59.80.6661 > 192.168.27.100.1140: . 50613:52073(1460) ack 3430 win 11680 (DF)
13:56:31.313195 IP 192.168.27.100.1140 > 61.129.59.80.6661: . ack 52073 win 65535 (DF)
13:56:31.374109 IP 61.129.59.80.6661 > 192.168.27.100.1140: . 52073:53533(1460) ack 3430 win 11680 (DF)
13:56:31.375243 IP 192.168.27.100.1140 > 61.129.59.80.6661: P 3700:3715(15) ack 53533 win 65535 (DF)
13:56:31.615314 IP 61.129.59.80.6661 > 192.168.27.100.1140: P 53533:54435(902) ack 3445 win 11680 (DF)
13:56:31.616196 IP 192.168.27.100.1140 > 61.129.59.80.6661: . ack 54435 win 64633 (DF)
13:56:31.616219 IP 192.168.27.100.1140 > 61.129.59.80.6661: P 3715:3730(15) ack 54435 win 64633 (DF)
13:56:32.026021 IP 61.129.59.80.6661 > 192.168.27.100.1140: . 54435:55895(1460) ack 3700 win 11680 (DF)
13:56:32.029402 IP 192.168.27.100.1140 > 61.129.59.80.6661: P 3730:3910(180) ack 55895 win 65535 (DF)
13:56:32.207782 IP 61.129.59.80.6661 > 192.168.27.100.1140: . ack 3715 win 11680 (DF)
13:56:32.268011 IP 61.129.59.80.6661 > 192.168.27.100.1140: . 55895:57355(1460) ack 3715 win 11680 (DF)
13:56:32.414013 IP 192.168.27.100.1140 > 61.129.59.80.6661: . ack 57355 win 65535 (DF)
13:56:32.418515 IP 61.129.59.80.6661 > 192.168.27.100.1140: P 57355:57810(455) ack 3715 win 11680 (DF)
13:56:32.425652 IP 61.129.59.80.6661 > 192.168.27.100.1140: . ack 3730 win 11680 (DF)
13:56:32.614366 IP 192.168.27.100.1140 > 61.129.59.80.6661: . ack 57810 win 65080 (DF)
13:56:32.841611 IP 61.129.59.80.6661 > 192.168.27.100.1140: . ack 3910 win 11680 (DF)
13:56:32.842430 IP 192.168.27.100.1140 > 61.129.59.80.6661: P 3910:4150(240) ack 57810 win 65080 (DF)
13:56:32.943074 IP 61.129.59.80.6661 > 192.168.27.100.1140: . 57810:59270(1460) ack 3910 win 11680 (DF)
13:56:32.943938 IP 192.168.27.100.1140 > 61.129.59.80.6661: P 4150:4165(15) ack 59270 win 65535 (DF)
13:56:33.364885 IP 61.129.59.80.6661 > 192.168.27.100.1140: . 59270:60730(1460) ack 3910 win 11680 (DF)
13:56:33.368774 IP 192.168.27.100.1140 > 61.129.59.80.6661: P 4165:4180(15) ack 60730 win 65535 (DF)
13:56:33.429477 IP 61.129.59.80.6661 > 192.168.27.100.1140: P 60730:60939(209) ack 3910 win 11680 (DF)
13:56:33.432247 IP 192.168.27.100.1140 > 61.129.59.80.6661: P 4180:4195(15) ack 60939 win 65326 (DF)
13:56:33.691925 IP 61.129.59.80.6661 > 192.168.27.100.1140: . ack 4150 win 11680 (DF)
13:56:33.693038 IP 192.168.27.100.1140 > 61.129.59.80.6661: P 4195:4345(150) ack 60939 win 65326 (DF)
13:56:33.706041 IP 61.129.59.80.6661 > 192.168.27.100.1140: . 60939:62399(1460) ack 4150 win 11680 (DF)
13:56:33.791628 IP 61.129.59.80.6661 > 192.168.27.100.1140: . ack 4165 win 11680 (DF)
13:56:33.815880 IP 192.168.27.100.1140 > 61.129.59.80.6661: . ack 62399 win 65535 (DF)
13:56:34.174375 IP 61.129.59.80.6661 > 192.168.27.100.1140: . ack 4180 win 11680 (DF)
13:56:34.175481 IP 192.168.27.100.1140 > 61.129.59.80.6661: P 4345:4450(105) ack 62399 win 65535 (DF)
13:56:34.217178 IP 61.129.59.80.6661 > 192.168.27.100.1140: P 62399:63739(1340) ack 4195 win 11680 (DF)
13:56:34.418935 IP 192.168.27.100.1140 > 61.129.59.80.6661: . ack 63739 win 64195 (DF)
13:56:34.519294 IP 61.129.59.80.6661 > 192.168.27.100.1140: . ack 4345 win 11680 (DF)
13:56:34.520751 IP 192.168.27.100.1140 > 61.129.59.80.6661: P 4450:4525(75) ack 63739 win 64195 (DF)
13:56:34.594959 IP 61.129.59.80.6661 > 192.168.27.100.1140: . 63739:65199(1460) ack 4345 win 11680 (DF)
13:56:34.717262 IP 192.168.27.100.1140 > 61.129.59.80.6661: . ack 65199 win 65535 (DF)
13:56:34.972297 IP 61.129.59.80.6661 > 192.168.27.100.1140: . ack 4450 win 11680 (DF)
13:56:34.972906 IP 192.168.27.100.1140 > 61.129.59.80.6661: P 4525:4540(15) ack 65199 win 65535 (DF)
13:56:35.044249 IP 61.129.59.80.6661 > 192.168.27.100.1140: . 65199:66659(1460) ack 4450 win 11680 (DF)
13:56:35.197180 IP 61.129.59.80.6661 > 192.168.27.100.1140: P 66659:67068(409) ack 4450 win 11680 (DF)
13:56:35.200479 IP 192.168.27.100.1140 > 61.129.59.80.6661: P 4540:4585(45) ack 67068 win 65535 (DF)
13:56:35.320809 IP 61.129.59.80.6661 > 192.168.27.100.1140: . ack 4525 win 11680 (DF)
13:56:35.594270 IP 61.129.59.80.6661 > 192.168.27.100.1140: . 67068:68528(1460) ack 4525 win 11680 (DF)
13:56:35.596893 IP 192.168.27.100.1140 > 61.129.59.80.6661: P 4585:4645(60) ack 68528 win 65535 (DF)
13:56:35.801031 IP 61.129.59.80.6661 > 192.168.27.100.1140: . ack 4540 win 11680 (DF)
13:56:36.034807 IP 61.129.59.80.6661 > 192.168.27.100.1140: P 68528:69333(805) ack 4585 win 11680 (DF)
13:56:36.035994 IP 192.168.27.100.1140 > 61.129.59.80.6661: P 4645:4660(15) ack 69333 win 64730 (DF)
13:56:36.419585 IP 61.129.59.80.6661 > 192.168.27.100.1140: . ack 4645 win 11680 (DF)
13:56:36.420555 IP 192.168.27.100.1140 > 61.129.59.80.6661: P 4660:4750(90) ack 69333 win 64730 (DF)
13:56:36.474732 IP 61.129.59.80.6661 > 192.168.27.100.1140: . 69333:70793(1460) ack 4645 win 11680 (DF)
13:56:36.622375 IP 192.168.27.100.1140 > 61.129.59.80.6661: . ack 70793 win 65535 (DF)
13:56:36.841749 IP 61.129.59.80.6661 > 192.168.27.100.1140: P 70793:71804(1011) ack 4660 win 11680 (DF)
13:56:36.870747 IP 192.168.27.100.1140 > 61.129.59.80.6661: P 4750:4765(15) ack 71804 win 64524 (DF)
13:56:37.269789 IP 61.129.59.80.6661 > 192.168.27.100.1140: . ack 4750 win 11680 (DF)
13:56:37.270640 IP 192.168.27.100.1140 > 61.129.59.80.6661: P 4765:4825(60) ack 71804 win 64524 (DF)
13:56:37.362126 IP 61.129.59.80.6661 > 192.168.27.100.1140: . 71804:73264(1460) ack 4750 win 11680 (DF)
13:56:37.363277 IP 192.168.27.100.1140 > 61.129.59.80.6661: P 4825:4840(15) ack 73264 win 65535 (DF)
13:56:37.662194 IP 61.129.59.80.6661 > 192.168.27.100.1140: P 73264:74111(847) ack 4765 win 11680 (DF)
13:56:37.665292 IP 192.168.27.100.1140 > 61.129.59.80.6661: P 4840:4855(15) ack 74111 win 64688 (DF)
13:56:38.133002 IP 61.129.59.80.6661 > 192.168.27.100.1140: . ack 4825 win 11680 (DF)
13:56:38.134069 IP 192.168.27.100.1140 > 61.129.59.80.6661: P 4855:4945(90) ack 74111 win 64688 (DF)
13:56:38.144267 IP 61.129.59.80.6661 > 192.168.27.100.1140: . 74111:75571(1460) ack 4825 win 11680 (DF)
13:56:38.192120 IP 61.129.59.80.6661 > 192.168.27.100.1140: . ack 4840 win 11680 (DF)
13:56:38.323227 IP 192.168.27.100.1140 > 61.129.59.80.6661: . ack 75571 win 65535 (DF)
13:56:38.562445 IP 61.129.59.80.6661 > 192.168.27.100.1140: P 75571:76324(753) ack 4855 win 11680 (DF)
13:56:38.584093 IP 192.168.27.100.1140 > 61.129.59.80.6661: P 4945:4960(15) ack 76324 win 64782 (DF)
13:56:39.020594 IP 61.129.59.80.6661 > 192.168.27.100.1140: . ack 4945 win 11680 (DF)
13:56:39.022981 IP 192.168.27.100.1140 > 61.129.59.80.6661: P 4960:5065(105) ack 76324 win 64782 (DF)
13:56:39.033750 IP 61.129.59.80.6661 > 192.168.27.100.1140: . 76324:77784(1460) ack 4945 win 11680 (DF)
13:56:39.223736 IP 192.168.27.100.1140 > 61.129.59.80.6661: . ack 77784 win 65535 (DF)
13:56:39.424425 IP 61.129.59.80.6661 > 192.168.27.100.1140: P 77784:78600(816) ack 4960 win 11680 (DF)
13:56:39.425971 IP 192.168.27.100.1140 > 61.129.59.80.6661: P 5065:5080(15) ack 78600 win 64719 (DF)
13:56:39.904436 IP 61.129.59.80.6661 > 192.168.27.100.1140: . ack 5065 win 11680 (DF)
13:56:39.905911 IP 192.168.27.100.1140 > 61.129.59.80.6661: P 5080:5125(45) ack 78600 win 64719 (DF)
13:56:40.250751 IP 61.129.59.80.6661 > 192.168.27.100.1140: P 78600:79969(1369) ack 5080 win 11680 (DF)
13:56:40.253368 IP 192.168.27.100.1140 > 61.129.59.80.6661: P 5125:5140(15) ack 79969 win 65535 (DF)
13:56:40.751599 IP 61.129.59.80.6661 > 192.168.27.100.1140: . ack 5125 win 11680 (DF)
13:56:41.083504 IP 61.129.59.80.6661 > 192.168.27.100.1140: P 79969:81211(1242) ack 5140 win 11680 (DF)
13:56:41.085668 IP 192.168.27.100.1140 > 61.129.59.80.6661: P 5140:5155(15) ack 81211 win 64293 (DF)
13:56:41.934553 IP 61.129.59.80.6661 > 192.168.27.100.1140: P 81211:82059(848) ack 5155 win 11680 (DF)
13:56:41.937876 IP 192.168.27.100.1140 > 61.129.59.80.6661: P 5155:5215(60) ack 82059 win 65535 (DF)
13:56:42.801287 IP 61.129.59.80.6661 > 192.168.27.100.1140: P 82059:83183(1124) ack 5215 win 11680 (DF)
13:56:42.802461 IP 192.168.27.100.1140 > 61.129.59.80.6661: P 5215:5260(45) ack 83183 win 64411 (DF)
13:56:43.740740 IP 61.129.59.80.6661 > 192.168.27.100.1140: P 83183:84370(1187) ack 5260 win 11680 (DF)
13:56:43.744694 IP 192.168.27.100.1140 > 61.129.59.80.6661: P 5260:5305(45) ack 84370 win 65535 (DF)
13:56:44.581596 IP 61.129.59.80.6661 > 192.168.27.100.1140: P 84370:85395(1025) ack 5305 win 11680 (DF)
13:56:44.582564 IP 192.168.27.100.1140 > 61.129.59.80.6661: P 5305:5335(30) ack 85395 win 64510 (DF)
13:56:45.433810 IP 61.129.59.80.6661 > 192.168.27.100.1140: P 85395:86191(796) ack 5335 win 11680 (DF)
13:56:45.437192 IP 192.168.27.100.1140 > 61.129.59.80.6661: P 5335:5440(105) ack 86191 win 65535 (DF)
13:56:46.318661 IP 61.129.59.80.6661 > 192.168.27.100.1140: P 86191:86911(720) ack 5440 win 11680 (DF)
13:56:46.320500 IP 192.168.27.100.1140 > 61.129.59.80.6661: P 5440:5515(75) ack 86911 win 64815 (DF)
13:56:47.176869 IP 61.129.59.80.6661 > 192.168.27.100.1140: P 86911:87719(808) ack 5515 win 11680 (DF)
13:56:47.180117 IP 192.168.27.100.1140 > 61.129.59.80.6661: P 5515:5605(90) ack 87719 win 65535 (DF)
13:56:48.040580 IP 61.129.59.80.6661 > 192.168.27.100.1140: P 87719:88369(650) ack 5605 win 11680 (DF)
13:56:48.042290 IP 192.168.27.100.1140 > 61.129.59.80.6661: P 5605:5650(45) ack 88369 win 64885 (DF)
13:56:48.880143 IP 61.129.59.80.6661 > 192.168.27.100.1140: P 88369:89132(763) ack 5650 win 11680 (DF)
13:56:48.883803 IP 192.168.27.100.1140 > 61.129.59.80.6661: P 5650:5695(45) ack 89132 win 64122 (DF)
13:56:49.734587 IP 61.129.59.80.6661 > 192.168.27.100.1140: P 89132:89753(621) ack 5695 win 11680 (DF)
13:56:49.735557 IP 192.168.27.100.1140 > 61.129.59.80.6661: P 5695:5725(30) ack 89753 win 65535 (DF)
13:56:50.562136 IP 61.129.59.80.6661 > 192.168.27.100.1140: P 89753:90341(588) ack 5725 win 11680 (DF)
13:56:50.564869 IP 192.168.27.100.1140 > 61.129.59.80.6661: P 5725:5770(45) ack 90341 win 64947 (DF)
13:56:51.482628 IP 61.129.59.80.6661 > 192.168.27.100.1140: P 90341:91233(892) ack 5770 win 11680 (DF)
13:56:51.484084 IP 192.168.27.100.1140 > 61.129.59.80.6661: P 5770:5815(45) ack 91233 win 65535 (DF)
13:56:52.295530 IP 61.129.59.80.6661 > 192.168.27.100.1140: P 91233:92014(781) ack 5815 win 11680 (DF)
13:56:52.298559 IP 192.168.27.100.1140 > 61.129.59.80.6661: P 5815:5856(41) ack 92014 win 64754 (DF)
13:56:53.102002 IP 61.129.59.80.6661 > 192.168.27.100.1140: P 92014:92566(552) ack 5856 win 11680 (DF)
13:56:53.103173 IP 192.168.27.100.1140 > 61.129.59.80.6661: P 5856:5886(30) ack 92566 win 64202 (DF)
13:56:53.950192 IP 61.129.59.80.6661 > 192.168.27.100.1140: P 92566:93154(588) ack 5886 win 11680 (DF)
13:56:53.953672 IP 192.168.27.100.1140 > 61.129.59.80.6661: P 5886:5916(30) ack 93154 win 65535 (DF)
13:56:54.815816 IP 61.129.59.80.6661 > 192.168.27.100.1140: P 93154:94080(926) ack 5916 win 11680 (DF)
13:56:54.816697 IP 192.168.27.100.1140 > 61.129.59.80.6661: P 5916:5946(30) ack 94080 win 64609 (DF)
13:56:55.661625 IP 61.129.59.80.6661 > 192.168.27.100.1140: P 94080:95060(980) ack 5946 win 11680 (DF)
13:56:55.664684 IP 192.168.27.100.1140 > 61.129.59.80.6661: P 5946:5991(45) ack 95060 win 65535 (DF)
13:56:56.509809 IP 61.129.59.80.6661 > 192.168.27.100.1140: P 95060:96386(1326) ack 5991 win 11680 (DF)
13:56:56.510645 IP 192.168.27.100.1140 > 61.129.59.80.6661: P 5991:6036(45) ack 96386 win 64209 (DF)
13:56:57.332952 IP 61.129.59.80.6661 > 192.168.27.100.1140: P 96386:97455(1069) ack 6036 win 11680 (DF)
13:56:57.335926 IP 192.168.27.100.1140 > 61.129.59.80.6661: P 6036:6081(45) ack 97455 win 65535 (DF)
13:56:58.149290 IP 61.129.59.80.6661 > 192.168.27.100.1140: P 97455:98583(1128) ack 6081 win 11680 (DF)
13:56:58.151124 IP 192.168.27.100.1140 > 61.129.59.80.6661: P 6081:6111(30) ack 98583 win 64407 (DF)
13:56:59.044170 IP 61.129.59.80.6661 > 192.168.27.100.1140: P 98583:99585(1002) ack 6111 win 11680 (DF)
13:56:59.047501 IP 192.168.27.100.1140 > 61.129.59.80.6661: P 6111:6141(30) ack 99585 win 65535 (DF)
13:56:59.862070 IP 61.129.59.80.6661 > 192.168.27.100.1140: P 99585:100552(967) ack 6141 win 11680 (DF)
13:56:59.863566 IP 192.168.27.100.1140 > 61.129.59.80.6661: P 6141:6156(15) ack 100552 win 64568 (DF)
13:57:00.674904 IP 61.129.59.80.6661 > 192.168.27.100.1140: P 100552:101977(1425) ack 6156 win 11680 (DF)
13:57:00.677657 IP 192.168.27.100.1140 > 61.129.59.80.6661: P 6156:6216(60) ack 101977 win 65535 (DF)
13:57:01.370394 IP 61.129.59.80.6661 > 192.168.27.100.1140: . 101977:103437(1460) ack 6156 win 11680 (DF)
13:57:01.372209 IP 192.168.27.100.1140 > 61.129.59.80.6661: P 6216:6306(90) ack 103437 win 65535 (DF)
13:57:01.520033 IP 61.129.59.80.6661 > 192.168.27.100.1140: P 103437:103717(280) ack 6216 win 11680 (DF)
13:57:01.655976 IP 192.168.27.100.1140 > 61.129.59.80.6661: . ack 103717 win 65255 (DF)
13:57:02.153040 IP 61.129.59.80.6661 > 192.168.27.100.1140: . 103717:105177(1460) ack 6216 win 11680 (DF)
13:57:02.155819 IP 192.168.27.100.1140 > 61.129.59.80.6661: P 6306:6411(105) ack 105177 win 65535 (DF)
13:57:02.195704 IP 61.129.59.80.6661 > 192.168.27.100.1140: . ack 6306 win 11680 (DF)
13:57:02.440476 IP 61.129.59.80.6661 > 192.168.27.100.1140: P 105177:105957(780) ack 6306 win 11680 (DF)
13:57:02.441348 IP 192.168.27.100.1140 > 61.129.59.80.6661: P 6411:6426(15) ack 105957 win 64755 (DF)
13:57:02.992520 IP 61.129.59.80.6661 > 192.168.27.100.1140: . ack 6411 win 11680 (DF)
13:57:02.993520 IP 192.168.27.100.1140 > 61.129.59.80.6661: P 6426:6441(15) ack 105957 win 64755 (DF)
13:57:03.042389 IP 61.129.59.80.6661 > 192.168.27.100.1140: . 105957:107417(1460) ack 6411 win 11680 (DF)
13:57:03.159475 IP 192.168.27.100.1140 > 61.129.59.80.6661: . ack 107417 win 65535 (DF)
13:57:03.273953 IP 61.129.59.80.6661 > 192.168.27.100.1140: P 107417:108345(928) ack 6426 win 11680 (DF)
13:57:03.276496 IP 192.168.27.100.1140 > 61.129.59.80.6661: P 6441:6456(15) ack 108345 win 64607 (DF)
13:57:03.821217 IP 61.129.59.80.6661 > 192.168.27.100.1140: . 108345:109805(1460) ack 6426 win 11680 (DF)
13:57:03.822551 IP 192.168.27.100.1140 > 61.129.59.80.6661: P 6456:6576(120) ack 109805 win 65535 (DF)
13:57:03.856773 IP 61.129.59.80.6661 > 192.168.27.100.1140: . ack 6441 win 11680 (DF)
13:57:03.857662 IP 192.168.27.100.1140 > 61.129.59.80.6661: P 6576:6591(15) ack 109805 win 65535 (DF)
13:57:04.079862 IP 61.129.59.80.6661 > 192.168.27.100.1140: P 109805:110413(608) ack 6456 win 11680 (DF)
13:57:04.261216 IP 192.168.27.100.1140 > 61.129.59.80.6661: . ack 110413 win 64927 (DF)
13:57:04.592369 IP 61.129.59.80.6661 > 192.168.27.100.1140: . 110413:111873(1460) ack 6456 win 11680 (DF)
13:57:04.593508 IP 192.168.27.100.1140 > 61.129.59.80.6661: P 6591:6711(120) ack 111873 win 65535 (DF)
13:57:04.663965 IP 61.129.59.80.6661 > 192.168.27.100.1140: . ack 6576 win 11680 (DF)
13:57:04.687471 IP 61.129.59.80.6661 > 192.168.27.100.1140: . ack 6591 win 11680 (DF)
13:57:04.920212 IP 61.129.59.80.6661 > 192.168.27.100.1140: . 111873:113333(1460) ack 6591 win 11680 (DF)
13:57:05.063164 IP 192.168.27.100.1140 > 61.129.59.80.6661: . ack 113333 win 65535 (DF)
13:57:05.074645 IP 61.129.59.80.6661 > 192.168.27.100.1140: P 113333:113837(504) ack 6591 win 11680 (DF)
13:57:05.074993 IP 192.168.27.100.1140 > 61.129.59.80.6661: P 6711:6726(15) ack 113837 win 65031 (DF)
13:57:05.415336 IP 61.129.59.80.6661 > 192.168.27.100.1140: . ack 6711 win 11680 (DF)
13:57:05.418496 IP 192.168.27.100.1140 > 61.129.59.80.6661: P 6726:6846(120) ack 113837 win 65031 (DF)
13:57:05.483107 IP 61.129.59.80.6661 > 192.168.27.100.1140: . 113837:115297(1460) ack 6711 win 11680 (DF)
13:57:05.661846 IP 192.168.27.100.1140 > 61.129.59.80.6661: . ack 115297 win 65535 (DF)
13:57:05.887982 IP 61.129.59.80.6661 > 192.168.27.100.1140: P 115297:116672(1375) ack 6726 win 11680 (DF)
13:57:06.062331 IP 192.168.27.100.1140 > 61.129.59.80.6661: . ack 116672 win 64160 (DF)
13:57:06.259085 IP 61.129.59.80.6661 > 192.168.27.100.1140: . 116672:118132(1460) ack 6846 win 11680 (DF)
13:57:06.260111 IP 192.168.27.100.1140 > 61.129.59.80.6661: P 6846:6981(135) ack 118132 win 65535 (DF)
13:57:06.700089 IP 61.129.59.80.6661 > 192.168.27.100.1140: . 118132:119592(1460) ack 6846 win 11680 (DF)
13:57:06.705188 IP 192.168.27.100.1140 > 61.129.59.80.6661: P 6981:7071(90) ack 119592 win 65535 (DF)
13:57:06.902275 IP 61.129.59.80.6661 > 192.168.27.100.1140: P 119592:120282(690) ack 6846 win 11680 (DF)
13:57:06.903446 IP 192.168.27.100.1140 > 61.129.59.80.6661: P 7071:7086(15) ack 120282 win 64845 (DF)
13:57:07.138552 IP 61.129.59.80.6661 > 192.168.27.100.1140: . ack 6981 win 11680 (DF)
13:57:07.139445 IP 192.168.27.100.1140 > 61.129.59.80.6661: P 7086:7176(90) ack 120282 win 64845 (DF)
13:57:07.141756 IP 61.129.59.80.6661 > 192.168.27.100.1140: . 120282:121742(1460) ack 6981 win 11680 (DF)
13:57:07.264804 IP 192.168.27.100.1140 > 61.129.59.80.6661: . ack 121742 win 65535 (DF)
13:57:07.551216 IP 61.129.59.80.6661 > 192.168.27.100.1140: . ack 7071 win 11680 (DF)
13:57:07.552206 IP 192.168.27.100.1140 > 61.129.59.80.6661: P 7176:7191(15) ack 121742 win 65535 (DF)
13:57:07.580340 IP 61.129.59.80.6661 > 192.168.27.100.1140: . 121742:123202(1460) ack 7071 win 11680 (DF)
13:57:07.734953 IP 61.129.59.80.6661 > 192.168.27.100.1140: P 123202:124012(810) ack 7086 win 11680 (DF)
13:57:07.738969 IP 192.168.27.100.1140 > 61.129.59.80.6661: P 7191:7236(45) ack 124012 win 65535 (DF)
13:57:08.011677 IP 61.129.59.80.6661 > 192.168.27.100.1140: . ack 7176 win 11680 (DF)
13:57:08.012607 IP 192.168.27.100.1140 > 61.129.59.80.6661: P 7236:7296(60) ack 124012 win 65535 (DF)
13:57:08.039656 IP 61.129.59.80.6661 > 192.168.27.100.1140: . 124012:125472(1460) ack 7176 win 11680 (DF)
13:57:08.167253 IP 192.168.27.100.1140 > 61.129.59.80.6661: . ack 125472 win 65535 (DF)
13:57:08.338063 IP 61.129.59.80.6661 > 192.168.27.100.1140: . ack 7191 win 11680 (DF)
13:57:08.338874 IP 192.168.27.100.1140 > 61.129.59.80.6661: P 7296:7311(15) ack 125472 win 65535 (DF)
13:57:08.569621 IP 61.129.59.80.6661 > 192.168.27.100.1140: P 125472:126615(1143) ack 7236 win 11680 (DF)
13:57:08.570906 IP 192.168.27.100.1140 > 61.129.59.80.6661: P 7311:7341(30) ack 126615 win 64392 (DF)
13:57:08.856330 IP 61.129.59.80.6661 > 192.168.27.100.1140: . ack 7296 win 11680 (DF)
13:57:08.859502 IP 192.168.27.100.1140 > 61.129.59.80.6661: P 7341:7416(75) ack 126615 win 64392 (DF)
13:57:08.928888 IP 61.129.59.80.6661 > 192.168.27.100.1140: . 126615:128075(1460) ack 7296 win 11680 (DF)
13:57:09.066970 IP 192.168.27.100.1140 > 61.129.59.80.6661: . ack 128075 win 65535 (DF)
13:57:09.145868 IP 61.129.59.80.6661 > 192.168.27.100.1140: . ack 7311 win 11680 (DF)
13:57:09.146697 IP 192.168.27.100.1140 > 61.129.59.80.6661: P 7416:7431(15) ack 128075 win 65535 (DF)
13:57:09.405731 IP 61.129.59.80.6661 > 192.168.27.100.1140: P 128075:129519(1444) ack 7341 win 11680 (DF)
13:57:09.407240 IP 192.168.27.100.1140 > 61.129.59.80.6661: P 7431:7446(15) ack 129519 win 64091 (DF)
13:57:09.745993 IP 61.129.59.80.6661 > 192.168.27.100.1140: . ack 7416 win 11680 (DF)
13:57:09.747124 IP 192.168.27.100.1140 > 61.129.59.80.6661: P 7446:7476(30) ack 129519 win 64091 (DF)
13:57:09.819569 IP 61.129.59.80.6661 > 192.168.27.100.1140: . 129519:130979(1460) ack 7416 win 11680 (DF)
13:57:09.972607 IP 192.168.27.100.1140 > 61.129.59.80.6661: . ack 130979 win 65535 (DF)
13:57:10.014231 IP 61.129.59.80.6661 > 192.168.27.100.1140: . ack 7431 win 11680 (DF)
13:57:10.244904 IP 61.129.59.80.6661 > 192.168.27.100.1140: P 130979:132028(1049) ack 7446 win 11680 (DF)
13:57:10.245923 IP 192.168.27.100.1140 > 61.129.59.80.6661: P 7476:7491(15) ack 132028 win 64486 (DF)
13:57:10.590889 IP 61.129.59.80.6661 > 192.168.27.100.1140: . 132028:133488(1460) ack 7446 win 11680 (DF)
13:57:10.637877 IP 61.129.59.80.6661 > 192.168.27.100.1140: . ack 7476 win 11680 (DF)
13:57:10.769226 IP 192.168.27.100.1140 > 61.129.59.80.6661: . ack 133488 win 65535 (DF)
13:57:11.030336 IP 61.129.59.80.6661 > 192.168.27.100.1140: . 133488:134948(1460) ack 7476 win 11680 (DF)
13:57:11.033149 IP 192.168.27.100.1140 > 61.129.59.80.6661: P 7491:7506(15) ack 134948 win 65535 (DF)
13:57:11.080758 IP 61.129.59.80.6661 > 192.168.27.100.1140: P 134948:135141(193) ack 7491 win 11680 (DF)
13:57:11.081776 IP 192.168.27.100.1140 > 61.129.59.80.6661: P 7506:7521(15) ack 135141 win 65342 (DF)
13:57:11.596196 IP 61.129.59.80.6661 > 192.168.27.100.1140: . 135141:136601(1460) ack 7491 win 11680 (DF)
13:57:11.597626 IP 192.168.27.100.1140 > 61.129.59.80.6661: P 7521:7596(75) ack 136601 win 65535 (DF)
13:57:11.886807 IP 61.129.59.80.6661 > 192.168.27.100.1140: P 136601:137135(534) ack 7521 win 11680 (DF)
13:57:11.888616 IP 192.168.27.100.1140 > 61.129.59.80.6661: P 7596:7611(15) ack 137135 win 65001 (DF)
13:57:11.891156 IP 61.129.59.80.6661 > 192.168.27.100.1140: . ack 7506 win 11680 (DF)
13:57:11.892616 IP 192.168.27.100.1140 > 61.129.59.80.6661: . ack 137135 win 65001 (DF)
13:57:12.444541 IP 61.129.59.80.6661 > 192.168.27.100.1140: . ack 7596 win 11680 (DF)
13:57:12.447380 IP 192.168.27.100.1140 > 61.129.59.80.6661: P 7611:7776(165) ack 137135 win 65001 (DF)
13:57:12.471983 IP 61.129.59.80.6661 > 192.168.27.100.1140: . 137135:138595(1460) ack 7596 win 11680 (DF)
13:57:12.671845 IP 192.168.27.100.1140 > 61.129.59.80.6661: . ack 138595 win 65535 (DF)
13:57:12.675625 IP 61.129.59.80.6661 > 192.168.27.100.1140: P 138595:139356(761) ack 7611 win 11680 (DF)
13:57:12.872239 IP 192.168.27.100.1140 > 61.129.59.80.6661: . ack 139356 win 64774 (DF)
13:57:13.150648 IP 61.129.59.80.6661 > 192.168.27.100.1140: . 139356:140816(1460) ack 7611 win 11680 (DF)
13:57:13.151816 IP 192.168.27.100.1140 > 61.129.59.80.6661: P 7776:7971(195) ack 140816 win 65535 (DF)
13:57:13.298680 IP 61.129.59.80.6661 > 192.168.27.100.1140: . ack 7776 win 11680 (DF)
13:57:13.479326 IP 61.129.59.80.6661 > 192.168.27.100.1140: . 140816:142276(1460) ack 7776 win 11680 (DF)
13:57:13.671039 IP 61.129.59.80.6661 > 192.168.27.100.1140: P 142276:142660(384) ack 7776 win 11680 (DF)
13:57:13.672198 IP 192.168.27.100.1140 > 61.129.59.80.6661: . ack 142660 win 65535 (DF)
13:57:13.965826 IP 61.129.59.80.6661 > 192.168.27.100.1140: . ack 7971 win 11680 (DF)
13:57:13.968167 IP 192.168.27.100.1140 > 61.129.59.80.6661: P 7971:8106(135) ack 142660 win 65535 (DF)
13:57:14.142563 IP 61.129.59.80.6661 > 192.168.27.100.1140: . 142660:144120(1460) ack 7971 win 11680 (DF)
13:57:14.143836 IP 192.168.27.100.1140 > 61.129.59.80.6661: P 8106:8121(15) ack 144120 win 65535 (DF)
13:57:14.537933 IP 61.129.59.80.6661 > 192.168.27.100.1140: P 144120:144930(810) ack 7971 win 11680 (DF)
13:57:14.540524 IP 192.168.27.100.1140 > 61.129.59.80.6661: P 8121:8136(15) ack 144930 win 64725 (DF)
13:57:14.872474 IP 61.129.59.80.6661 > 192.168.27.100.1140: . ack 8106 win 11680 (DF)
13:57:14.876375 IP 192.168.27.100.1140 > 61.129.59.80.6661: P 8136:8196(60) ack 144930 win 64725 (DF)
13:57:15.016372 IP 61.129.59.80.6661 > 192.168.27.100.1140: . ack 8121 win 11680 (DF)
13:57:15.017170 IP 192.168.27.100.1140 > 61.129.59.80.6661: P 8196:8211(15) ack 144930 win 64725 (DF)
13:57:15.249322 IP 61.129.59.80.6661 > 192.168.27.100.1140: . 144930:146390(1460) ack 8121 win 11680 (DF)
13:57:15.250413 IP 192.168.27.100.1140 > 61.129.59.80.6661: P 8211:8226(15) ack 146390 win 65535 (DF)
13:57:15.357624 IP 61.129.59.80.6661 > 192.168.27.100.1140: P 146390:146796(406) ack 8136 win 11680 (DF)
13:57:15.476172 IP 192.168.27.100.1140 > 61.129.59.80.6661: . ack 146796 win 65129 (DF)
13:57:15.704086 IP 61.129.59.80.6661 > 192.168.27.100.1140: . ack 8196 win 11680 (DF)
13:57:15.707144 IP 192.168.27.100.1140 > 61.129.59.80.6661: P 8226:8241(15) ack 146796 win 65129 (DF)
13:57:15.829829 IP 61.129.59.80.6661 > 192.168.27.100.1140: . ack 8211 win 11680 (DF)
13:57:15.830804 IP 192.168.27.100.1140 > 61.129.59.80.6661: P 8241:8256(15) ack 146796 win 65129 (DF)
13:57:16.055613 IP 61.129.59.80.6661 > 192.168.27.100.1140: . ack 8226 win 11680 (DF)
13:57:16.139298 IP 61.129.59.80.6661 > 192.168.27.100.1140: . 146796:148256(1460) ack 8226 win 11680 (DF)
13:57:16.140157 IP 192.168.27.100.1140 > 61.129.59.80.6661: P 8256:8271(15) ack 148256 win 65535 (DF)
13:57:16.265207 IP 61.129.59.80.6661 > 192.168.27.100.1140: P 148256:148598(342) ack 8226 win 11680 (DF)
13:57:16.377603 IP 192.168.27.100.1140 > 61.129.59.80.6661: . ack 148598 win 65193 (DF)
13:57:16.505435 IP 61.129.59.80.6661 > 192.168.27.100.1140: . ack 8241 win 11680 (DF)
13:57:16.618763 IP 61.129.59.80.6661 > 192.168.27.100.1140: . ack 8256 win 11680 (DF)
13:57:16.909155 IP 61.129.59.80.6661 > 192.168.27.100.1140: . ack 8271 win 11680 (DF)
13:57:16.911561 IP 192.168.27.100.1140 > 61.129.59.80.6661: P 8271:8316(45) ack 148598 win 65193 (DF)
13:57:17.029153 IP 61.129.59.80.6661 > 192.168.27.100.1140: . 148598:150058(1460) ack 8271 win 11680 (DF)
13:57:17.139027 IP 61.129.59.80.6661 > 192.168.27.100.1140: P 150058:150690(632) ack 8271 win 11680 (DF)
13:57:17.139950 IP 192.168.27.100.1140 > 61.129.59.80.6661: . ack 150690 win 65535 (DF)
13:57:17.714699 IP 61.129.59.80.6661 > 192.168.27.100.1140: . ack 8316 win 11680 (DF)
13:57:17.715692 IP 192.168.27.100.1140 > 61.129.59.80.6661: P 8316:8331(15) ack 150690 win 65535 (DF)
13:57:17.926442 IP 61.129.59.80.6661 > 192.168.27.100.1140: P 152150:152449(299) ack 8316 win 11680 (DF)
13:57:17.929421 IP 192.168.27.100.1140 > 61.129.59.80.6661: . ack 150690 win 65535 <nop,nop,sack sack 1 {152150:152449} > (DF)
13:57:17.932287 IP 61.129.59.80.6661 > 192.168.27.100.1140: . 150690:152150(1460) ack 8316 win 11680 (DF)
13:57:17.933347 IP 192.168.27.100.1140 > 61.129.59.80.6661: . ack 152449 win 65535 (DF)
13:57:18.523913 IP 61.129.59.80.6661 > 192.168.27.100.1140: . ack 8331 win 11680 (DF)
13:57:18.740877 IP 61.129.59.80.6661 > 192.168.27.100.1140: P 152449:153841(1392) ack 8331 win 11680 (DF)
13:57:18.880723 IP 192.168.27.100.1140 > 61.129.59.80.6661: . ack 153841 win 64143 (DF)
13:57:19.588020 IP 61.129.59.80.6661 > 192.168.27.100.1140: . 153841:155301(1460) ack 8331 win 11680 (DF)
13:57:19.729364 IP 192.168.27.100.1140 > 61.129.59.80.6661: P 8331:8350(19) ack 155301 win 65535 (DF)
13:57:19.736344 IP 61.129.59.80.6661 > 192.168.27.100.1140: P 155301:155585(284) ack 8331 win 11680 (DF)
13:57:19.885347 IP 192.168.27.100.1140 > 61.129.59.80.6661: . ack 155585 win 65251 (DF)
13:57:20.560182 IP 61.129.59.80.6661 > 192.168.27.100.1140: . 155585:157045(1460) ack 8350 win 11680 (DF)
13:57:20.563186 IP 192.168.27.100.1140 > 61.129.59.80.6661: P 8350:8380(30) ack 157045 win 65535 (DF)
13:57:20.737861 IP 61.129.59.80.6661 > 192.168.27.100.1140: P 157045:157500(455) ack 8350 win 11680 (DF)
13:57:20.883621 IP 192.168.27.100.1140 > 61.129.59.80.6661: . ack 157500 win 65080 (DF)
13:57:21.427621 IP 61.129.59.80.6661 > 192.168.27.100.1140: . ack 8380 win 11680 (DF)
13:57:21.428566 IP 192.168.27.100.1140 > 61.129.59.80.6661: P 8380:8395(15) ack 157500 win 65080 (DF)
13:57:21.598227 IP 61.129.59.80.6661 > 192.168.27.100.1140: . 157500:158960(1460) ack 8380 win 11680 (DF)
13:57:21.688294 IP 61.129.59.80.6661 > 192.168.27.100.1140: P 158960:159386(426) ack 8380 win 11680 (DF)
13:57:21.692839 IP 192.168.27.100.1140 > 61.129.59.80.6661: . ack 159386 win 65535 (DF)
13:57:22.265235 IP 61.129.59.80.6661 > 192.168.27.100.1140: . ack 8395 win 11680 (DF)
13:57:22.266848 IP 192.168.27.100.1140 > 61.129.59.80.6661: P 8395:8425(30) ack 159386 win 65535 (DF)
13:57:22.567812 IP 61.129.59.80.6661 > 192.168.27.100.1140: P 160846:160891(45) ack 8395 win 11680 (DF)
13:57:22.568834 IP 192.168.27.100.1140 > 61.129.59.80.6661: . ack 159386 win 65535 <nop,nop,sack sack 1 {160846:160891} > (DF)
13:57:22.568860 IP 192.168.27.100.1140 > 61.129.59.80.6661: P 8425:8440(15) ack 159386 win 65535 (DF)
13:57:22.572815 IP 61.129.59.80.6661 > 192.168.27.100.1140: . 159386:160846(1460) ack 8395 win 11680 (DF)
13:57:22.574510 IP 192.168.27.100.1140 > 61.129.59.80.6661: . ack 160891 win 65535 (DF)
13:57:23.116687 IP 61.129.59.80.6661 > 192.168.27.100.1140: . ack 8425 win 11680 (DF)
13:57:23.119428 IP 192.168.27.100.1140 > 61.129.59.80.6661: P 8440:8470(30) ack 160891 win 65535 (DF)
13:57:23.150321 IP 61.129.59.80.6661 > 192.168.27.100.1140: . 160891:162351(1460) ack 8425 win 11680 (DF)
13:57:23.287082 IP 192.168.27.100.1140 > 61.129.59.80.6661: . ack 162351 win 65535 (DF)
13:57:23.406334 IP 61.129.59.80.6661 > 192.168.27.100.1140: P 162351:163165(814) ack 8440 win 11680 (DF)
13:57:23.407740 IP 192.168.27.100.1140 > 61.129.59.80.6661: P 8470:8485(15) ack 163165 win 64721 (DF)
13:57:23.918298 IP 61.129.59.80.6661 > 192.168.27.100.1140: . 163165:164625(1460) ack 8440 win 11680 (DF)
13:57:23.920588 IP 192.168.27.100.1140 > 61.129.59.80.6661: P 8485:8515(30) ack 164625 win 65535 (DF)
13:57:23.995912 IP 61.129.59.80.6661 > 192.168.27.100.1140: . ack 8470 win 11680 (DF)
13:57:24.270936 IP 61.129.59.80.6661 > 192.168.27.100.1140: P 164625:165454(829) ack 8485 win 11680 (DF)
13:57:24.274254 IP 192.168.27.100.1140 > 61.129.59.80.6661: P 8515:8530(15) ack 165454 win 64706 (DF)
13:57:24.803980 IP 61.129.59.80.6661 > 192.168.27.100.1140: . ack 8515 win 11680 (DF)
13:57:24.805763 IP 192.168.27.100.1140 > 61.129.59.80.6661: P 8530:8560(30) ack 165454 win 64706 (DF)
13:57:24.808552 IP 61.129.59.80.6661 > 192.168.27.100.1140: . 165454:166914(1460) ack 8515 win 11680 (DF)
13:57:24.992726 IP 192.168.27.100.1140 > 61.129.59.80.6661: . ack 166914 win 65535 (DF)
13:57:25.158656 IP 61.129.59.80.6661 > 192.168.27.100.1140: P 166914:167991(1077) ack 8530 win 11680 (DF)
13:57:25.159043 IP 192.168.27.100.1140 > 61.129.59.80.6661: P 8560:8575(15) ack 167991 win 64458 (DF)
13:57:25.704197 IP 61.129.59.80.6661 > 192.168.27.100.1140: . 167991:169451(1460) ack 8560 win 11680 (DF)
13:57:25.707554 IP 192.168.27.100.1140 > 61.129.59.80.6661: P 8575:8650(75) ack 169451 win 65535 (DF)
13:57:26.026141 IP 61.129.59.80.6661 > 192.168.27.100.1140: P 169451:170574(1123) ack 8575 win 11680 (DF)
13:57:26.027294 IP 192.168.27.100.1140 > 61.129.59.80.6661: P 8650:8665(15) ack 170574 win 64412 (DF)
13:57:26.358380 IP 61.129.59.80.6661 > 192.168.27.100.1140: . 170574:172034(1460) ack 8575 win 11680 (DF)
13:57:26.359445 IP 192.168.27.100.1140 > 61.129.59.80.6661: P 8665:8785(120) ack 172034 win 65535 (DF)
13:57:26.603405 IP 61.129.59.80.6661 > 192.168.27.100.1140: . ack 8650 win 11680 (DF)
13:57:26.810110 IP 61.129.59.80.6661 > 192.168.27.100.1140: . 172034:173494(1460) ack 8650 win 11680 (DF)
13:57:26.858473 IP 61.129.59.80.6661 > 192.168.27.100.1140: P 173494:173611(117) ack 8665 win 11680 (DF)
13:57:26.859447 IP 192.168.27.100.1140 > 61.129.59.80.6661: . ack 173611 win 65535 (DF)
13:57:27.254531 IP 61.129.59.80.6661 > 192.168.27.100.1140: . ack 8785 win 11680 (DF)
13:57:27.255749 IP 192.168.27.100.1140 > 61.129.59.80.6661: P 8785:9010(225) ack 173611 win 65535 (DF)
13:57:27.257675 IP 61.129.59.80.6661 > 192.168.27.100.1140: . 173611:175071(1460) ack 8785 win 11680 (DF)
13:57:27.392915 IP 192.168.27.100.1140 > 61.129.59.80.6661: . ack 175071 win 65535 (DF)
13:57:27.698033 IP 61.129.59.80.6661 > 192.168.27.100.1140: P 176531:176551(20) ack 8785 win 11680 (DF)
13:57:27.699444 IP 61.129.59.80.6661 > 192.168.27.100.1140: . 175071:176531(1460) ack 8785 win 11680 (DF)
13:57:27.700084 IP 192.168.27.100.1140 > 61.129.59.80.6661: . ack 175071 win 65535 <nop,nop,sack sack 1 {176531:176551} > (DF)
13:57:27.700119 IP 192.168.27.100.1140 > 61.129.59.80.6661: P 9010:9025(15) ack 175071 win 65535 (DF)
13:57:27.700464 IP 192.168.27.100.1140 > 61.129.59.80.6661: . ack 176551 win 65535 (DF)
13:57:28.150139 IP 61.129.59.80.6661 > 192.168.27.100.1140: . ack 9010 win 11680 (DF)
13:57:28.154021 IP 192.168.27.100.1140 > 61.129.59.80.6661: P 9025:9175(150) ack 176551 win 65535 (DF)
13:57:28.262306 IP 61.129.59.80.6661 > 192.168.27.100.1140: . 176551:178011(1460) ack 9010 win 11680 (DF)
13:57:28.394405 IP 192.168.27.100.1140 > 61.129.59.80.6661: . ack 178011 win 65535 (DF)
13:57:28.526310 IP 61.129.59.80.6661 > 192.168.27.100.1140: P 178011:179151(1140) ack 9025 win 11680 (DF)
13:57:28.694823 IP 192.168.27.100.1140 > 61.129.59.80.6661: . ack 179151 win 64395 (DF)
13:57:29.023357 IP 61.129.59.80.6661 > 192.168.27.100.1140: . ack 9175 win 11680 (DF)
13:57:29.024422 IP 192.168.27.100.1140 > 61.129.59.80.6661: P 9175:9250(75) ack 179151 win 64395 (DF)
13:57:29.853254 IP 61.129.59.80.6661 > 192.168.27.100.1140: . ack 9250 win 11680 (DF)
13:57:29.855771 IP 192.168.27.100.1140 > 61.129.59.80.6661: P 9250:9265(15) ack 179151 win 64395 (DF)
13:57:30.472762 IP 61.129.59.80.6661 > 192.168.27.100.1140: . 180872:182332(1460) ack 9250 win 11680 (DF)
13:57:30.473894 IP 192.168.27.100.1140 > 61.129.59.80.6661: . ack 179151 win 64395 <nop,nop,sack sack 1 {180872:182332} > (DF)
13:57:30.473925 IP 192.168.27.100.1140 > 61.129.59.80.6661: P 9265:9295(30) ack 179151 win 64395 (DF)
13:57:30.654521 IP 61.129.59.80.6661 > 192.168.27.100.1140: . ack 9265 win 11680 (DF)
13:57:30.721402 IP 61.129.59.80.6661 > 192.168.27.100.1140: . 179151:180611(1460) ack 9265 win 11680 (DF)
13:57:30.898378 IP 192.168.27.100.1140 > 61.129.59.80.6661: . ack 180611 win 65535 <nop,nop,sack sack 1 {180872:182332} > (DF)
13:57:31.317554 IP 61.129.59.80.6661 > 192.168.27.100.1140: . ack 9295 win 11680 (DF)
13:57:31.320024 IP 192.168.27.100.1140 > 61.129.59.80.6661: P 9295:9340(45) ack 180611 win 65535 (DF)
13:57:31.724109 IP 61.129.59.80.6661 > 192.168.27.100.1140: . 182332:183792(1460) ack 9295 win 11680 (DF)
13:57:31.725588 IP 61.129.59.80.6661 > 192.168.27.100.1140: P 180611:180872(261) ack 9295 win 11680 (DF)
13:57:31.729186 IP 192.168.27.100.1140 > 61.129.59.80.6661: . ack 182332 win 65535 (DF)
13:57:31.729196 IP 192.168.27.100.1140 > 61.129.59.80.6661: P 9340:9415(75) ack 183792 win 65535 (DF)
13:57:32.162666 IP 61.129.59.80.6661 > 192.168.27.100.1140: . ack 9340 win 11680 (DF)
13:57:32.163523 IP 192.168.27.100.1140 > 61.129.59.80.6661: P 9415:9460(45) ack 183792 win 65535 (DF)
13:57:32.569039 IP 61.129.59.80.6661 > 192.168.27.100.1140: P 183792:184817(1025) ack 9340 win 11680 (DF)
13:57:32.572283 IP 192.168.27.100.1140 > 61.129.59.80.6661: P 9460:9490(30) ack 184817 win 64510 (DF)
13:57:32.574087 IP 61.129.59.80.6661 > 192.168.27.100.1140: . ack 9415 win 11680 (DF)
13:57:33.009903 IP 61.129.59.80.6661 > 192.168.27.100.1140: . ack 9460 win 11680 (DF)
13:57:33.011969 IP 192.168.27.100.1140 > 61.129.59.80.6661: P 9490:9505(15) ack 184817 win 64510 (DF)
13:57:33.415968 IP 61.129.59.80.6661 > 192.168.27.100.1140: P 184817:186093(1276) ack 9490 win 11680 (DF)
13:57:33.417088 IP 192.168.27.100.1140 > 61.129.59.80.6661: P 9505:9520(15) ack 186093 win 65535 (DF)
13:57:33.913937 IP 61.129.59.80.6661 > 192.168.27.100.1140: . ack 9505 win 11680 (DF)
13:57:33.916320 IP 192.168.27.100.1140 > 61.129.59.80.6661: P 9520:9550(30) ack 186093 win 65535 (DF)
13:57:34.255799 IP 61.129.59.80.6661 > 192.168.27.100.1140: P 186093:187027(934) ack 9520 win 11680 (DF)
13:57:34.256545 IP 192.168.27.100.1140 > 61.129.59.80.6661: P 9550:9565(15) ack 187027 win 64601 (DF)
13:57:34.785389 IP 61.129.59.80.6661 > 192.168.27.100.1140: . ack 9550 win 11680 (DF)
13:57:34.786464 IP 192.168.27.100.1140 > 61.129.59.80.6661: P 9565:9610(45) ack 187027 win 64601 (DF)
13:57:35.082985 IP 61.129.59.80.6661 > 192.168.27.100.1140: P 187027:187762(735) ack 9565 win 11680 (DF)
13:57:35.085981 IP 192.168.27.100.1140 > 61.129.59.80.6661: P 9610:9625(15) ack 187762 win 65535 (DF)
13:57:35.676454 IP 61.129.59.80.6661 > 192.168.27.100.1140: . ack 9610 win 11680 (DF)
13:57:35.677470 IP 192.168.27.100.1140 > 61.129.59.80.6661: P 9625:9655(30) ack 187762 win 65535 (DF)
13:57:35.905186 IP 61.129.59.80.6661 > 192.168.27.100.1140: P 187762:188784(1022) ack 9625 win 11680 (DF)
13:57:36.107145 IP 192.168.27.100.1140 > 61.129.59.80.6661: . ack 188784 win 64513 (DF)
13:57:36.573200 IP 61.129.59.80.6661 > 192.168.27.100.1140: . ack 9655 win 11680 (DF)
13:57:36.575801 IP 192.168.27.100.1140 > 61.129.59.80.6661: P 9655:9685(30) ack 188784 win 64513 (DF)
13:57:36.904738 IP 61.129.59.80.6661 > 192.168.27.100.1140: P 188784:189725(941) ack 9655 win 11680 (DF)
13:57:36.905788 IP 192.168.27.100.1140 > 61.129.59.80.6661: P 9685:9715(30) ack 189725 win 65535 (DF)
13:57:37.365561 IP 61.129.59.80.6661 > 192.168.27.100.1140: . ack 9685 win 11680 (DF)
13:57:37.368193 IP 192.168.27.100.1140 > 61.129.59.80.6661: P 9715:9730(15) ack 189725 win 65535 (DF)
13:57:37.691055 IP 61.129.59.80.6661 > 192.168.27.100.1140: P 189725:190405(680) ack 9715 win 11680 (DF)
13:57:37.692007 IP 192.168.27.100.1140 > 61.129.59.80.6661: P 9730:9745(15) ack 190405 win 64855 (DF)
13:57:38.213841 IP 61.129.59.80.6661 > 192.168.27.100.1140: . ack 9730 win 11680 (DF)
13:57:38.214867 IP 192.168.27.100.1140 > 61.129.59.80.6661: P 9745:9760(15) ack 190405 win 64855 (DF)
13:57:38.516851 IP 61.129.59.80.6661 > 192.168.27.100.1140: P 190405:191318(913) ack 9745 win 11680 (DF)
13:57:38.520074 IP 192.168.27.100.1140 > 61.129.59.80.6661: P 9760:9790(30) ack 191318 win 65535 (DF)
13:57:39.063875 IP 61.129.59.80.6661 > 192.168.27.100.1140: . ack 9760 win 11680 (DF)
13:57:39.064860 IP 192.168.27.100.1140 > 61.129.59.80.6661: P 9790:9805(15) ack 191318 win 65535 (DF)
13:57:39.351226 IP 61.129.59.80.6661 > 192.168.27.100.1140: P 191318:192245(927) ack 9790 win 11680 (DF)
13:57:39.352432 IP 192.168.27.100.1140 > 61.129.59.80.6661: P 9805:9820(15) ack 192245 win 64608 (DF)
13:57:39.912402 IP 61.129.59.80.6661 > 192.168.27.100.1140: . ack 9805 win 11680 (DF)
13:57:40.153729 IP 61.129.59.80.6661 > 192.168.27.100.1140: P 192245:193239(994) ack 9820 win 11680 (DF)
13:57:40.154711 IP 192.168.27.100.1140 > 61.129.59.80.6661: P 9820:9850(30) ack 193239 win 65535 (DF)
13:57:40.961679 IP 61.129.59.80.6661 > 192.168.27.100.1140: P 193239:193892(653) ack 9850 win 11680 (DF)
13:57:40.965512 IP 192.168.27.100.1140 > 61.129.59.80.6661: P 9850:9880(30) ack 193892 win 64882 (DF)
13:57:41.754801 IP 61.129.59.80.6661 > 192.168.27.100.1140: P 193892:194501(609) ack 9880 win 11680 (DF)
13:57:41.755973 IP 192.168.27.100.1140 > 61.129.59.80.6661: P 9880:9910(30) ack 194501 win 64273 (DF)
13:57:42.543783 IP 61.129.59.80.6661 > 192.168.27.100.1140: P 194501:195185(684) ack 9910 win 11680 (DF)
13:57:42.546545 IP 192.168.27.100.1140 > 61.129.59.80.6661: P 9910:9940(30) ack 195185 win 65535 (DF)
13:57:43.327000 IP 61.129.59.80.6661 > 192.168.27.100.1140: P 195185:195851(666) ack 9940 win 11680 (DF)
13:57:43.328787 IP 192.168.27.100.1140 > 61.129.59.80.6661: P 9940:9985(45) ack 195851 win 64869 (DF)
13:57:44.131688 IP 61.129.59.80.6661 > 192.168.27.100.1140: P 195851:196480(629) ack 9985 win 11680 (DF)
13:57:44.134368 IP 192.168.27.100.1140 > 61.129.59.80.6661: P 9985:10060(75) ack 196480 win 64240 (DF)
13:57:44.974162 IP 61.129.59.80.6661 > 192.168.27.100.1140: P 196480:197223(743) ack 10060 win 11680 (DF)
13:57:44.977006 IP 192.168.27.100.1140 > 61.129.59.80.6661: P 10060:10195(135) ack 197223 win 65535 (DF)
13:57:45.803826 IP 61.129.59.80.6661 > 192.168.27.100.1140: P 197223:198105(882) ack 10195 win 11680 (DF)
13:57:45.808137 IP 192.168.27.100.1140 > 61.129.59.80.6661: P 10195:10330(135) ack 198105 win 64653 (DF)
13:57:46.624112 IP 61.129.59.80.6661 > 192.168.27.100.1140: P 198105:199333(1228) ack 10330 win 11680 (DF)
13:57:46.625385 IP 192.168.27.100.1140 > 61.129.59.80.6661: P 10330:10345(15) ack 199333 win 65535 (DF)
13:57:47.438544 IP 61.129.59.80.6661 > 192.168.27.100.1140: P 199333:200361(1028) ack 10345 win 11680 (DF)
13:57:47.440872 IP 192.168.27.100.1140 > 61.129.59.80.6661: P 10345:10390(45) ack 200361 win 64507 (DF)
13:57:48.311433 IP 61.129.59.80.6661 > 192.168.27.100.1140: P 200361:201200(839) ack 10390 win 11680 (DF)
13:57:48.312340 IP 192.168.27.100.1140 > 61.129.59.80.6661: P 10390:10405(15) ack 201200 win 65535 (DF)
13:57:49.326639 IP 192.168.27.100.1140 > 61.129.59.80.6661: P 10390:10450(60) ack 201200 win 65535 (DF)
13:57:50.132080 IP 61.129.59.80.6661 > 192.168.27.100.1140: . ack 10450 win 11680 <nop,nop,sack sack 1 {10390:10405} > (DF)
13:57:50.133617 IP 192.168.27.100.1140 > 61.129.59.80.6661: P 10450:10495(45) ack 201200 win 65535 (DF)
13:57:50.140178 IP 61.129.59.80.6661 > 192.168.27.100.1140: P 201200:202375(1175) ack 10450 win 11680 (DF)
13:57:50.144571 IP 61.129.59.80.6661 > 192.168.27.100.1140: . 202375:203835(1460) ack 10450 win 11680 (DF)
13:57:50.146990 IP 192.168.27.100.1140 > 61.129.59.80.6661: . ack 203835 win 65535 (DF)
13:57:50.893133 IP 61.129.59.80.6661 > 192.168.27.100.1140: P 203835:205001(1166) ack 10495 win 11680 (DF)
13:57:50.895905 IP 192.168.27.100.1140 > 61.129.59.80.6661: P 10495:10525(30) ack 205001 win 64369 (DF)
13:57:51.665211 IP 61.129.59.80.6661 > 192.168.27.100.1140: P 205001:206077(1076) ack 10525 win 11680 (DF)
13:57:51.666462 IP 192.168.27.100.1140 > 61.129.59.80.6661: P 10525:10555(30) ack 206077 win 65535 (DF)
13:57:52.244449 IP 61.129.59.80.6661 > 192.168.27.100.1140: P 206077:206961(884) ack 10555 win 11680 (DF)
13:57:52.247911 IP 192.168.27.100.1140 > 61.129.59.80.6661: P 10555:10596(41) ack 206961 win 64651 (DF)
13:57:52.732451 IP 61.129.59.80.6661 > 192.168.27.100.1140: P 206961:207786(825) ack 10596 win 11680 (DF)
13:57:52.908009 IP 192.168.27.100.1140 > 61.129.59.80.6661: P 10596:10611(15) ack 207786 win 65535 (DF)
13:57:53.263165 IP 61.129.59.80.6661 > 192.168.27.100.1140: P 207786:208819(1033) ack 10611 win 11680 (DF)
13:57:53.348739 IP 192.168.27.100.1140 > 61.129.59.80.6661: P 10611:10626(15) ack 208819 win 64502 (DF)
13:57:54.038641 IP 61.129.59.80.6661 > 192.168.27.100.1140: . 208819:210279(1460) ack 10611 win 11680 (DF)
13:57:54.040401 IP 192.168.27.100.1140 > 61.129.59.80.6661: P 10626:10641(15) ack 210279 win 65535 (DF)
13:57:54.218786 IP 61.129.59.80.6661 > 192.168.27.100.1140: P 207786:208819(1033) ack 10611 win 11680 (DF)
13:57:54.220020 IP 192.168.27.100.1140 > 61.129.59.80.6661: . ack 210279 win 65535 (DF)
13:57:54.307646 IP 61.129.59.80.6661 > 192.168.27.100.1140: P 210279:211028(749) ack 10611 win 11680 <nop,nop,sack sack 1 {10626:10641} > (DF)
13:57:54.310072 IP 192.168.27.100.1140 > 61.129.59.80.6661: P 10641:10656(15) ack 211028 win 64786 (DF)
13:57:54.916747 IP 61.129.59.80.6661 > 192.168.27.100.1140: . 211028:212476(1448) ack 10611 win 11680 <nop,nop,sack sack 1 {10626:10641} > (DF)
13:57:54.918211 IP 192.168.27.100.1140 > 61.129.59.80.6661: P 10656:10686(30) ack 212476 win 65535 (DF)
13:57:55.035075 IP 192.168.27.100.1140 > 61.129.59.80.6661: P 10611:10686(75) ack 212476 win 65535 (DF)
13:57:55.182534 IP 61.129.59.80.6661 > 192.168.27.100.1140: P 212476:213013(537) ack 10611 win 11680 <nop,nop,sack sack 2 {10656:10686}{10626:10641} > (DF)
13:57:55.182918 IP 192.168.27.100.1140 > 61.129.59.80.6661: P 10686:10701(15) ack 213013 win 64998 (DF)
13:57:55.274191 IP 61.129.59.80.6661 > 192.168.27.100.1140: . ack 10686 win 11680 <nop,nop,sack sack 1 {10626:10686} > (DF)
13:57:55.277322 IP 192.168.27.100.1140 > 61.129.59.80.6661: P 10701:10716(15) ack 213013 win 64998 (DF)
13:57:55.395896 IP 61.129.59.80.6661 > 192.168.27.100.1140: P 213013:213776(763) ack 10701 win 11680 (DF)
13:57:55.533421 IP 192.168.27.100.1140 > 61.129.59.80.6661: . ack 213776 win 64235 (DF)
13:57:55.758568 IP 61.129.59.80.6661 > 192.168.27.100.1140: P 213776:214537(761) ack 10701 win 11680 (DF)
13:57:55.933857 IP 192.168.27.100.1140 > 61.129.59.80.6661: . ack 214537 win 65535 (DF)
13:57:56.146892 IP 61.129.59.80.6661 > 192.168.27.100.1140: P 214537:215738(1201) ack 10701 win 11680 (DF)
13:57:56.148185 IP 192.168.27.100.1140 > 61.129.59.80.6661: P 10716:10776(60) ack 215738 win 64334 (DF)
13:57:56.355788 IP 61.129.59.80.6661 > 192.168.27.100.1140: P 215738:216371(633) ack 10701 win 11680 <nop,nop,sack sack 1 {10716:10776} > (DF)
13:57:56.358406 IP 192.168.27.100.1140 > 61.129.59.80.6661: P 10776:10836(60) ack 216371 win 65535 (DF)
13:57:56.596955 IP 61.129.59.80.6661 > 192.168.27.100.1140: P 216371:217002(631) ack 10701 win 11680 <nop,nop,sack sack 1 {10716:10836} > (DF)
13:57:56.597979 IP 192.168.27.100.1140 > 61.129.59.80.6661: P 10836:10851(15) ack 217002 win 64904 (DF)
13:57:57.143838 IP 61.129.59.80.6661 > 192.168.27.100.1140: . 217002:218450(1448) ack 10701 win 11680 <nop,nop,sack sack 1 {10716:10836} > (DF)
13:57:57.145691 IP 192.168.27.100.1140 > 61.129.59.80.6661: P 10851:10881(30) ack 218450 win 65535 (DF)
13:57:57.336582 IP 192.168.27.100.1140 > 61.129.59.80.6661: P 10701:10881(180) ack 218450 win 65535 (DF)
13:57:57.356756 IP 61.129.59.80.6661 > 192.168.27.100.1140: P 218450:219018(568) ack 10701 win 11680 <nop,nop,sack sack 2 {10851:10881}{10716:10836} > (DF)
13:57:57.536394 IP 192.168.27.100.1140 > 61.129.59.80.6661: . ack 219018 win 64967 (DF)
13:57:57.577947 IP 61.129.59.80.6661 > 192.168.27.100.1140: . ack 10881 win 11680 <nop,nop,sack sack 1 {10716:10881} > (DF)
13:57:57.579202 IP 192.168.27.100.1140 > 61.129.59.80.6661: P 10881:10986(105) ack 219018 win 64967 (DF)
13:57:57.693478 IP 61.129.59.80.6661 > 192.168.27.100.1140: . 219018:220478(1460) ack 10881 win 11680 (DF)
13:57:57.737562 IP 61.129.59.80.6661 > 192.168.27.100.1140: P 220478:220777(299) ack 10881 win 11680 (DF)
13:57:57.738452 IP 192.168.27.100.1140 > 61.129.59.80.6661: . ack 220777 win 65535 (DF)
13:57:57.791043 IP 61.129.59.80.6661 > 192.168.27.100.1140: . ack 10986 win 11680 (DF)
13:57:57.792096 IP 192.168.27.100.1140 > 61.129.59.80.6661: P 10986:11031(45) ack 220777 win 65535 (DF)
13:57:57.993789 IP 61.129.59.80.6661 > 192.168.27.100.1140: P 220777:221661(884) ack 11031 win 11680 (DF)
13:57:57.995831 IP 192.168.27.100.1140 > 61.129.59.80.6661: P 11031:11046(15) ack 221661 win 64651 (DF)
13:57:58.357579 IP 61.129.59.80.6661 > 192.168.27.100.1140: . 221661:223121(1460) ack 11031 win 11680 (DF)
13:57:58.360203 IP 192.168.27.100.1140 > 61.129.59.80.6661: P 11046:11076(30) ack 223121 win 65535 (DF)
13:57:58.588377 IP 61.129.59.80.6661 > 192.168.27.100.1140: P 223121:223853(732) ack 11031 win 11680 <nop,nop,sack sack 1 {11046:11076} > (DF)
13:57:58.738123 IP 192.168.27.100.1140 > 61.129.59.80.6661: . ack 223853 win 64803 (DF)
13:57:58.940350 IP 61.129.59.80.6661 > 192.168.27.100.1140: P 223853:224955(1102) ack 11031 win 11680 <nop,nop,sack sack 1 {11046:11076} > (DF)
13:57:58.941391 IP 192.168.27.100.1140 > 61.129.59.80.6661: P 11076:11151(75) ack 224955 win 65535 (DF)
13:57:59.164081 IP 61.129.59.80.6661 > 192.168.27.100.1140: P 224955:225462(507) ack 11031 win 11680 <nop,nop,sack sack 1 {11046:11151} > (DF)
13:57:59.164875 IP 192.168.27.100.1140 > 61.129.59.80.6661: P 11151:11196(45) ack 225462 win 65028 (DF)
13:57:59.460063 IP 61.129.59.80.6661 > 192.168.27.100.1140: P 225462:226142(680) ack 11031 win 11680 <nop,nop,sack sack 1 {11046:11196} > (DF)
13:57:59.463187 IP 192.168.27.100.1140 > 61.129.59.80.6661: P 11196:11241(45) ack 226142 win 64348 (DF)
13:57:59.716458 IP 61.129.59.80.6661 > 192.168.27.100.1140: P 226142:227039(897) ack 11031 win 11680 <nop,nop,sack sack 1 {11046:11241} > (DF)
13:57:59.717707 IP 192.168.27.100.1140 > 61.129.59.80.6661: P 11241:11271(30) ack 227039 win 65535 (DF)
13:57:59.967019 IP 61.129.59.80.6661 > 192.168.27.100.1140: P 227039:227855(816) ack 11031 win 11680 <nop,nop,sack sack 1 {11046:11271} > (DF)
13:57:59.967805 IP 192.168.27.100.1140 > 61.129.59.80.6661: P 11271:11331(60) ack 227855 win 64719 (DF)
13:58:00.040086 IP 192.168.27.100.1140 > 61.129.59.80.6661: P 11031:11406(375) ack 227855 win 64719 (DF)
13:58:00.191155 IP 61.129.59.80.6661 > 192.168.27.100.1140: P 227855:228477(622) ack 11031 win 11680 <nop,nop,sack sack 1 {11046:11331} > (DF)
13:58:00.193868 IP 192.168.27.100.1140 > 61.129.59.80.6661: P 11406:11421(15) ack 228477 win 64097 (DF)
13:58:00.277440 IP 61.129.59.80.6661 > 192.168.27.100.1140: . ack 11406 win 11680 <nop,nop,sack sack 1 {11046:11406} > (DF)
13:58:00.278418 IP 192.168.27.100.1140 > 61.129.59.80.6661: P 11421:11466(45) ack 228477 win 64097 (DF)
13:58:00.355365 IP 61.129.59.80.6661 > 192.168.27.100.1140: . 228477:229937(1460) ack 11406 win 11680 (DF)
13:58:00.518087 IP 61.129.59.80.6661 > 192.168.27.100.1140: P 229937:230497(560) ack 11406 win 11680 <nop,nop,sack sack 1 {11421:11466} > (DF)
13:58:00.520752 IP 192.168.27.100.1140 > 61.129.59.80.6661: . ack 230497 win 65535 (DF)
13:58:00.761879 IP 61.129.59.80.6661 > 192.168.27.100.1140: P 230497:231008(511) ack 11406 win 11680 <nop,nop,sack sack 1 {11421:11466} > (DF)
13:58:00.763031 IP 192.168.27.100.1140 > 61.129.59.80.6661: P 11466:11541(75) ack 231008 win 65024 (DF)
13:58:01.007912 IP 61.129.59.80.6661 > 192.168.27.100.1140: P 231008:231665(657) ack 11406 win 11680 <nop,nop,sack sack 1 {11421:11541} > (DF)
13:58:01.008940 IP 192.168.27.100.1140 > 61.129.59.80.6661: P 11541:11571(30) ack 231665 win 64367 (DF)
13:58:01.251062 IP 61.129.59.80.6661 > 192.168.27.100.1140: P 231665:232482(817) ack 11406 win 11680 <nop,nop,sack sack 1 {11421:11571} > (DF)
13:58:01.252169 IP 192.168.27.100.1140 > 61.129.59.80.6661: P 11571:11616(45) ack 232482 win 65535 (DF)
13:58:01.493309 IP 61.129.59.80.6661 > 192.168.27.100.1140: P 232482:233112(630) ack 11406 win 11680 <nop,nop,sack sack 1 {11421:11616} > (DF)
13:58:01.496441 IP 192.168.27.100.1140 > 61.129.59.80.6661: P 11616:11661(45) ack 233112 win 64905 (DF)
13:58:01.751947 IP 61.129.59.80.6661 > 192.168.27.100.1140: P 233112:233680(568) ack 11406 win 11680 <nop,nop,sack sack 1 {11421:11661} > (DF)
13:58:01.752621 IP 192.168.27.100.1140 > 61.129.59.80.6661: P 11661:11691(30) ack 233680 win 64337 (DF)
13:58:01.999242 IP 61.129.59.80.6661 > 192.168.27.100.1140: P 233680:234243(563) ack 11406 win 11680 <nop,nop,sack sack 1 {11421:11691} > (DF)
13:58:02.002697 IP 192.168.27.100.1140 > 61.129.59.80.6661: P 11691:11706(15) ack 234243 win 65535 (DF)
13:58:02.243241 IP 192.168.27.100.1140 > 61.129.59.80.6661: P 11406:11781(375) ack 234243 win 65535 (DF)
13:58:02.259599 IP 61.129.59.80.6661 > 192.168.27.100.1140: P 234243:235056(813) ack 11406 win 11680 <nop,nop,sack sack 1 {11421:11706} > (DF)
13:58:02.443456 IP 192.168.27.100.1140 > 61.129.59.80.6661: . ack 235056 win 64722 (DF)
13:58:02.500543 IP 61.129.59.80.6661 > 192.168.27.100.1140: . ack 11781 win 11680 <nop,nop,sack sack 1 {11421:11781} > (DF)
13:58:02.504552 IP 192.168.27.100.1140 > 61.129.59.80.6661: P 11781:11856(75) ack 235056 win 64722 (DF)
13:58:02.521402 IP 61.129.59.80.6661 > 192.168.27.100.1140: . 235056:236516(1460) ack 11781 win 11680 (DF)
13:58:02.643753 IP 192.168.27.100.1140 > 61.129.59.80.6661: . ack 236516 win 65535 (DF)
13:58:02.662123 IP 61.129.59.80.6661 > 192.168.27.100.1140: P 236516:236888(372) ack 11781 win 11680 (DF)
13:58:02.761710 IP 61.129.59.80.6661 > 192.168.27.100.1140: . ack 11856 win 11680 (DF)
13:58:02.762692 IP 192.168.27.100.1140 > 61.129.59.80.6661: P 11856:11901(45) ack 236888 win 65163 (DF)
13:58:02.983115 IP 61.129.59.80.6661 > 192.168.27.100.1140: P 236888:237777(889) ack 11901 win 11680 (DF)
13:58:03.126471 IP 192.168.27.100.1140 > 61.129.59.80.6661: P 11901:11916(15) ack 237777 win 64274 (DF)
13:58:03.344635 IP 61.129.59.80.6661 > 192.168.27.100.1140: P 237777:238535(758) ack 11916 win 11680 (DF)
13:58:03.545342 IP 192.168.27.100.1140 > 61.129.59.80.6661: . ack 238535 win 65535 (DF)
13:58:03.743266 IP 192.168.27.100.1140 > 61.129.59.80.6661: P 11916:11931(15) ack 238535 win 65535 (DF)
13:58:03.767455 IP 61.129.59.80.6661 > 192.168.27.100.1140: P 238535:239340(805) ack 11916 win 11680 (DF)
13:58:03.945680 IP 192.168.27.100.1140 > 61.129.59.80.6661: . ack 239340 win 64730 (DF)
13:58:03.981294 IP 61.129.59.80.6661 > 192.168.27.100.1140: . ack 11931 win 11680 (DF)
13:58:04.072885 IP 192.168.27.100.1140 > 61.129.59.80.6661: P 11931:11946(15) ack 239340 win 64730 (DF)
13:58:04.148180 IP 61.129.59.80.6661 > 192.168.27.100.1140: P 239340:240120(780) ack 11931 win 11680 (DF)
13:58:04.305874 IP 61.129.59.80.6661 > 192.168.27.100.1140: . ack 11946 win 11680 (DF)
13:58:04.346191 IP 192.168.27.100.1140 > 61.129.59.80.6661: . ack 240120 win 65535 (DF)
13:58:04.555967 IP 61.129.59.80.6661 > 192.168.27.100.1140: P 240120:240574(454) ack 11946 win 11680 (DF)
13:58:04.748380 IP 192.168.27.100.1140 > 61.129.59.80.6661: . ack 240574 win 65081 (DF)
13:58:04.758383 IP 192.168.27.100.1140 > 61.129.59.80.6661: P 11946:11961(15) ack 240574 win 65081 (DF)
13:58:04.986109 IP 61.129.59.80.6661 > 192.168.27.100.1140: P 240574:241099(525) ack 11961 win 11680 (DF)
13:58:05.147224 IP 192.168.27.100.1140 > 61.129.59.80.6661: . ack 241099 win 64556 (DF)
13:58:05.183122 IP 192.168.27.100.1140 > 61.129.59.80.6661: P 11961:11976(15) ack 241099 win 64556 (DF)
13:58:05.372877 IP 61.129.59.80.6661 > 192.168.27.100.1140: P 241099:241765(666) ack 11961 win 11680 (DF)
13:58:05.374867 IP 192.168.27.100.1140 > 61.129.59.80.6661: P 11976:12021(45) ack 241765 win 65535 (DF)
13:58:05.453627 IP 61.129.59.80.6661 > 192.168.27.100.1140: . ack 11976 win 11680 (DF)
13:58:05.598943 IP 61.129.59.80.6661 > 192.168.27.100.1140: P 241765:241961(196) ack 12021 win 11680 (DF)
13:58:05.643127 IP 192.168.27.100.1140 > 61.129.59.80.6661: P 12021:12036(15) ack 241961 win 65339 (DF)
13:58:05.879085 IP 61.129.59.80.6661 > 192.168.27.100.1140: P 241961:242318(357) ack 12036 win 11680 (DF)
13:58:05.921863 IP 192.168.27.100.1140 > 61.129.59.80.6661: P 12036:12051(15) ack 242318 win 64982 (DF)
13:58:06.168012 IP 61.129.59.80.6661 > 192.168.27.100.1140: P 242318:242641(323) ack 12051 win 11680 (DF)
13:58:06.168857 IP 192.168.27.100.1140 > 61.129.59.80.6661: P 12051:12066(15) ack 242641 win 64659 (DF)
13:58:06.745844 IP 61.129.59.80.6661 > 192.168.27.100.1140: P 242318:242641(323) ack 12051 win 11680 (DF)
13:58:06.746855 IP 192.168.27.100.1140 > 61.129.59.80.6661: . ack 242641 win 64659 (DF)
13:58:06.954091 IP 192.168.27.100.1140 > 61.129.59.80.6661: P 12051:12111(60) ack 242641 win 64659 (DF)
13:58:07.006771 IP 61.129.59.80.6661 > 192.168.27.100.1140: P 242641:243564(923) ack 12051 win 11680 (DF)
13:58:07.150149 IP 192.168.27.100.1140 > 61.129.59.80.6661: . ack 243564 win 65535 (DF)
13:58:07.269394 IP 61.129.59.80.6661 > 192.168.27.100.1140: . ack 12111 win 11680 (DF)
13:58:07.270459 IP 192.168.27.100.1140 > 61.129.59.80.6661: P 12111:12126(15) ack 243564 win 65535 (DF)
13:58:07.536465 IP 61.129.59.80.6661 > 192.168.27.100.1140: P 243564:244267(703) ack 12126 win 11680 (DF)
13:58:07.537487 IP 192.168.27.100.1140 > 61.129.59.80.6661: P 12126:12141(15) ack 244267 win 64832 (DF)
13:58:08.153502 IP 192.168.27.100.1140 > 61.129.59.80.6661: P 12126:12186(60) ack 244267 win 64832 (DF)
13:58:08.268887 IP 61.129.59.80.6661 > 192.168.27.100.1140: P 243564:244267(703) ack 12126 win 11680 (DF)
13:58:08.269915 IP 192.168.27.100.1140 > 61.129.59.80.6661: . ack 244267 win 64832 (DF)
13:58:08.434094 IP 61.129.59.80.6661 > 192.168.27.100.1140: P 244267:245131(864) ack 12186 win 11680 (DF)
13:58:08.555144 IP 192.168.27.100.1140 > 61.129.59.80.6661: . ack 245131 win 65535 (DF)
13:58:08.715708 IP 192.168.27.100.1140 > 61.129.59.80.6661: P 12186:12201(15) ack 245131 win 65535 (DF)
13:58:08.836829 IP 61.129.59.80.6661 > 192.168.27.100.1140: P 245131:245698(567) ack 12186 win 11680 (DF)
13:58:08.953072 IP 192.168.27.100.1140 > 61.129.59.80.6661: . ack 245698 win 64968 (DF)
13:58:09.038716 IP 61.129.59.80.6661 > 192.168.27.100.1140: . ack 12201 win 11680 (DF)
13:58:09.152911 IP 192.168.27.100.1140 > 61.129.59.80.6661: P 12201:12216(15) ack 245698 win 64968 (DF)
13:58:09.464264 IP 61.129.59.80.6661 > 192.168.27.100.1140: P 245698:246408(710) ack 12216 win 11680 (DF)
13:58:09.573474 IP 192.168.27.100.1140 > 61.129.59.80.6661: P 12216:12231(15) ack 246408 win 64258 (DF)
13:58:10.258223 IP 192.168.27.100.1140 > 61.129.59.80.6661: P 12216:12246(30) ack 246408 win 64258 (DF)
13:58:10.376099 IP 61.129.59.80.6661 > 192.168.27.100.1140: P 245698:246408(710) ack 12216 win 11680 (DF)
13:58:10.378695 IP 192.168.27.100.1140 > 61.129.59.80.6661: . ack 246408 win 64258 (DF)
13:58:10.571309 IP 61.129.59.80.6661 > 192.168.27.100.1140: P 246408:247654(1246) ack 12246 win 11680 (DF)
13:58:10.573128 IP 192.168.27.100.1140 > 61.129.59.80.6661: P 12246:12261(15) ack 247654 win 65535 (DF)
13:58:10.886714 IP 61.129.59.80.6661 > 192.168.27.100.1140: P 247654:248108(454) ack 12261 win 11680 (DF)
13:58:10.887944 IP 192.168.27.100.1140 > 61.129.59.80.6661: P 12261:12336(75) ack 248108 win 65081 (DF)
13:58:11.208452 IP 61.129.59.80.6661 > 192.168.27.100.1140: P 248108:248736(628) ack 12336 win 11680 (DF)
13:58:11.209795 IP 192.168.27.100.1140 > 61.129.59.80.6661: P 12336:12366(30) ack 248736 win 64453 (DF)
13:58:11.546146 IP 61.129.59.80.6661 > 192.168.27.100.1140: P 248736:249477(741) ack 12366 win 11680 (DF)
13:58:11.548320 IP 192.168.27.100.1140 > 61.129.59.80.6661: P 12366:12411(45) ack 249477 win 65535 (DF)
13:58:11.805965 IP 61.129.59.80.6661 > 192.168.27.100.1140: P 249477:250185(708) ack 12411 win 11680 (DF)
13:58:11.846570 IP 192.168.27.100.1140 > 61.129.59.80.6661: P 12411:12426(15) ack 250185 win 64827 (DF)
13:58:12.357770 IP 192.168.27.100.1140 > 61.129.59.80.6661: P 12411:12471(60) ack 250185 win 64827 (DF)
13:58:12.452374 IP 61.129.59.80.6661 > 192.168.27.100.1140: P 250185:251428(1243) ack 12471 win 11680 (DF)
13:58:12.513291 IP 192.168.27.100.1140 > 61.129.59.80.6661: P 12471:12486(15) ack 251428 win 65535 (DF)
13:58:12.609488 IP 61.129.59.80.6661 > 192.168.27.100.1140: P 251428:252055(627) ack 12486 win 11680 (DF)
13:58:12.758281 IP 192.168.27.100.1140 > 61.129.59.80.6661: . ack 252055 win 64908 (DF)
13:58:13.252767 IP 61.129.59.80.6661 > 192.168.27.100.1140: . 252055:253515(1460) ack 12486 win 11680 (DF)
13:58:13.342080 IP 192.168.27.100.1140 > 61.129.59.80.6661: P 12486:12501(15) ack 253515 win 65535 (DF)
13:58:13.557479 IP 61.129.59.80.6661 > 192.168.27.100.1140: P 251428:252055(627) ack 12486 win 11680 (DF)
13:58:13.557807 IP 192.168.27.100.1140 > 61.129.59.80.6661: . ack 253515 win 65535 (DF)
13:58:14.260424 IP 192.168.27.100.1140 > 61.129.59.80.6661: P 12486:12531(45) ack 253515 win 65535 (DF)
13:58:14.327346 IP 61.129.59.80.6661 > 192.168.27.100.1140: P 254975:256266(1291) ack 12531 win 11680 (DF)
13:58:14.328258 IP 192.168.27.100.1140 > 61.129.59.80.6661: . ack 253515 win 65535 <nop,nop,sack sack 1 {254975:256266} > (DF)
13:58:14.331421 IP 61.129.59.80.6661 > 192.168.27.100.1140: . 253515:254975(1460) ack 12531 win 11680 (DF)
13:58:14.332231 IP 192.168.27.100.1140 > 61.129.59.80.6661: . ack 256266 win 65535 (DF)
13:58:14.540570 IP 192.168.27.100.1140 > 61.129.59.80.6661: P 12531:12546(15) ack 256266 win 65535 (DF)
13:58:15.564173 IP 192.168.27.100.1140 > 61.129.59.80.6661: P 12531:12681(150) ack 256266 win 65535 (DF)
13:58:15.613066 IP 61.129.59.80.6661 > 192.168.27.100.1140: P 259186:259971(785) ack 12681 win 11680 (DF)
13:58:15.614228 IP 61.129.59.80.6661 > 192.168.27.100.1140: . 256266:257726(1460) ack 12681 win 11680 (DF)
13:58:15.614438 IP 61.129.59.80.6661 > 192.168.27.100.1140: . 257726:259186(1460) ack 12681 win 11680 (DF)
13:58:15.614794 IP 192.168.27.100.1140 > 61.129.59.80.6661: . ack 256266 win 65535 <nop,nop,sack sack 1 {259186:259971} > (DF)
13:58:15.615072 IP 192.168.27.100.1140 > 61.129.59.80.6661: . ack 259971 win 65535 (DF)
13:58:15.764395 IP 192.168.27.100.1140 > 61.129.59.80.6661: P 12681:12696(15) ack 259971 win 65535 (DF)
13:58:16.865360 IP 192.168.27.100.1140 > 61.129.59.80.6661: P 12681:12846(165) ack 259971 win 65535 (DF)
13:58:16.932537 IP 61.129.59.80.6661 > 192.168.27.100.1140: P 262891:264344(1453) ack 12846 win 11680 (DF)
13:58:16.934003 IP 61.129.59.80.6661 > 192.168.27.100.1140: . 259971:261431(1460) ack 12846 win 11680 (DF)
13:58:16.934211 IP 61.129.59.80.6661 > 192.168.27.100.1140: . 261431:262891(1460) ack 12846 win 11680 (DF)
13:58:16.936248 IP 192.168.27.100.1140 > 61.129.59.80.6661: . ack 259971 win 65535 <nop,nop,sack sack 1 {262891:264344} > (DF)
13:58:16.936641 IP 192.168.27.100.1140 > 61.129.59.80.6661: . ack 264344 win 65535 (DF)
13:58:16.990983 IP 192.168.27.100.1140 > 61.129.59.80.6661: P 12846:12861(15) ack 264344 win 65535 (DF)
13:58:17.073592 IP 61.129.59.80.6661 > 192.168.27.100.1140: P 264344:265126(782) ack 12861 win 11680 (DF)
13:58:17.074556 IP 192.168.27.100.1140 > 61.129.59.80.6661: P 12861:12981(120) ack 265126 win 64753 (DF)
13:58:17.135559 IP 61.129.59.80.6661 > 192.168.27.100.1140: P 265126:265650(524) ack 12981 win 11680 (DF)
13:58:17.264795 IP 192.168.27.100.1140 > 61.129.59.80.6661: . ack 265650 win 64229 (DF)
13:58:17.930108 IP 192.168.27.100.1140 > 61.129.59.80.6661: P 12981:12996(15) ack 265650 win 64229 (DF)
13:58:18.767066 IP 192.168.27.100.1140 > 61.129.59.80.6661: P 12981:13026(45) ack 265650 win 64229 (DF)
13:58:20.571282 IP 192.168.27.100.1140 > 61.129.59.80.6661: P 12981:13116(135) ack 265650 win 64229 (DF)
13:58:24.177255 IP 192.168.27.100.1140 > 61.129.59.80.6661: P 12981:13236(255) ack 265650 win 64229 (DF)
13:58:24.301051 IP 61.129.59.80.6661 > 192.168.27.100.1140: . ack 13236 win 11680 <nop,nop,sack sack 1 {12981:13116} > (DF)
13:58:24.495074 IP 192.168.27.100.1140 > 61.129.59.80.6661: P 13236:13251(15) ack 265650 win 64229 (DF)
13:58:25.024212 IP 61.129.59.80.6661 > 192.168.27.100.1140: . 265650:267110(1460) ack 13236 win 11680 (DF)
13:58:25.176820 IP 192.168.27.100.1140 > 61.129.59.80.6661: P 13236:13281(45) ack 267110 win 65535 (DF)
13:58:25.248727 IP 61.129.59.80.6661 > 192.168.27.100.1140: P 267110:268297(1187) ack 13236 win 11680 (DF)
13:58:25.257246 IP 61.129.59.80.6661 > 192.168.27.100.1140: . 268297:269757(1460) ack 13236 win 11680 (DF)
13:58:25.258627 IP 192.168.27.100.1140 > 61.129.59.80.6661: . ack 269757 win 65535 (DF)
13:58:25.285276 IP 61.129.59.80.6661 > 192.168.27.100.1140: . ack 13281 win 11680 (DF)
13:58:25.344259 IP 192.168.27.100.1140 > 61.129.59.80.6661: P 13281:13296(15) ack 269757 win 65535 (DF)
13:58:25.351766 IP 61.129.59.80.6661 > 192.168.27.100.1140: . 269757:271217(1460) ack 13281 win 11680 (DF)
13:58:25.351880 IP 61.129.59.80.6661 > 192.168.27.100.1140: . 271217:272677(1460) ack 13281 win 11680 (DF)
13:58:25.352045 IP 61.129.59.80.6661 > 192.168.27.100.1140: . 272677:274137(1460) ack 13281 win 11680 (DF)
13:58:25.352271 IP 192.168.27.100.1140 > 61.129.59.80.6661: . ack 272677 win 65535 (DF)
13:58:25.476508 IP 192.168.27.100.1140 > 61.129.59.80.6661: . ack 274137 win 65535 (DF)
13:58:25.877843 IP 192.168.27.100.1140 > 61.129.59.80.6661: P 13281:13521(240) ack 274137 win 65535 (DF)
13:58:25.948471 IP 61.129.59.80.6661 > 192.168.27.100.1140: P 277057:278517(1460) ack 13521 win 11680 (DF)
13:58:25.949579 IP 192.168.27.100.1140 > 61.129.59.80.6661: . ack 274137 win 65535 <nop,nop,sack sack 1 {277057:278517} > (DF)
13:58:25.949607 IP 192.168.27.100.1140 > 61.129.59.80.6661: P 13521:13566(45) ack 274137 win 65535 (DF)
13:58:25.950086 IP 61.129.59.80.6661 > 192.168.27.100.1140: . 274137:275597(1460) ack 13521 win 11680 (DF)
13:58:25.950223 IP 61.129.59.80.6661 > 192.168.27.100.1140: . 275597:277057(1460) ack 13521 win 11680 (DF)
13:58:25.950877 IP 192.168.27.100.1140 > 61.129.59.80.6661: . ack 278517 win 65535 (DF)
13:58:26.048023 IP 61.129.59.80.6661 > 192.168.27.100.1140: . ack 13566 win 11680 (DF)
13:58:26.069838 IP 192.168.27.100.1140 > 61.129.59.80.6661: P 13566:13581(15) ack 278517 win 65535 (DF)
13:58:26.135077 IP 61.129.59.80.6661 > 192.168.27.100.1140: . 278517:279977(1460) ack 13581 win 11680 (DF)
13:58:26.136436 IP 192.168.27.100.1140 > 61.129.59.80.6661: P 13581:13596(15) ack 279977 win 65535 (DF)
13:58:26.137090 IP 61.129.59.80.6661 > 192.168.27.100.1140: . 279977:281437(1460) ack 13581 win 11680 (DF)
13:58:26.137313 IP 61.129.59.80.6661 > 192.168.27.100.1140: . 281437:282897(1460) ack 13581 win 11680 (DF)
13:58:26.137850 IP 192.168.27.100.1140 > 61.129.59.80.6661: . ack 282897 win 65535 (DF)
13:58:26.203995 IP 61.129.59.80.6661 > 192.168.27.100.1140: P 285817:287277(1460) ack 13581 win 11680 (DF)
13:58:26.207918 IP 61.129.59.80.6661 > 192.168.27.100.1140: . 282897:284357(1460) ack 13581 win 11680 (DF)
13:58:26.208433 IP 192.168.27.100.1140 > 61.129.59.80.6661: . ack 282897 win 65535 <nop,nop,sack sack 1 {285817:287277} > (DF)
13:58:26.214696 IP 61.129.59.80.6661 > 192.168.27.100.1140: . 284357:285817(1460) ack 13581 win 11680 (DF)
13:58:26.217315 IP 192.168.27.100.1140 > 61.129.59.80.6661: . ack 287277 win 65535 (DF)
13:58:26.295346 IP 61.129.59.80.6661 > 192.168.27.100.1140: . 287277:288737(1460) ack 13581 win 11680 (DF)
13:58:26.478072 IP 192.168.27.100.1140 > 61.129.59.80.6661: P 13581:13896(315) ack 288737 win 65535 (DF)
13:58:26.584892 IP 61.129.59.80.6661 > 192.168.27.100.1140: . 288737:290197(1460) ack 13896 win 11680 (DF)
13:58:26.585069 IP 61.129.59.80.6661 > 192.168.27.100.1140: . 290197:291657(1460) ack 13896 win 11680 (DF)
13:58:26.585198 IP 61.129.59.80.6661 > 192.168.27.100.1140: . 291657:293117(1460) ack 13896 win 11680 (DF)
13:58:26.586411 IP 192.168.27.100.1140 > 61.129.59.80.6661: . ack 291657 win 65535 (DF)
13:58:26.778392 IP 192.168.27.100.1140 > 61.129.59.80.6661: . ack 293117 win 65535 (DF)
13:58:26.875749 IP 192.168.27.100.1140 > 61.129.59.80.6661: P 13896:13911(15) ack 293117 win 65535 (DF)
13:58:27.181533 IP 192.168.27.100.1140 > 61.129.59.80.6661: P 13896:14031(135) ack 293117 win 65535 (DF)
13:58:27.355471 IP 61.129.59.80.6661 > 192.168.27.100.1140: . 293117:294577(1460) ack 14031 win 11680 (DF)
13:58:27.355659 IP 61.129.59.80.6661 > 192.168.27.100.1140: . 294577:296037(1460) ack 14031 win 11680 (DF)
13:58:27.356832 IP 61.129.59.80.6661 > 192.168.27.100.1140: . 296037:297497(1460) ack 14031 win 11680 (DF)
13:58:27.358866 IP 192.168.27.100.1140 > 61.129.59.80.6661: . ack 296037 win 65535 (DF)
13:58:27.358893 IP 192.168.27.100.1140 > 61.129.59.80.6661: . ack 297497 win 65535 (DF)
13:58:27.442524 IP 192.168.27.100.1140 > 61.129.59.80.6661: P 14031:14046(15) ack 297497 win 65535 (DF)
13:58:27.498475 IP 61.129.59.80.6661 > 192.168.27.100.1140: P 297497:298820(1323) ack 14046 win 11680 (DF)
13:58:27.499484 IP 192.168.27.100.1140 > 61.129.59.80.6661: P 14046:14136(90) ack 298820 win 64212 (DF)
13:58:27.576513 IP 61.129.59.80.6661 > 192.168.27.100.1140: P 298820:299523(703) ack 14136 win 11680 (DF)
13:58:27.577556 IP 192.168.27.100.1140 > 61.129.59.80.6661: P 14136:14166(30) ack 299523 win 65535 (DF)
13:58:27.666368 IP 61.129.59.80.6661 > 192.168.27.100.1140: . ack 14166 win 11680 (DF)
13:58:27.684103 IP 61.129.59.80.6661 > 192.168.27.100.1140: P 299523:300076(553) ack 14166 win 11680 (DF)
13:58:27.738141 IP 192.168.27.100.1140 > 61.129.59.80.6661: P 14166:14181(15) ack 300076 win 64982 (DF)
13:58:27.791875 IP 61.129.59.80.6661 > 192.168.27.100.1140: . ack 14181 win 11680 (DF)
13:58:27.792771 IP 192.168.27.100.1140 > 61.129.59.80.6661: P 14181:14226(45) ack 300076 win 64982 (DF)
13:58:27.793242 IP 61.129.59.80.6661 > 192.168.27.100.1140: P 300076:300365(289) ack 14181 win 11680 (DF)
13:58:27.876871 IP 61.129.59.80.6661 > 192.168.27.100.1140: . ack 14226 win 11680 (DF)
13:58:27.980414 IP 192.168.27.100.1140 > 61.129.59.80.6661: . ack 300365 win 64693 (DF)
13:58:28.254650 IP 61.129.59.80.6661 > 192.168.27.100.1140: . 300365:301825(1460) ack 14226 win 11680 (DF)
13:58:28.382102 IP 192.168.27.100.1140 > 61.129.59.80.6661: . ack 301825 win 65535 (DF)
13:58:28.444311 IP 61.129.59.80.6661 > 192.168.27.100.1140: P 301825:302102(277) ack 14226 win 11680 (DF)
13:58:28.593849 IP 192.168.27.100.1140 > 61.129.59.80.6661: . ack 302102 win 65258 (DF)
13:58:28.673333 IP 192.168.27.100.1140 > 61.129.59.80.6661: P 14226:14241(15) ack 302102 win 65258 (DF)
13:58:28.741693 IP 61.129.59.80.6661 > 192.168.27.100.1140: P 302102:303027(925) ack 14241 win 11680 (DF)
13:58:28.881411 IP 192.168.27.100.1140 > 61.129.59.80.6661: . ack 303027 win 64333 (DF)
13:58:28.921526 IP 61.129.59.80.6661 > 192.168.27.100.1140: P 303027:303556(529) ack 14241 win 11680 (DF)
13:58:29.081811 IP 192.168.27.100.1140 > 61.129.59.80.6661: . ack 303556 win 65535 (DF)
13:58:29.460827 IP 61.129.59.80.6661 > 192.168.27.100.1140: . 303556:305016(1460) ack 14241 win 11680 (DF)
13:58:29.582506 IP 192.168.27.100.1140 > 61.129.59.80.6661: . ack 305016 win 65535 (DF)
13:58:29.625298 IP 61.129.59.80.6661 > 192.168.27.100.1140: P 305016:305462(446) ack 14241 win 11680 (DF)
13:58:29.782588 IP 192.168.27.100.1140 > 61.129.59.80.6661: . ack 305462 win 65089 (DF)
13:58:29.818948 IP 61.129.59.80.6661 > 192.168.27.100.1140: P 305462:306226(764) ack 14241 win 11680 (DF)
13:58:29.828604 IP 192.168.27.100.1140 > 61.129.59.80.6661: R 429770225:429770225(0) win 0 (DF)
13:58:30.359298 IP 61.129.59.80.6661 > 192.168.27.100.1140: . 306226:307686(1460) ack 14241 win 11680 (DF)
13:58:30.790726 IP 61.129.59.80.6661 > 192.168.27.100.1140: . 307686:309146(1460) ack 14241 win 11680 (DF)
13:58:31.229693 IP 61.129.59.80.6661 > 192.168.27.100.1140: P 305462:306226(764) ack 14241 win 11680 (DF)
