File STDIN:
15:22:29.925934 IP 61.129.59.81.6661 > 192.168.27.100.1207: P 1025755963:1025756371(408) ack 1721167709 win 6432 (DF)
15:22:30.053205 IP 192.168.27.100.1207 > 61.129.59.81.6661: . ack 408 win 65127 (DF)
15:22:30.724849 IP 61.129.59.81.6661 > 192.168.27.100.1207: P 408:822(414) ack 1 win 6432 (DF)
15:22:30.853334 IP 192.168.27.100.1207 > 61.129.59.81.6661: . ack 822 win 64713 (DF)
15:22:31.085966 IP 192.168.27.100.1207 > 61.129.59.81.6661: P 1:16(15) ack 822 win 64713 (DF)
15:22:31.515940 IP 61.129.59.81.6661 > 192.168.27.100.1207: P 822:1258(436) ack 1 win 6432 (DF)
15:22:31.516877 IP 192.168.27.100.1207 > 61.129.59.81.6661: P 16:31(15) ack 1258 win 64277 (DF)
15:22:31.788065 IP 61.129.59.81.6661 > 192.168.27.100.1207: . ack 16 win 6432 (DF)
15:22:31.790531 IP 192.168.27.100.1207 > 61.129.59.81.6661: P 31:46(15) ack 1258 win 64277 (DF)
15:22:32.147504 IP 61.129.59.81.6661 > 192.168.27.100.1207: P 1258:1543(285) ack 31 win 6432 (DF)
15:22:32.148407 IP 192.168.27.100.1207 > 61.129.59.81.6661: P 46:61(15) ack 1543 win 65535 (DF)
15:22:32.457920 IP 61.129.59.81.6661 > 192.168.27.100.1207: . ack 46 win 6432 (DF)
15:22:32.790602 IP 61.129.59.81.6661 > 192.168.27.100.1207: P 1543:2003(460) ack 61 win 6432 (DF)
15:22:32.793158 IP 192.168.27.100.1207 > 61.129.59.81.6661: P 61:76(15) ack 2003 win 65075 (DF)
15:22:33.492280 IP 61.129.59.81.6661 > 192.168.27.100.1207: P 2003:2356(353) ack 76 win 6432 (DF)
15:22:33.493353 IP 192.168.27.100.1207 > 61.129.59.81.6661: P 76:121(45) ack 2356 win 64722 (DF)
15:22:34.125652 IP 61.129.59.81.6661 > 192.168.27.100.1207: P 2356:2749(393) ack 121 win 6432 (DF)
15:22:34.128528 IP 192.168.27.100.1207 > 61.129.59.81.6661: P 121:136(15) ack 2749 win 64329 (DF)
15:22:34.742935 IP 61.129.59.81.6661 > 192.168.27.100.1207: P 2749:3102(353) ack 136 win 6432 (DF)
15:22:34.744593 IP 192.168.27.100.1207 > 61.129.59.81.6661: P 136:181(45) ack 3102 win 65535 (DF)
15:22:35.366749 IP 61.129.59.81.6661 > 192.168.27.100.1207: P 3102:3387(285) ack 181 win 6432 (DF)
15:22:35.369516 IP 192.168.27.100.1207 > 61.129.59.81.6661: P 181:286(105) ack 3387 win 65250 (DF)
15:22:35.996510 IP 61.129.59.81.6661 > 192.168.27.100.1207: P 3387:3872(485) ack 286 win 6432 (DF)
15:22:35.997661 IP 192.168.27.100.1207 > 61.129.59.81.6661: P 286:361(75) ack 3872 win 64765 (DF)
15:22:36.638807 IP 61.129.59.81.6661 > 192.168.27.100.1207: P 3872:4397(525) ack 361 win 6432 (DF)
15:22:36.641479 IP 192.168.27.100.1207 > 61.129.59.81.6661: P 361:391(30) ack 4397 win 64240 (DF)
15:22:37.296525 IP 61.129.59.81.6661 > 192.168.27.100.1207: P 4397:4946(549) ack 391 win 6432 (DF)
15:22:37.299521 IP 192.168.27.100.1207 > 61.129.59.81.6661: P 391:421(30) ack 4946 win 65535 (DF)
15:22:37.936245 IP 61.129.59.81.6661 > 192.168.27.100.1207: P 4946:5233(287) ack 421 win 6432 (DF)
15:22:37.938854 IP 192.168.27.100.1207 > 61.129.59.81.6661: P 421:511(90) ack 5233 win 65248 (DF)
15:22:38.592138 IP 61.129.59.81.6661 > 192.168.27.100.1207: P 5233:5610(377) ack 511 win 6432 (DF)
15:22:38.593214 IP 192.168.27.100.1207 > 61.129.59.81.6661: P 511:586(75) ack 5610 win 64871 (DF)
15:22:39.242381 IP 61.129.59.81.6661 > 192.168.27.100.1207: P 5610:6197(587) ack 586 win 6432 (DF)
15:22:39.244997 IP 192.168.27.100.1207 > 61.129.59.81.6661: P 586:676(90) ack 6197 win 64284 (DF)
15:22:39.888720 IP 61.129.59.81.6661 > 192.168.27.100.1207: P 6197:6811(614) ack 676 win 6432 (DF)
15:22:39.890236 IP 192.168.27.100.1207 > 61.129.59.81.6661: P 676:721(45) ack 6811 win 65535 (DF)
15:22:40.526044 IP 61.129.59.81.6661 > 192.168.27.100.1207: P 6811:7603(792) ack 721 win 6432 (DF)
15:22:40.528665 IP 192.168.27.100.1207 > 61.129.59.81.6661: P 721:871(150) ack 7603 win 64743 (DF)
15:22:41.181131 IP 61.129.59.81.6661 > 192.168.27.100.1207: P 7603:8267(664) ack 871 win 6432 (DF)
15:22:41.182944 IP 192.168.27.100.1207 > 61.129.59.81.6661: P 871:1036(165) ack 8267 win 64079 (DF)
15:22:41.855832 IP 61.129.59.81.6661 > 192.168.27.100.1207: P 8267:9362(1095) ack 1036 win 6432 (DF)
15:22:41.858839 IP 192.168.27.100.1207 > 61.129.59.81.6661: P 1036:1156(120) ack 9362 win 65535 (DF)
15:22:42.508717 IP 61.129.59.81.6661 > 192.168.27.100.1207: P 9362:10239(877) ack 1156 win 6432 (DF)
15:22:42.510546 IP 192.168.27.100.1207 > 61.129.59.81.6661: P 1156:1201(45) ack 10239 win 64658 (DF)
15:22:43.188236 IP 61.129.59.81.6661 > 192.168.27.100.1207: P 10239:11063(824) ack 1201 win 6432 (DF)
15:22:43.192689 IP 192.168.27.100.1207 > 61.129.59.81.6661: P 1201:1216(15) ack 11063 win 65535 (DF)
15:22:43.857268 IP 61.129.59.81.6661 > 192.168.27.100.1207: P 11063:11700(637) ack 1216 win 6432 (DF)
15:22:43.858384 IP 192.168.27.100.1207 > 61.129.59.81.6661: P 1216:1261(45) ack 11700 win 64898 (DF)
15:22:44.485508 IP 61.129.59.81.6661 > 192.168.27.100.1207: P 11700:12257(557) ack 1261 win 6432 (DF)
15:22:44.488017 IP 192.168.27.100.1207 > 61.129.59.81.6661: P 1261:1291(30) ack 12257 win 64341 (DF)
15:22:45.157933 IP 61.129.59.81.6661 > 192.168.27.100.1207: P 12257:12904(647) ack 1291 win 6432 (DF)
15:22:45.158696 IP 192.168.27.100.1207 > 61.129.59.81.6661: P 1291:1328(37) ack 12904 win 65535 (DF)
15:22:45.828157 IP 61.129.59.81.6661 > 192.168.27.100.1207: P 12904:13780(876) ack 1328 win 6432 (DF)
15:22:45.830945 IP 192.168.27.100.1207 > 61.129.59.81.6661: P 1328:1362(34) ack 13780 win 64659 (DF)
15:22:46.566563 IP 61.129.59.81.6661 > 192.168.27.100.1207: P 13780:14651(871) ack 1362 win 6432 (DF)
15:22:46.569569 IP 192.168.27.100.1207 > 61.129.59.81.6661: P 1362:1467(105) ack 14651 win 65535 (DF)
15:22:47.228098 IP 61.129.59.81.6661 > 192.168.27.100.1207: P 14651:15529(878) ack 1467 win 6432 (DF)
15:22:47.230792 IP 192.168.27.100.1207 > 61.129.59.81.6661: P 1467:1579(112) ack 15529 win 64657 (DF)
15:22:47.892171 IP 61.129.59.81.6661 > 192.168.27.100.1207: P 15529:16413(884) ack 1579 win 6432 (DF)
15:22:47.901915 IP 192.168.27.100.1207 > 61.129.59.81.6661: P 1579:1691(112) ack 16413 win 65535 (DF)
15:22:48.524203 IP 61.129.59.81.6661 > 192.168.27.100.1207: P 16413:17218(805) ack 1691 win 6432 (DF)
15:22:48.526864 IP 192.168.27.100.1207 > 61.129.59.81.6661: P 1691:1766(75) ack 17218 win 64730 (DF)
15:22:49.203281 IP 61.129.59.81.6661 > 192.168.27.100.1207: P 17218:17844(626) ack 1766 win 6432 (DF)
15:22:49.204416 IP 192.168.27.100.1207 > 61.129.59.81.6661: P 1766:1830(64) ack 17844 win 64104 (DF)
15:22:49.827362 IP 61.129.59.81.6661 > 192.168.27.100.1207: P 17844:18402(558) ack 1830 win 6432 (DF)
15:22:49.884265 IP 192.168.27.100.1207 > 61.129.59.81.6661: P 1830:1845(15) ack 18402 win 65535 (DF)
15:22:50.546164 IP 61.129.59.81.6661 > 192.168.27.100.1207: P 18402:19000(598) ack 1845 win 6432 (DF)
15:22:50.547443 IP 192.168.27.100.1207 > 61.129.59.81.6661: P 1845:1860(15) ack 19000 win 64937 (DF)
15:22:51.222976 IP 61.129.59.81.6661 > 192.168.27.100.1207: P 19000:19431(431) ack 1860 win 6432 (DF)
15:22:51.225516 IP 192.168.27.100.1207 > 61.129.59.81.6661: P 1860:1875(15) ack 19431 win 64506 (DF)
15:22:51.868237 IP 61.129.59.81.6661 > 192.168.27.100.1207: P 19431:20259(828) ack 1875 win 6432 (DF)
15:22:51.869342 IP 192.168.27.100.1207 > 61.129.59.81.6661: P 1875:2010(135) ack 20259 win 65535 (DF)
15:22:52.508445 IP 61.129.59.81.6661 > 192.168.27.100.1207: P 20259:20735(476) ack 2010 win 6432 (DF)
15:22:52.511165 IP 192.168.27.100.1207 > 61.129.59.81.6661: P 2010:2130(120) ack 20735 win 65059 (DF)
15:22:53.168687 IP 61.129.59.81.6661 > 192.168.27.100.1207: P 20735:21515(780) ack 2130 win 6432 (DF)
15:22:53.172078 IP 192.168.27.100.1207 > 61.129.59.81.6661: P 2130:2250(120) ack 21515 win 64279 (DF)
15:22:53.829650 IP 61.129.59.81.6661 > 192.168.27.100.1207: P 21515:22380(865) ack 2250 win 6432 (DF)
15:22:53.832507 IP 192.168.27.100.1207 > 61.129.59.81.6661: P 2250:2400(150) ack 22380 win 65535 (DF)
15:22:54.464144 IP 61.129.59.81.6661 > 192.168.27.100.1207: P 22380:23269(889) ack 2400 win 6432 (DF)
15:22:54.465994 IP 192.168.27.100.1207 > 61.129.59.81.6661: P 2400:2490(90) ack 23269 win 64646 (DF)
15:22:55.106952 IP 61.129.59.81.6661 > 192.168.27.100.1207: P 23269:24412(1143) ack 2490 win 6432 (DF)
15:22:55.109876 IP 192.168.27.100.1207 > 61.129.59.81.6661: P 2490:2520(30) ack 24412 win 65535 (DF)
15:22:55.723066 IP 61.129.59.81.6661 > 192.168.27.100.1207: P 24412:25344(932) ack 2520 win 6432 (DF)
15:22:55.724820 IP 192.168.27.100.1207 > 61.129.59.81.6661: P 2520:2550(30) ack 25344 win 64603 (DF)
15:22:56.375267 IP 61.129.59.81.6661 > 192.168.27.100.1207: P 25344:26154(810) ack 2550 win 6432 (DF)
15:22:56.378520 IP 192.168.27.100.1207 > 61.129.59.81.6661: P 2550:2599(49) ack 26154 win 65535 (DF)
15:22:57.053214 IP 61.129.59.81.6661 > 192.168.27.100.1207: P 26154:27265(1111) ack 2599 win 6432 (DF)
15:22:57.106475 IP 192.168.27.100.1207 > 61.129.59.81.6661: P 2599:2618(19) ack 27265 win 64424 (DF)
15:22:57.772693 IP 61.129.59.81.6661 > 192.168.27.100.1207: P 27265:28087(822) ack 2618 win 6432 (DF)
15:22:57.826545 IP 192.168.27.100.1207 > 61.129.59.81.6661: P 2618:2637(19) ack 28087 win 65535 (DF)
15:22:58.522227 IP 61.129.59.81.6661 > 192.168.27.100.1207: P 28087:28950(863) ack 2637 win 6432 (DF)
15:22:58.566728 IP 192.168.27.100.1207 > 61.129.59.81.6661: P 2637:2648(11) ack 28950 win 64672 (DF)
15:22:59.215958 IP 61.129.59.81.6661 > 192.168.27.100.1207: P 28950:29626(676) ack 2648 win 6432 (DF)
15:22:59.219232 IP 192.168.27.100.1207 > 61.129.59.81.6661: P 2648:2667(19) ack 29626 win 65535 (DF)
15:22:59.864066 IP 61.129.59.81.6661 > 192.168.27.100.1207: P 29626:30325(699) ack 2667 win 6432 (DF)
15:22:59.865641 IP 192.168.27.100.1207 > 61.129.59.81.6661: P 2667:2686(19) ack 30325 win 64836 (DF)
15:23:00.565239 IP 61.129.59.81.6661 > 192.168.27.100.1207: P 30325:31016(691) ack 2686 win 6432 (DF)
15:23:00.568116 IP 192.168.27.100.1207 > 61.129.59.81.6661: P 2686:2705(19) ack 31016 win 64145 (DF)
15:23:01.264852 IP 61.129.59.81.6661 > 192.168.27.100.1207: P 31016:31689(673) ack 2705 win 6432 (DF)
15:23:01.265675 IP 192.168.27.100.1207 > 61.129.59.81.6661: P 2705:2742(37) ack 31689 win 65535 (DF)
15:23:01.960346 IP 61.129.59.81.6661 > 192.168.27.100.1207: P 31689:32587(898) ack 2742 win 6432 (DF)
15:23:01.963045 IP 192.168.27.100.1207 > 61.129.59.81.6661: P 2742:2776(34) ack 32587 win 64637 (DF)
15:23:02.653342 IP 61.129.59.81.6661 > 192.168.27.100.1207: P 32587:33295(708) ack 2776 win 6432 (DF)
15:23:02.654479 IP 192.168.27.100.1207 > 61.129.59.81.6661: P 2776:2795(19) ack 33295 win 65535 (DF)
15:23:03.358838 IP 61.129.59.81.6661 > 192.168.27.100.1207: P 33295:34103(808) ack 2795 win 6432 (DF)
15:23:03.361222 IP 192.168.27.100.1207 > 61.129.59.81.6661: P 2795:2814(19) ack 34103 win 64727 (DF)
15:23:04.105756 IP 61.129.59.81.6661 > 192.168.27.100.1207: P 34103:34904(801) ack 2814 win 6432 (DF)
15:23:04.109135 IP 192.168.27.100.1207 > 61.129.59.81.6661: P 2814:2852(38) ack 34904 win 65535 (DF)
15:23:04.830415 IP 61.129.59.81.6661 > 192.168.27.100.1207: P 34904:35766(862) ack 2852 win 6432 (DF)
15:23:04.833045 IP 192.168.27.100.1207 > 61.129.59.81.6661: P 2852:2871(19) ack 35766 win 64673 (DF)
15:23:05.544247 IP 61.129.59.81.6661 > 192.168.27.100.1207: P 35766:36442(676) ack 2871 win 6432 (DF)
15:23:05.671298 IP 192.168.27.100.1207 > 61.129.59.81.6661: P 2871:2890(19) ack 36442 win 65535 (DF)
15:23:06.371366 IP 61.129.59.81.6661 > 192.168.27.100.1207: P 36442:37133(691) ack 2890 win 6432 (DF)
15:23:06.504463 IP 192.168.27.100.1207 > 61.129.59.81.6661: . ack 37133 win 64844 (DF)
15:23:07.191071 IP 61.129.59.81.6661 > 192.168.27.100.1207: P 37133:37886(753) ack 2890 win 6432 (DF)
15:23:07.214984 IP 192.168.27.100.1207 > 61.129.59.81.6661: P 2890:2905(15) ack 37886 win 64091 (DF)
15:23:07.873445 IP 61.129.59.81.6661 > 192.168.27.100.1207: P 37886:38485(599) ack 2905 win 6432 (DF)
15:23:07.877093 IP 192.168.27.100.1207 > 61.129.59.81.6661: P 2905:2962(57) ack 38485 win 65535 (DF)
15:23:08.585449 IP 61.129.59.81.6661 > 192.168.27.100.1207: P 38485:39110(625) ack 2962 win 6432 (DF)
15:23:08.586705 IP 192.168.27.100.1207 > 61.129.59.81.6661: P 2962:3005(43) ack 39110 win 64910 (DF)
15:23:09.319330 IP 61.129.59.81.6661 > 192.168.27.100.1207: P 39110:39895(785) ack 3005 win 6432 (DF)
15:23:09.323104 IP 192.168.27.100.1207 > 61.129.59.81.6661: P 3005:3063(58) ack 39895 win 64125 (DF)
15:23:09.968328 IP 61.129.59.81.6661 > 192.168.27.100.1207: P 39895:40450(555) ack 3063 win 6432 (DF)
15:23:09.969874 IP 192.168.27.100.1207 > 61.129.59.81.6661: P 3063:3078(15) ack 40450 win 65535 (DF)
15:23:10.703272 IP 61.129.59.81.6661 > 192.168.27.100.1207: P 40450:41138(688) ack 3078 win 6432 (DF)
15:23:10.705888 IP 192.168.27.100.1207 > 61.129.59.81.6661: P 3078:3123(45) ack 41138 win 64847 (DF)
15:23:11.388290 IP 61.129.59.81.6661 > 192.168.27.100.1207: P 41138:41839(701) ack 3123 win 6432 (DF)
15:23:11.390040 IP 192.168.27.100.1207 > 61.129.59.81.6661: P 3123:3228(105) ack 41839 win 64146 (DF)
15:23:12.095898 IP 61.129.59.81.6661 > 192.168.27.100.1207: P 41839:42509(670) ack 3228 win 6432 (DF)
15:23:12.099983 IP 192.168.27.100.1207 > 61.129.59.81.6661: P 3228:3318(90) ack 42509 win 65535 (DF)
15:23:12.769506 IP 61.129.59.81.6661 > 192.168.27.100.1207: P 42509:43202(693) ack 3318 win 6432 (DF)
15:23:12.770705 IP 192.168.27.100.1207 > 61.129.59.81.6661: P 3318:3498(180) ack 43202 win 64842 (DF)
15:23:13.461065 IP 61.129.59.81.6661 > 192.168.27.100.1207: P 43202:43940(738) ack 3498 win 6432 (DF)
15:23:13.463943 IP 192.168.27.100.1207 > 61.129.59.81.6661: P 3498:3573(75) ack 43940 win 64104 (DF)
15:23:14.116697 IP 61.129.59.81.6661 > 192.168.27.100.1207: P 43940:44798(858) ack 3573 win 6432 (DF)
15:23:14.121595 IP 192.168.27.100.1207 > 61.129.59.81.6661: P 3573:3693(120) ack 44798 win 65535 (DF)
15:23:14.775652 IP 61.129.59.81.6661 > 192.168.27.100.1207: P 44798:45566(768) ack 3693 win 6432 (DF)
15:23:14.778456 IP 192.168.27.100.1207 > 61.129.59.81.6661: P 3693:3843(150) ack 45566 win 64767 (DF)
15:23:15.424256 IP 61.129.59.81.6661 > 192.168.27.100.1207: P 45566:46402(836) ack 3843 win 6432 (DF)
15:23:15.425421 IP 192.168.27.100.1207 > 61.129.59.81.6661: P 3843:4023(180) ack 46402 win 65535 (DF)
15:23:16.134862 IP 61.129.59.81.6661 > 192.168.27.100.1207: P 46402:47332(930) ack 4023 win 6432 (DF)
15:23:16.137774 IP 192.168.27.100.1207 > 61.129.59.81.6661: P 4023:4109(86) ack 47332 win 64605 (DF)
15:23:16.803415 IP 61.129.59.81.6661 > 192.168.27.100.1207: P 47332:48513(1181) ack 4109 win 6432 (DF)
15:23:16.804580 IP 192.168.27.100.1207 > 61.129.59.81.6661: P 4109:4139(30) ack 48513 win 65535 (DF)
15:23:17.502382 IP 61.129.59.81.6661 > 192.168.27.100.1207: P 48513:49807(1294) ack 4139 win 6432 (DF)
15:23:17.504676 IP 192.168.27.100.1207 > 61.129.59.81.6661: P 4139:4169(30) ack 49807 win 64241 (DF)
15:23:18.230528 IP 61.129.59.81.6661 > 192.168.27.100.1207: P 49807:50886(1079) ack 4169 win 6432 (DF)
15:23:18.232620 IP 192.168.27.100.1207 > 61.129.59.81.6661: P 4169:4316(147) ack 50886 win 65535 (DF)
15:23:18.964319 IP 61.129.59.81.6661 > 192.168.27.100.1207: P 50886:51842(956) ack 4316 win 6432 (DF)
15:23:18.967039 IP 192.168.27.100.1207 > 61.129.59.81.6661: P 4316:4361(45) ack 51842 win 64579 (DF)
15:23:19.684586 IP 61.129.59.81.6661 > 192.168.27.100.1207: P 51842:52695(853) ack 4361 win 6432 (DF)
15:23:19.685423 IP 192.168.27.100.1207 > 61.129.59.81.6661: P 4361:4391(30) ack 52695 win 65535 (DF)
15:23:20.373030 IP 61.129.59.81.6661 > 192.168.27.100.1207: P 52695:53359(664) ack 4391 win 6432 (DF)
15:23:20.375343 IP 192.168.27.100.1207 > 61.129.59.81.6661: P 4391:4436(45) ack 53359 win 64871 (DF)
15:23:21.087541 IP 61.129.59.81.6661 > 192.168.27.100.1207: P 53359:53918(559) ack 4436 win 6432 (DF)
15:23:21.088482 IP 192.168.27.100.1207 > 61.129.59.81.6661: P 4436:4485(49) ack 53918 win 64312 (DF)
15:23:21.805582 IP 61.129.59.81.6661 > 192.168.27.100.1207: P 53918:54436(518) ack 4485 win 6432 (DF)
15:23:21.808224 IP 192.168.27.100.1207 > 61.129.59.81.6661: P 4485:4515(30) ack 54436 win 65535 (DF)
15:23:22.561402 IP 61.129.59.81.6661 > 192.168.27.100.1207: P 54436:55174(738) ack 4515 win 6432 (DF)
15:23:22.562542 IP 192.168.27.100.1207 > 61.129.59.81.6661: P 4515:4564(49) ack 55174 win 64797 (DF)
15:23:23.288235 IP 61.129.59.81.6661 > 192.168.27.100.1207: P 55174:55626(452) ack 4564 win 6432 (DF)
15:23:23.291449 IP 192.168.27.100.1207 > 61.129.59.81.6661: P 4564:4609(45) ack 55626 win 64345 (DF)
15:23:24.019566 IP 61.129.59.81.6661 > 192.168.27.100.1207: P 55626:56213(587) ack 4609 win 6432 (DF)
15:23:24.020588 IP 192.168.27.100.1207 > 61.129.59.81.6661: P 4609:4658(49) ack 56213 win 65535 (DF)
15:23:24.750004 IP 61.129.59.81.6661 > 192.168.27.100.1207: P 56213:56753(540) ack 4658 win 6432 (DF)
15:23:24.753098 IP 192.168.27.100.1207 > 61.129.59.81.6661: P 4658:4688(30) ack 56753 win 64995 (DF)
15:23:25.459951 IP 61.129.59.81.6661 > 192.168.27.100.1207: P 56753:57152(399) ack 4688 win 6432 (DF)
15:23:25.461603 IP 192.168.27.100.1207 > 61.129.59.81.6661: P 4688:4718(30) ack 57152 win 64596 (DF)
15:23:26.142510 IP 61.129.59.81.6661 > 192.168.27.100.1207: P 57152:57597(445) ack 4718 win 6432 (DF)
15:23:26.145676 IP 192.168.27.100.1207 > 61.129.59.81.6661: P 4718:4748(30) ack 57597 win 64151 (DF)
15:23:26.864996 IP 61.129.59.81.6661 > 192.168.27.100.1207: P 57597:57948(351) ack 4748 win 6432 (DF)
15:23:26.866020 IP 192.168.27.100.1207 > 61.129.59.81.6661: P 4748:4838(90) ack 57948 win 65535 (DF)
15:23:27.837860 IP 192.168.27.100.1207 > 61.129.59.81.6661: P 4748:4898(150) ack 57948 win 65535 (DF)
15:23:28.487626 IP 61.129.59.81.6661 > 192.168.27.100.1207: P 57948:58277(329) ack 4838 win 6432 (DF)
15:23:28.490357 IP 192.168.27.100.1207 > 61.129.59.81.6661: P 4898:4913(15) ack 58277 win 65206 (DF)
15:23:28.521144 IP 61.129.59.81.6661 > 192.168.27.100.1207: . ack 4898 win 6432 <nop,nop,sack sack 1 {4748:4838} > (DF)
15:23:28.522168 IP 192.168.27.100.1207 > 61.129.59.81.6661: P 4913:4928(15) ack 58277 win 65206 (DF)
15:23:29.186533 IP 61.129.59.81.6661 > 192.168.27.100.1207: P 58277:59257(980) ack 4913 win 6432 (DF)
15:23:29.189431 IP 192.168.27.100.1207 > 61.129.59.81.6661: P 4928:4958(30) ack 59257 win 64226 (DF)
15:23:29.264217 IP 61.129.59.81.6661 > 192.168.27.100.1207: . ack 4928 win 6432 (DF)
15:23:29.872153 IP 61.129.59.81.6661 > 192.168.27.100.1207: P 59257:59651(394) ack 4958 win 6432 (DF)
15:23:29.873261 IP 192.168.27.100.1207 > 61.129.59.81.6661: P 4958:4988(30) ack 59651 win 65535 (DF)
15:23:30.572677 IP 61.129.59.81.6661 > 192.168.27.100.1207: P 59651:60104(453) ack 4988 win 6432 (DF)
15:23:30.576286 IP 192.168.27.100.1207 > 61.129.59.81.6661: P 4988:5033(45) ack 60104 win 65082 (DF)
15:23:31.312285 IP 61.129.59.81.6661 > 192.168.27.100.1207: P 60104:60549(445) ack 5033 win 6432 (DF)
15:23:31.313058 IP 192.168.27.100.1207 > 61.129.59.81.6661: P 5033:5153(120) ack 60549 win 64637 (DF)
15:23:32.019829 IP 61.129.59.81.6661 > 192.168.27.100.1207: P 60549:60961(412) ack 5153 win 6432 (DF)
15:23:32.022845 IP 192.168.27.100.1207 > 61.129.59.81.6661: P 5153:5273(120) ack 60961 win 64225 (DF)
15:23:32.742301 IP 61.129.59.81.6661 > 192.168.27.100.1207: P 60961:61636(675) ack 5273 win 6432 (DF)
15:23:32.743502 IP 192.168.27.100.1207 > 61.129.59.81.6661: P 5273:5318(45) ack 61636 win 65535 (DF)
15:23:33.538460 IP 61.129.59.81.6661 > 192.168.27.100.1207: P 61636:62258(622) ack 5318 win 6432 (DF)
15:23:33.541028 IP 192.168.27.100.1207 > 61.129.59.81.6661: P 5318:5438(120) ack 62258 win 64913 (DF)
15:23:34.276319 IP 61.129.59.81.6661 > 192.168.27.100.1207: P 62258:62684(426) ack 5438 win 6432 (DF)
15:23:34.277142 IP 192.168.27.100.1207 > 61.129.59.81.6661: P 5438:5603(165) ack 62684 win 64487 (DF)
15:23:34.996025 IP 61.129.59.81.6661 > 192.168.27.100.1207: P 62684:63393(709) ack 5603 win 6432 (DF)
15:23:34.998535 IP 192.168.27.100.1207 > 61.129.59.81.6661: P 5603:5708(105) ack 63393 win 65535 (DF)
15:23:35.732435 IP 61.129.59.81.6661 > 192.168.27.100.1207: P 63393:64266(873) ack 5708 win 6432 (DF)
15:23:35.735777 IP 192.168.27.100.1207 > 61.129.59.81.6661: P 5708:5768(60) ack 64266 win 64662 (DF)
15:23:36.423934 IP 61.129.59.81.6661 > 192.168.27.100.1207: P 64266:64953(687) ack 5768 win 6432 (DF)
15:23:36.427353 IP 192.168.27.100.1207 > 61.129.59.81.6661: P 5768:5783(15) ack 64953 win 65535 (DF)
15:23:37.141790 IP 61.129.59.81.6661 > 192.168.27.100.1207: P 64953:65585(632) ack 5783 win 6432 (DF)
15:23:37.142876 IP 192.168.27.100.1207 > 61.129.59.81.6661: P 5783:5843(60) ack 65585 win 64903 (DF)
15:23:37.859745 IP 61.129.59.81.6661 > 192.168.27.100.1207: P 65585:66107(522) ack 5843 win 6432 (DF)
15:23:37.862489 IP 192.168.27.100.1207 > 61.129.59.81.6661: P 5843:5948(105) ack 66107 win 64381 (DF)
15:23:38.559220 IP 61.129.59.81.6661 > 192.168.27.100.1207: P 66107:66589(482) ack 5948 win 6432 (DF)
15:23:38.561039 IP 192.168.27.100.1207 > 61.129.59.81.6661: P 5948:6083(135) ack 66589 win 65535 (DF)
15:23:39.257080 IP 61.129.59.81.6661 > 192.168.27.100.1207: P 66589:67211(622) ack 6083 win 6432 (DF)
15:23:39.260367 IP 192.168.27.100.1207 > 61.129.59.81.6661: P 6083:6158(75) ack 67211 win 64913 (DF)
15:23:40.006859 IP 61.129.59.81.6661 > 192.168.27.100.1207: P 67211:68064(853) ack 6158 win 6432 (DF)
15:23:40.007944 IP 192.168.27.100.1207 > 61.129.59.81.6661: P 6158:6203(45) ack 68064 win 65535 (DF)
15:23:40.718981 IP 61.129.59.81.6661 > 192.168.27.100.1207: P 68064:68706(642) ack 6203 win 6432 (DF)
15:23:40.721611 IP 192.168.27.100.1207 > 61.129.59.81.6661: P 6203:6233(30) ack 68706 win 64893 (DF)
15:23:41.501267 IP 61.129.59.81.6661 > 192.168.27.100.1207: P 68706:69421(715) ack 6233 win 6432 (DF)
15:23:41.502325 IP 192.168.27.100.1207 > 61.129.59.81.6661: P 6233:6278(45) ack 69421 win 64178 (DF)
15:23:42.348018 IP 61.129.59.81.6661 > 192.168.27.100.1207: P 69421:70249(828) ack 6278 win 6432 (DF)
15:23:42.350903 IP 192.168.27.100.1207 > 61.129.59.81.6661: P 6278:6368(90) ack 70249 win 65535 (DF)
15:23:43.231951 IP 61.129.59.81.6661 > 192.168.27.100.1207: P 70249:71132(883) ack 6368 win 6432 (DF)
15:23:43.233150 IP 192.168.27.100.1207 > 61.129.59.81.6661: P 6368:6462(94) ack 71132 win 64652 (DF)
15:23:43.965142 IP 61.129.59.81.6661 > 192.168.27.100.1207: P 71132:71980(848) ack 6462 win 6432 (DF)
15:23:43.968129 IP 192.168.27.100.1207 > 61.129.59.81.6661: P 6462:6597(135) ack 71980 win 65535 (DF)
15:23:44.723866 IP 61.129.59.81.6661 > 192.168.27.100.1207: P 71980:72745(765) ack 6597 win 6432 (DF)
15:23:44.778728 IP 192.168.27.100.1207 > 61.129.59.81.6661: P 6597:6612(15) ack 72745 win 64770 (DF)
15:23:45.511656 IP 61.129.59.81.6661 > 192.168.27.100.1207: P 72745:73794(1049) ack 6612 win 6432 (DF)
15:23:45.514401 IP 192.168.27.100.1207 > 61.129.59.81.6661: P 6612:6642(30) ack 73794 win 65535 (DF)
15:23:46.254671 IP 61.129.59.81.6661 > 192.168.27.100.1207: P 73794:74452(658) ack 6642 win 6432 (DF)
15:23:46.255723 IP 192.168.27.100.1207 > 61.129.59.81.6661: P 6642:6691(49) ack 74452 win 64877 (DF)
15:23:47.026205 IP 61.129.59.81.6661 > 192.168.27.100.1207: P 74452:75187(735) ack 6691 win 6432 (DF)
15:23:47.028803 IP 192.168.27.100.1207 > 61.129.59.81.6661: P 6691:6710(19) ack 75187 win 64142 (DF)
15:23:47.757578 IP 61.129.59.81.6661 > 192.168.27.100.1207: P 75187:75924(737) ack 6710 win 6432 (DF)
15:23:47.758813 IP 192.168.27.100.1207 > 61.129.59.81.6661: P 6710:6729(19) ack 75924 win 65535 (DF)
15:23:48.535113 IP 61.129.59.81.6661 > 192.168.27.100.1207: P 75924:76583(659) ack 6729 win 6432 (DF)
15:23:48.537703 IP 192.168.27.100.1207 > 61.129.59.81.6661: P 6729:6744(15) ack 76583 win 64876 (DF)
15:23:49.258162 IP 61.129.59.81.6661 > 192.168.27.100.1207: P 76583:77177(594) ack 6744 win 6432 (DF)
15:23:49.259206 IP 192.168.27.100.1207 > 61.129.59.81.6661: P 6744:6774(30) ack 77177 win 64282 (DF)
15:23:49.985083 IP 61.129.59.81.6661 > 192.168.27.100.1207: P 77177:77848(671) ack 6774 win 6432 (DF)
15:23:49.987538 IP 192.168.27.100.1207 > 61.129.59.81.6661: P 6774:6793(19) ack 77848 win 65535 (DF)
15:23:50.708227 IP 61.129.59.81.6661 > 192.168.27.100.1207: P 77848:78421(573) ack 6793 win 6432 (DF)
15:23:50.709100 IP 192.168.27.100.1207 > 61.129.59.81.6661: P 6793:6812(19) ack 78421 win 64962 (DF)
15:23:51.474646 IP 61.129.59.81.6661 > 192.168.27.100.1207: P 78421:78999(578) ack 6812 win 6432 (DF)
15:23:51.478675 IP 192.168.27.100.1207 > 61.129.59.81.6661: P 6812:6831(19) ack 78999 win 64384 (DF)
15:23:52.234997 IP 61.129.59.81.6661 > 192.168.27.100.1207: P 78999:79618(619) ack 6831 win 6432 (DF)
15:23:52.236036 IP 192.168.27.100.1207 > 61.129.59.81.6661: P 6831:6846(15) ack 79618 win 65535 (DF)
15:23:52.978903 IP 61.129.59.81.6661 > 192.168.27.100.1207: P 79618:80190(572) ack 6846 win 6432 (DF)
15:23:52.985780 IP 192.168.27.100.1207 > 61.129.59.81.6661: P 6846:6925(79) ack 80190 win 64963 (DF)
15:23:53.745582 IP 61.129.59.81.6661 > 192.168.27.100.1207: P 80190:80805(615) ack 6925 win 6432 (DF)
15:23:53.746658 IP 192.168.27.100.1207 > 61.129.59.81.6661: P 6925:6963(38) ack 80805 win 64348 (DF)
15:23:54.455108 IP 61.129.59.81.6661 > 192.168.27.100.1207: P 80805:81245(440) ack 6963 win 6432 (DF)
15:23:54.457573 IP 192.168.27.100.1207 > 61.129.59.81.6661: P 6963:6982(19) ack 81245 win 65535 (DF)
15:23:55.181817 IP 61.129.59.81.6661 > 192.168.27.100.1207: P 81245:81869(624) ack 6982 win 6432 (DF)
15:23:55.182843 IP 192.168.27.100.1207 > 61.129.59.81.6661: P 6982:7016(34) ack 81869 win 64911 (DF)
15:23:55.898702 IP 61.129.59.81.6661 > 192.168.27.100.1207: P 81869:82379(510) ack 7016 win 6432 (DF)
15:23:55.901863 IP 192.168.27.100.1207 > 61.129.59.81.6661: P 7016:7054(38) ack 82379 win 64401 (DF)
15:23:56.626335 IP 61.129.59.81.6661 > 192.168.27.100.1207: P 82379:83105(726) ack 7054 win 6432 (DF)
15:23:56.711808 IP 192.168.27.100.1207 > 61.129.59.81.6661: P 7054:7069(15) ack 83105 win 65535 (DF)
15:23:57.421807 IP 61.129.59.81.6661 > 192.168.27.100.1207: P 83105:83664(559) ack 7069 win 6432 (DF)
15:23:57.424166 IP 192.168.27.100.1207 > 61.129.59.81.6661: P 7069:7099(30) ack 83664 win 64976 (DF)
15:23:58.141205 IP 61.129.59.81.6661 > 192.168.27.100.1207: P 83664:84162(498) ack 7099 win 6432 (DF)
15:23:58.142351 IP 192.168.27.100.1207 > 61.129.59.81.6661: P 7099:7129(30) ack 84162 win 64478 (DF)
15:23:58.873159 IP 61.129.59.81.6661 > 192.168.27.100.1207: P 84162:84910(748) ack 7129 win 6432 (DF)
15:23:58.875361 IP 192.168.27.100.1207 > 61.129.59.81.6661: P 7129:7144(15) ack 84910 win 65535 (DF)
15:23:59.592436 IP 61.129.59.81.6661 > 192.168.27.100.1207: P 84910:85518(608) ack 7144 win 6432 (DF)
15:23:59.593966 IP 192.168.27.100.1207 > 61.129.59.81.6661: P 7144:7230(86) ack 85518 win 64927 (DF)
15:24:00.321331 IP 61.129.59.81.6661 > 192.168.27.100.1207: P 85518:86234(716) ack 7230 win 6432 (DF)
15:24:00.323908 IP 192.168.27.100.1207 > 61.129.59.81.6661: P 7230:7275(45) ack 86234 win 64211 (DF)
15:24:01.075128 IP 61.129.59.81.6661 > 192.168.27.100.1207: P 86234:87218(984) ack 7275 win 6432 (DF)
15:24:01.076157 IP 192.168.27.100.1207 > 61.129.59.81.6661: P 7275:7335(60) ack 87218 win 65535 (DF)
15:24:01.828965 IP 61.129.59.81.6661 > 192.168.27.100.1207: P 87218:88066(848) ack 7335 win 6432 (DF)
15:24:01.831837 IP 192.168.27.100.1207 > 61.129.59.81.6661: P 7335:7530(195) ack 88066 win 64687 (DF)
15:24:02.637021 IP 61.129.59.81.6661 > 192.168.27.100.1207: P 88066:89077(1011) ack 7530 win 6432 (DF)
15:24:02.639442 IP 192.168.27.100.1207 > 61.129.59.81.6661: P 7530:7728(198) ack 89077 win 65535 (DF)
15:24:03.436974 IP 61.129.59.81.6661 > 192.168.27.100.1207: P 89077:90358(1281) ack 7728 win 6432 (DF)
15:24:03.440698 IP 192.168.27.100.1207 > 61.129.59.81.6661: P 7728:7897(169) ack 90358 win 64254 (DF)
15:24:04.225607 IP 61.129.59.81.6661 > 192.168.27.100.1207: P 90358:91742(1384) ack 7897 win 6432 (DF)
15:24:04.227473 IP 192.168.27.100.1207 > 61.129.59.81.6661: P 7897:8081(184) ack 91742 win 65535 (DF)
15:24:05.142950 IP 61.129.59.81.6661 > 192.168.27.100.1207: P 91742:92736(994) ack 8081 win 6432 (DF)
15:24:05.151450 IP 192.168.27.100.1207 > 61.129.59.81.6661: P 8081:8175(94) ack 92736 win 64541 (DF)
15:24:05.940271 IP 61.129.59.81.6661 > 192.168.27.100.1207: P 92736:93691(955) ack 8175 win 6432 (DF)
15:24:05.941956 IP 192.168.27.100.1207 > 61.129.59.81.6661: P 8175:8209(34) ack 93691 win 65535 (DF)
15:24:06.703195 IP 61.129.59.81.6661 > 192.168.27.100.1207: P 93691:94348(657) ack 8209 win 6432 (DF)
15:24:06.706332 IP 192.168.27.100.1207 > 61.129.59.81.6661: P 8209:8228(19) ack 94348 win 64878 (DF)
15:24:07.466536 IP 61.129.59.81.6661 > 192.168.27.100.1207: P 94348:94897(549) ack 8228 win 6432 (DF)
15:24:07.467237 IP 192.168.27.100.1207 > 61.129.59.81.6661: P 8228:8262(34) ack 94897 win 64329 (DF)
15:24:08.205249 IP 61.129.59.81.6661 > 192.168.27.100.1207: P 94897:95484(587) ack 8262 win 6432 (DF)
15:24:08.207871 IP 192.168.27.100.1207 > 61.129.59.81.6661: P 8262:8296(34) ack 95484 win 65535 (DF)
15:24:08.993929 IP 61.129.59.81.6661 > 192.168.27.100.1207: P 95484:96085(601) ack 8296 win 6432 (DF)
15:24:08.994990 IP 192.168.27.100.1207 > 61.129.59.81.6661: P 8296:8330(34) ack 96085 win 64934 (DF)
15:24:09.728941 IP 61.129.59.81.6661 > 192.168.27.100.1207: P 96085:96660(575) ack 8330 win 6432 (DF)
15:24:09.732319 IP 192.168.27.100.1207 > 61.129.59.81.6661: P 8330:8368(38) ack 96660 win 64359 (DF)
15:24:10.454165 IP 61.129.59.81.6661 > 192.168.27.100.1207: P 96660:97253(593) ack 8368 win 6432 (DF)
15:24:10.457879 IP 192.168.27.100.1207 > 61.129.59.81.6661: P 8368:8398(30) ack 97253 win 65535 (DF)
15:24:11.213586 IP 61.129.59.81.6661 > 192.168.27.100.1207: P 97253:97879(626) ack 8398 win 6432 (DF)
15:24:11.217159 IP 192.168.27.100.1207 > 61.129.59.81.6661: P 8398:8447(49) ack 97879 win 64909 (DF)
15:24:11.955446 IP 61.129.59.81.6661 > 192.168.27.100.1207: P 97879:98480(601) ack 8447 win 6432 (DF)
15:24:12.108904 IP 192.168.27.100.1207 > 61.129.59.81.6661: . ack 98480 win 64308 (DF)
15:24:12.912891 IP 61.129.59.81.6661 > 192.168.27.100.1207: P 98480:99268(788) ack 8447 win 6432 (DF)
15:24:12.924241 IP 192.168.27.100.1207 > 61.129.59.81.6661: P 8447:8462(15) ack 99268 win 65535 (DF)
15:24:13.834721 IP 61.129.59.81.6661 > 192.168.27.100.1207: P 99268:100144(876) ack 8462 win 6432 (DF)
15:24:13.836626 IP 192.168.27.100.1207 > 61.129.59.81.6661: P 8462:8481(19) ack 100144 win 64659 (DF)
15:24:14.672905 IP 61.129.59.81.6661 > 192.168.27.100.1207: P 100144:100862(718) ack 8481 win 6432 (DF)
15:24:14.676677 IP 192.168.27.100.1207 > 61.129.59.81.6661: P 8481:8537(56) ack 100862 win 65535 (DF)
15:24:15.505813 IP 61.129.59.81.6661 > 192.168.27.100.1207: P 100862:101583(721) ack 8537 win 6432 (DF)
15:24:15.507403 IP 192.168.27.100.1207 > 61.129.59.81.6661: P 8537:8571(34) ack 101583 win 64814 (DF)
15:24:16.331191 IP 61.129.59.81.6661 > 192.168.27.100.1207: P 101583:102402(819) ack 8571 win 6432 (DF)
15:24:16.333739 IP 192.168.27.100.1207 > 61.129.59.81.6661: P 8571:8615(44) ack 102402 win 65535 (DF)
15:24:17.219693 IP 61.129.59.81.6661 > 192.168.27.100.1207: P 102402:103165(763) ack 8615 win 6432 (DF)
15:24:17.222690 IP 192.168.27.100.1207 > 61.129.59.81.6661: P 8615:8659(44) ack 103165 win 64772 (DF)
15:24:18.072249 IP 61.129.59.81.6661 > 192.168.27.100.1207: P 103165:104031(866) ack 8659 win 6432 (DF)
15:24:18.073407 IP 192.168.27.100.1207 > 61.129.59.81.6661: P 8659:8722(63) ack 104031 win 65535 (DF)
15:24:18.857323 IP 61.129.59.81.6661 > 192.168.27.100.1207: P 104031:104816(785) ack 8722 win 6432 (DF)
15:24:18.860000 IP 192.168.27.100.1207 > 61.129.59.81.6661: P 8722:8741(19) ack 104816 win 64750 (DF)
15:24:19.621335 IP 61.129.59.81.6661 > 192.168.27.100.1207: P 104816:105599(783) ack 8741 win 6432 (DF)
15:24:19.623605 IP 192.168.27.100.1207 > 61.129.59.81.6661: P 8741:8775(34) ack 105599 win 65535 (DF)
15:24:20.475534 IP 61.129.59.81.6661 > 192.168.27.100.1207: P 105599:106345(746) ack 8775 win 6432 (DF)
15:24:20.478405 IP 192.168.27.100.1207 > 61.129.59.81.6661: P 8775:8809(34) ack 106345 win 64789 (DF)
15:24:21.163472 IP 61.129.59.81.6661 > 192.168.27.100.1207: P 106345:107082(737) ack 8809 win 6432 (DF)
15:24:21.164547 IP 192.168.27.100.1207 > 61.129.59.81.6661: P 8809:8828(19) ack 107082 win 65535 (DF)
15:24:21.926317 IP 61.129.59.81.6661 > 192.168.27.100.1207: P 107082:107756(674) ack 8828 win 6432 (DF)
15:24:21.928925 IP 192.168.27.100.1207 > 61.129.59.81.6661: P 8828:8866(38) ack 107756 win 64861 (DF)
15:24:22.693933 IP 61.129.59.81.6661 > 192.168.27.100.1207: P 107756:108519(763) ack 8866 win 6432 (DF)
15:24:22.695022 IP 192.168.27.100.1207 > 61.129.59.81.6661: P 8866:8885(19) ack 108519 win 64098 (DF)
15:24:23.442276 IP 61.129.59.81.6661 > 192.168.27.100.1207: P 108519:109333(814) ack 8885 win 6432 (DF)
15:24:23.445045 IP 192.168.27.100.1207 > 61.129.59.81.6661: P 8885:8923(38) ack 109333 win 65535 (DF)
15:24:24.255086 IP 61.129.59.81.6661 > 192.168.27.100.1207: P 109333:110078(745) ack 8923 win 6432 (DF)
15:24:24.258343 IP 192.168.27.100.1207 > 61.129.59.81.6661: P 8923:8957(34) ack 110078 win 64790 (DF)
15:24:24.985016 IP 61.129.59.81.6661 > 192.168.27.100.1207: P 110078:110840(762) ack 8957 win 6432 (DF)
15:24:24.987857 IP 192.168.27.100.1207 > 61.129.59.81.6661: P 8957:8972(15) ack 110840 win 65535 (DF)
15:24:25.869230 IP 61.129.59.81.6661 > 192.168.27.100.1207: P 110840:111736(896) ack 8972 win 6432 (DF)
15:24:25.870690 IP 192.168.27.100.1207 > 61.129.59.81.6661: P 8972:9025(53) ack 111736 win 64639 (DF)
15:24:26.627730 IP 61.129.59.81.6661 > 192.168.27.100.1207: P 111736:112482(746) ack 9025 win 6432 (DF)
15:24:26.630490 IP 192.168.27.100.1207 > 61.129.59.81.6661: P 9025:9055(30) ack 112482 win 65535 (DF)
15:24:27.342849 IP 61.129.59.81.6661 > 192.168.27.100.1207: P 112482:113195(713) ack 9055 win 6432 (DF)
15:24:27.343935 IP 192.168.27.100.1207 > 61.129.59.81.6661: P 9055:9084(29) ack 113195 win 64822 (DF)
15:24:28.041824 IP 61.129.59.81.6661 > 192.168.27.100.1207: P 113195:113785(590) ack 9084 win 6432 (DF)
15:24:28.044903 IP 192.168.27.100.1207 > 61.129.59.81.6661: P 9084:9128(44) ack 113785 win 64232 (DF)
15:24:28.755854 IP 61.129.59.81.6661 > 192.168.27.100.1207: P 113785:114452(667) ack 9128 win 6432 (DF)
15:24:28.757041 IP 192.168.27.100.1207 > 61.129.59.81.6661: P 9128:9187(59) ack 114452 win 65535 (DF)
15:24:29.513293 IP 61.129.59.81.6661 > 192.168.27.100.1207: P 114452:115141(689) ack 9187 win 6432 (DF)
15:24:29.516412 IP 192.168.27.100.1207 > 61.129.59.81.6661: P 9187:9221(34) ack 115141 win 64846 (DF)
15:24:30.271724 IP 61.129.59.81.6661 > 192.168.27.100.1207: P 115141:115942(801) ack 9221 win 6432 (DF)
15:24:30.344349 IP 192.168.27.100.1207 > 61.129.59.81.6661: P 9221:9236(15) ack 115942 win 65535 (DF)
15:24:31.099200 IP 61.129.59.81.6661 > 192.168.27.100.1207: P 115942:116851(909) ack 9236 win 6432 (DF)
15:24:31.101799 IP 192.168.27.100.1207 > 61.129.59.81.6661: P 9236:9270(34) ack 116851 win 64626 (DF)
15:24:31.869084 IP 61.129.59.81.6661 > 192.168.27.100.1207: P 116851:117582(731) ack 9270 win 6432 (DF)
15:24:31.870830 IP 192.168.27.100.1207 > 61.129.59.81.6661: P 9270:9318(48) ack 117582 win 65535 (DF)
15:24:32.563094 IP 61.129.59.81.6661 > 192.168.27.100.1207: P 117582:118172(590) ack 9318 win 6432 (DF)
15:24:32.565223 IP 192.168.27.100.1207 > 61.129.59.81.6661: P 9318:9348(30) ack 118172 win 64945 (DF)
15:24:33.341406 IP 61.129.59.81.6661 > 192.168.27.100.1207: P 118172:118896(724) ack 9348 win 6432 (DF)
15:24:33.342192 IP 192.168.27.100.1207 > 61.129.59.81.6661: P 9348:9386(38) ack 118896 win 64221 (DF)
15:24:34.041523 IP 61.129.59.81.6661 > 192.168.27.100.1207: P 118896:119419(523) ack 9386 win 6432 (DF)
15:24:34.044161 IP 192.168.27.100.1207 > 61.129.59.81.6661: P 9386:9423(37) ack 119419 win 65535 (DF)
15:24:34.756594 IP 61.129.59.81.6661 > 192.168.27.100.1207: P 119419:119950(531) ack 9423 win 6432 (DF)
15:24:34.758443 IP 192.168.27.100.1207 > 61.129.59.81.6661: P 9423:9442(19) ack 119950 win 65004 (DF)
15:24:35.491981 IP 61.129.59.81.6661 > 192.168.27.100.1207: P 119950:120498(548) ack 9442 win 6432 (DF)
15:24:35.494647 IP 192.168.27.100.1207 > 61.129.59.81.6661: P 9442:9461(19) ack 120498 win 64456 (DF)
15:24:36.173488 IP 61.129.59.81.6661 > 192.168.27.100.1207: P 120498:120927(429) ack 9461 win 6432 (DF)
15:24:36.174594 IP 192.168.27.100.1207 > 61.129.59.81.6661: P 9461:9480(19) ack 120927 win 65535 (DF)
15:24:36.877773 IP 61.129.59.81.6661 > 192.168.27.100.1207: P 120927:121369(442) ack 9480 win 6432 (DF)
15:24:36.880872 IP 192.168.27.100.1207 > 61.129.59.81.6661: P 9480:9499(19) ack 121369 win 65093 (DF)
15:24:37.595737 IP 61.129.59.81.6661 > 192.168.27.100.1207: P 121369:121861(492) ack 9499 win 6432 (DF)
15:24:37.597680 IP 192.168.27.100.1207 > 61.129.59.81.6661: P 9499:9518(19) ack 121861 win 64601 (DF)
15:24:38.423346 IP 61.129.59.81.6661 > 192.168.27.100.1207: P 121861:122470(609) ack 9518 win 6432 (DF)
15:24:38.427113 IP 192.168.27.100.1207 > 61.129.59.81.6661: P 9518:9537(19) ack 122470 win 65535 (DF)
15:24:39.101031 IP 61.129.59.81.6661 > 192.168.27.100.1207: P 122470:123023(553) ack 9537 win 6432 (DF)
15:24:39.102094 IP 192.168.27.100.1207 > 61.129.59.81.6661: P 9537:9574(37) ack 123023 win 64982 (DF)
15:24:39.766775 IP 61.129.59.81.6661 > 192.168.27.100.1207: P 123023:123461(438) ack 9574 win 6432 (DF)
15:24:39.817164 IP 192.168.27.100.1207 > 61.129.59.81.6661: P 9574:9593(19) ack 123461 win 64544 (DF)
15:24:40.461272 IP 61.129.59.81.6661 > 192.168.27.100.1207: P 123461:124046(585) ack 9593 win 6432 (DF)
15:24:40.529245 IP 192.168.27.100.1207 > 61.129.59.81.6661: P 9593:9608(15) ack 124046 win 65535 (DF)
15:24:41.237735 IP 61.129.59.81.6661 > 192.168.27.100.1207: P 124046:124709(663) ack 9608 win 6432 (DF)
15:24:41.240581 IP 192.168.27.100.1207 > 61.129.59.81.6661: P 9608:9627(19) ack 124709 win 64872 (DF)
15:24:41.918516 IP 61.129.59.81.6661 > 192.168.27.100.1207: P 124709:125430(721) ack 9627 win 6432 (DF)
15:24:41.919474 IP 192.168.27.100.1207 > 61.129.59.81.6661: P 9627:9646(19) ack 125430 win 64151 (DF)
15:24:42.546953 IP 61.129.59.81.6661 > 192.168.27.100.1207: P 125430:125990(560) ack 9646 win 6432 (DF)
15:24:42.550241 IP 192.168.27.100.1207 > 61.129.59.81.6661: P 9646:9665(19) ack 125990 win 65535 (DF)
15:24:43.167150 IP 61.129.59.81.6661 > 192.168.27.100.1207: P 125990:126505(515) ack 9665 win 6432 (DF)
15:24:43.168268 IP 192.168.27.100.1207 > 61.129.59.81.6661: P 9665:9703(38) ack 126505 win 65020 (DF)
15:24:43.870777 IP 61.129.59.81.6661 > 192.168.27.100.1207: P 126505:127021(516) ack 9703 win 6432 (DF)
15:24:43.873529 IP 192.168.27.100.1207 > 61.129.59.81.6661: P 9703:9722(19) ack 127021 win 64504 (DF)
15:24:44.539102 IP 61.129.59.81.6661 > 192.168.27.100.1207: P 127021:127548(527) ack 9722 win 6432 (DF)
15:24:44.540198 IP 192.168.27.100.1207 > 61.129.59.81.6661: P 9722:9741(19) ack 127548 win 65535 (DF)
15:24:45.254251 IP 61.129.59.81.6661 > 192.168.27.100.1207: P 127548:128084(536) ack 9741 win 6432 (DF)
15:24:45.256578 IP 192.168.27.100.1207 > 61.129.59.81.6661: P 9741:9760(19) ack 128084 win 64999 (DF)
15:24:46.002675 IP 61.129.59.81.6661 > 192.168.27.100.1207: P 128084:128760(676) ack 9760 win 6432 (DF)
15:24:46.003534 IP 192.168.27.100.1207 > 61.129.59.81.6661: P 9760:9809(49) ack 128760 win 64323 (DF)
15:24:46.694023 IP 61.129.59.81.6661 > 192.168.27.100.1207: P 128760:129488(728) ack 9809 win 6432 (DF)
15:24:46.696843 IP 192.168.27.100.1207 > 61.129.59.81.6661: P 9809:9828(19) ack 129488 win 65535 (DF)
15:24:47.397570 IP 61.129.59.81.6661 > 192.168.27.100.1207: P 129488:130187(699) ack 9828 win 6432 (DF)
15:24:47.543373 IP 192.168.27.100.1207 > 61.129.59.81.6661: P 9828:9843(15) ack 130187 win 64836 (DF)
15:24:48.244608 IP 61.129.59.81.6661 > 192.168.27.100.1207: P 130187:130942(755) ack 9843 win 6432 (DF)
15:24:48.248133 IP 192.168.27.100.1207 > 61.129.59.81.6661: P 9843:9857(14) ack 130942 win 64081 (DF)
15:24:48.980590 IP 61.129.59.81.6661 > 192.168.27.100.1207: P 130942:131735(793) ack 9857 win 6432 (DF)
15:24:48.981264 IP 192.168.27.100.1207 > 61.129.59.81.6661: P 9857:9872(15) ack 131735 win 65535 (DF)
15:24:49.700084 IP 61.129.59.81.6661 > 192.168.27.100.1207: P 131735:132411(676) ack 9872 win 6432 (DF)
15:24:49.729301 IP 192.168.27.100.1207 > 61.129.59.81.6661: P 9872:9930(58) ack 132411 win 64859 (DF)
15:24:50.404833 IP 61.129.59.81.6661 > 192.168.27.100.1207: P 132411:133137(726) ack 9930 win 6432 (DF)
15:24:50.406069 IP 192.168.27.100.1207 > 61.129.59.81.6661: P 9930:9945(15) ack 133137 win 64133 (DF)
15:24:51.130472 IP 61.129.59.81.6661 > 192.168.27.100.1207: P 133137:133857(720) ack 9945 win 6432 (DF)
15:24:51.133552 IP 192.168.27.100.1207 > 61.129.59.81.6661: P 9945:9990(45) ack 133857 win 65535 (DF)
15:24:51.834870 IP 61.129.59.81.6661 > 192.168.27.100.1207: P 133857:134696(839) ack 9990 win 6432 (DF)
15:24:51.966224 IP 192.168.27.100.1207 > 61.129.59.81.6661: . ack 134696 win 64696 (DF)
15:24:52.063174 IP 192.168.27.100.1207 > 61.129.59.81.6661: R 1721177698:1721177698(0) win 0 (DF)
15:24:52.742133 IP 61.129.59.81.6661 > 192.168.27.100.1207: P 134696:135428(732) ack 9990 win 6432 (DF)
15:24:53.741857 IP 61.129.59.81.6661 > 192.168.27.100.1207: P 134696:135428(732) ack 9990 win 6432 (DF)
